product_id,review_title,description,author,rating,date,pros,cons,author_profession,author_industry,author_duration
topdesk,Save time with Topdesk,"Overall, I found it helpful in the day to day to cut down on otherwise menial stuff. I like that it’s intuitive once workflows are set up properly.",Ryan P.,5.0,"February 16, 2026","I like it's user-friendly interface, it has a clean and organized dashboard. I think that it's easy for non-technical staff to submit tickets.",One thing that I think really holds it back is the pretty steep learning curve. The initial setup can feel overwhelming.,Lead Designer,Design,Used the software for: Less than 6 months
topdesk,Great system with clean user interface,The consultant we worked with on implementation was really helpful and able to lead us through building the system for a non-standard use case.,Joe K.,4.0,"January 3, 2025",Simple user interface and easy to implement with minimal prior knowledge.,Back end can be a bit clunky and limited in terms of analytics. Best solutions is to push data out to analyse. The options for personalising the self-service portal are somewhat limited.,Head of Technical Operations,Biotechnology,Used the software for: Less than 6 months
topdesk,"Great functionality, UI could do with softening and brightening ","Once you have learned the ropes the experience is great. It is of course far better than having things exist in email threads. As an operator, and manager of other operators, I can easily draw reporting data across how many tickets are closed over a period of time which is awesome. I would highly reccomend top-desk, just make sure you've got someone onboard to train you and show you how it integrates with your people and teams. The more teams who get on board, the better it works!",Will B.,4.0,"February 23, 2026","TOPdesk is a very important tool for managing inquiries and problem solving across a wide range of teams and colleagues. It effectively operates as a ticketing function, allowing a query to move through a chain of different stages and colleagues until it is solved. I like that the system is reliable, feels well structured and maintained. It allows for a great degree of detail and flexibility. On-top of that, it integrates with email platforms such as Outlook.","The downside to the complexity is that it is somewhat unappealing to look at and use. The UI is quite complex and cluttered and feels a bit like you're inside a type-writer to write the letter. Handing over tickets, pressing save and send, forgetting to do it right, can feel anxiety inducing.",University Centre Deputy Director,Education Management,Used the software for: 6-12 months
topdesk,Topdesk is overall good to work with,Its good my overall experience espacially the Change module and the variaty in topdesk,Marciano G.,3.0,"December 14, 2023",I like the Change module in topdesk and the different things that u can do with it,When different people work in the same card,Service manager,Accounting,Used the software for: 1-2 years
topdesk,Topdesk experience in education,Great product! Easy to use. Can be expensive when using many operators.,Jeroen V.,4.0,"September 25, 2024",Flexibilty and ease of use for endusers.,Sometimes to much flexibility and thus complex to manage.,IT and security consultant,Primary/Secondary Education,Used the software for: 1-2 years
topdesk,Best ITSM available ,,David S.,5.0,"December 12, 2023","TOPdesk is very easy to implement. It can come with a best practice set-up if you like. The consultants I worked with were great but with a bit of learning you can do a lot of things yourself aswell. Compared to some competititors (ServiceNow for example) it doesn't feel like they try to bleed you dry with consultancy hours. Also the asset management module is awesome, fully customizable and API based. And although the actions and action sequences are a bit harder to learn, once you master them the options for automating are endless.","No cons yet. Although the reports can be a bit meh, but you can connect to PowerBI or something similar through the OData feed.",CTO,Education Management,Used the software for: 1-2 years
topdesk,TOPdesk: An Extensive ITSM Tool,,Wijnand V.,4.0,"December 12, 2023",Configurability Customizability Support of TOPdesk,No option to give users/clients a way to create their own account to access the SSP,Technical Consultant,Information Technology and Services,Used the software for: 6-12 months
topdesk,TOPdesk as ITSM tool,,Sven M.,5.0,"December 12, 2023","Look and feel, easy to use. Team cooperation",Some features cannot be customized (saas),Cloud Engineer,Information Technology and Services,Used the software for: 2+ years
topdesk,Works all the time,"A great asset to any IT company, as well as any company using servicedesks of more serious IT capacities.",Roy T.,5.0,"April 9, 2025","The ability to modify the UI, the many options of registering booth tickets and assets, as well as contracts and many other aspect.",The design could be considered a bit old fashioned.,Application administrator,"Health, Wellness and Fitness",Used the software for: 2+ years
topdesk,Best work ever did,Nover done this kind of nice work in my life and I did a lot in ICT functions. But daily working with Topdesk is the most great work I ever did. In all parts.,Peter V.,5.0,"December 14, 2023",The way topdesk can let you organize all processes and flows and forms. all issues can be adressed and disturbance is unknown.,In the flow developping is no visual sign appearing when 2 people are working together in the same flow.,Topdesk Administration,Government Administration,Used the software for: 2+ years
topdesk,Customisable incident management,,Fran S.,4.0,"August 27, 2024",Very customisable to suit any purpose so we can create many branching categories for escalation and redirecting requests,Can be a little un wieldy if you have many different categories for end users to find what they need,Technologies Administrator,Retail,Used the software for: 2+ years
topdesk,"Keep up the good work, and keep improving","Overall I have great experiences with Topdesk, like I said the software has a lot of possibilities and the people are kind and very helpfull.",Bjorn H.,5.0,"December 12, 2023",The allround possibilities than other ticketsystemproviders.,Knowledgebase system is decent but can use a lot of improvements. For example paste images into a item.,Applicatiebeheerder,Retail,Used the software for: 2+ years
topdesk,TOPdesk review,,Jindi J.,4.0,"December 14, 2023","User-Friendly Interface, costumTion, Customization automation, SSP, knowledgement system.",Customization Complexity. Overly complex customization requires additional time and resources.,Functioneel beheerder,Government Relations,Used the software for: 2+ years
topdesk,Worth a try and certainly a look,,Sandra V.,5.0,"December 14, 2023",Easy to use and implement. Easy to get support,At the moment I really could not say that,Application Manager,Government Administration,Used the software for: 2+ years
topdesk,Easy to manage,So easy to use and maintain. Also if you contact the TOPdesk service desk there is a very quick response.,Rene W.,5.0,"December 14, 2023",It is easy to make your own environement.,Nothing really! We are very happy with the use of the modules we use.,Service Manager,Accounting,Used the software for: 2+ years
topdesk,TOPdesk review Dec 2023,,Diekus V.,4.0,"December 12, 2023",Overal usability and functionality. Adaptebility,Not able to use ritch text and copy/paste pictures,System Admin,Facilities Services,Used the software for: 2+ years
topdesk,Service excellence experts - supplier as a business partner,TOPdesk are beyond that of a supplier and more a business partner that many other suppliers could learn a lot from. They provide awesome support backed up by knowledgeable staff / consultants who share your desire for service excellence.,Nick B.,5.0,"June 14, 2019",Does what is says on the virtual tin - the modules are well designed and fit for purpose and allow for customisation's when rarely needed. The software can grow with your own needs as and when needed making it a great return on investment and is not limited to 'just a insert team name here' system allowing for integrated processes and oversight end-to-end. The expansion into allowing microservices to bolt onto TOPdesk via the marketplace only add more value.,"Its very minor but being able to save a complex form component - it would be great to save a small number (3 max) of complex built form components that can be re-used on other forms rather than having to rebuild it each time its used. e.g. long drop downs just for speed, consistency and efficiency.",Systems Manager,Government Administration,Used the software for: 1-2 years
topdesk,Let the great team of TOPdesk help make your life easier,,Stephanie J.,5.0,"May 7, 2019","It's very easy to tweak the software to make it work in line with your current processes. It helps shape them so everyone can easily follow guidance and procedures. We currently use Incident, Problem, Change and Operations Management successfully and are very excited about continuing to improve our processes with such a knowledgeable partner at our side. Our audit rating and maturity levels continue to get better and better as a consequence as well.","Of course there are times that we'd like to do something that the software isn't quite capable of doing yet, but the labs team is constantly looking at new trends and often there is already something in development. If that is not the case the consultants are great in helping us develop workarounds.",IT Compliance Manager,Packaging and Containers,Used the software for: 2+ years
topdesk,Success with self-service,"TOPdesk are an excellent company to work with, very responsive and helpful. You are made to feel like part of the wider team. We feel we get excellent value for money with this product.",Caroline F.,5.0,"July 9, 2019","It's so easy to customise and configure. Using this product we have developed a self-service portal showcasing multiple services from various departments, not just IT services. TOPdesk has made it possible to streamline our service provision, and automate some of the call management. Our self-service portal is regularly achieving over 75% entry.",It's difficult to find something I don't like but maybe I would like to have more text formatting tools.,Service Desk Manager,Higher Education,Used the software for: 2+ years
topdesk,TopDesk review,,Frederik Kalb N.,4.0,"March 9, 2022",Easy to use and gets you a clear overview over support cases.,"Some missing features, such as being able to easily assign several cases to a specific supporter/agent at once.",IT Supporter,Logistics and Supply Chain,Used the software for: 2+ years
topdesk,"Basic work easy, reporting a little difficult",,John L.,4.0,"September 8, 2022",The creation of tickets and the overal feel of topdesk isn't too difficult. Also the automatic importing of mails is a nice feature,reporting is a bit difficult at times and you don't always know what categories to include,System Engineer,Construction,Used the software for: 1-2 years
topdesk,Moving from a locally hosted version to SaaS was the best decision we made. ,,Andrew C.,4.0,"November 1, 2017","TOPdesk provides a simple tool for Service Management provided your organisation has good processes in place ... or even some processes!! For Operators it is easy to use and the KB is excellent. For end users the SSP is superb, delivering an intranet style webspace whilst easing the role of Service Desk Operators.",HTML in emails!! Pleased to say that this is something that TOPdesk appear to be addressing. The lack of customisation for operators is frustrating,Service Management Analyst,Used the software for: 2+ years,
topdesk,Good basic IT ticketing system,"It is probably best suited for smaller companies without a need to advanced routing. TOPdesk looks to be continuing to develop more modules. It would be helpful to see more focus on optimizing the core application, including a mobile app to make it even easier for employees to log trouble tickets when they need to.",Sandy K.,4.0,"April 11, 2022",The ticketing application was relatively quick to set up and deploy. It is easy to use by employees. It allowed employees to log trouble tickets via a button on our intranet rather than needing to remember a different application to visit.,The application is not flexible in terms of setting up workflows. There is a change management feature that seems underdeveloped and did not prove value-added to deploy.,Senior Manager,Chemicals,Used the software for: 1-2 years
topdesk,Easy call management!,Helping users 'self-solve'. Tracking incidents and requests. Managing estates / assets.,Rory M.,5.0,"October 31, 2018",Simple and clear call management. Flexible and highly customisable asset management and SSP.,Some settings are buried deep within the menu structures - can make it tricky to locate the one you need.,Second Line Support Technician,Higher Education,Used the software for: 2+ years
topdesk,TopDesk Review,The ability to manage two separate departments under one helpdesk system. TopDesk has allowed us to easily create a two department structure for managing work load and has also helped in the developed of Trust wide projects.,Alex B.,5.0,"February 27, 2019",Easy to use Tabbed cards allowing you to work on multiple tickets at one time Clear module structure and interfaces Ability to link different cards under one module,No 24hr clock when regional setting is set to GMT Linking two calls together auto generates a major call which is not always suitable,Infrastructure Engineering Manager,Education Management,Used the software for: Less than 6 months
