product_id,review_title,description,author,rating,date,pros,cons,author_profession,author_industry,author_duration
stardog,represents better performance at work,I had a better prepared performance with faster and more accurate delivery results,Anthony R.,5.0,"February 9, 2024",It is a very modern platform that through graphics allows to understand each data in a more understandable and effective way and even more so when data is unified that shows the most important and is easier to understand,"the platform is complex to learn to use, its learning time is long and a bit confusing at first",finance and international business,Food & Beverages,Used the software for: 2+ years
stardog," Stable, performant, well-featured, well-documented, has a great ecosystem","Very positive. It's stable, performant, well-featured, well-documented, has a great ecosystem. The dev team is responsive to feature requests & fixes.",Conrad L.,5.0,"November 9, 2020","Very fully featured, and constantly evolving. Produced by a knowledgeable and professional team.",Enterprise license is expensive; if you don't use all the Stardog-specific features then Amazon's hosted Neptune service might be better value.,Senior Bioinformatician,Research,Used the software for: 2+ years
stardog,Stardog based triplestore service,,Aarno A.,5.0,"October 30, 2020",Stardog fulfilled all requirements for VSHN to build a Triplestore-as-a-Service offering,Service provider requirements differ from regular enterprise customers,CTO & Partner,Internet,Used the software for: 1-2 years
stardog,Future looking knowledge store,Combining of standard semantic graph capabilities with well selected features outside of standard creates perfect environment for the delivering of future looking artificial intelligence applications in the enterprise environment.,Vladimir M.,5.0,"November 2, 2020","Integration of analytical capabilities with the graph store, visual studio for the developer productivity, virtualization of data and data integration capabilities","Need a cloud product offer, which I hope coming soon",Data Scientist,Telecommunications,Used the software for: 2+ years
stardog,review about Stardog,navigate through the data to have a better interpretation of them and learn to analyze them from another perspective,Thomas C.,5.0,"April 4, 2024","It has been a platform with a powerful data integration structure with easy installation, the database can be viewed in a more analytical way, improving the knowledge that can be had about this data.","the learning curve is a bit complex because it is not a basic knowledge platform, you must have extensive knowledge of this type of platform to know how to use it correctly",civil engineer,Plastics,Used the software for: 2+ years
stardog,"Stardog, the intelligent NoSQL Database, with a power schema, and a great integration platform","At 3 different clients, I have participated in the creation of different solutions as: (1) CMDB application including management of configuration items and impact analysis in case of failure. (2) Integration of external market data with internal sources, including Master Data Management of Organizations. (3) Real estate transactions analysis using spatial functions (4) Human resource profiles access using full text search (5) Human resource competency management (6) Branch search using spatial functions",Daniel L.,5.0,"November 8, 2020","As a RDF NoSQL database, Stardog is the best of both worlds: flexible as a NoSQL DB but with a powerful schema. Also, the product is a complete integration platform as it enables, not only virtually accessing other SQL and NoSQL databases, but also the integration of unstructured information. The fact that text search and spatial functions are also provided completes Stardog's abilities as a full integration platform.","As a newer DBMS, Stardog will still need investment in the areas of database management and monitoring to make it easier to deploy, maintain and support.",Senior Consultant,Information Technology and Services,Used the software for: 2+ years
stardog,Stardog a triplestore and more,"Support is a place where Stardog shines. It felt more like a partner relationship rather than a client / vendor one. For example, when we required the PATH operator and GRAPHQL support which Stardog did not support at the time, we work with them to defined and/or test the features which were release in months of requesting it.",Serge C.,5.0,"November 18, 2020",Stardog «PATH» operator allows us to do path traversal queries which would have been very difficult otherwise. A close second are the virtual graph capabilities and the simplification of R2RML via SMS2.,"Stardog is easy to deploy for simple installation, but cluster management and monitoring is rudimentary at best.",Senior Information and Solution Architect,Information Technology and Services,Used the software for: 2+ years
