product_id,review_title,description,author,rating,date,pros,cons,author_profession,author_industry,author_duration
captivateiq,Highly capable and scalable commission platform,"We were taking 1-2 weeks to finalize commissions before trying to implement Xactly SimplyComp. CIQ helps us solve for faster calculations (1-2 days turnaround), as well as quick ASC606-compliant JEs for the accounting team.",Kevin H.,5.0,"June 7, 2021","CaptivateIQ is based on Excel formulas and logic. If you know how to model your commission structure in Excel, you'll feel at home in CaptivateIQ. When you run calculations on a monthly basis, they will take a couple minutes only. Due to the flexibility of the platform, ""anything is possible"" in terms of accommodating complex plans. The Implementation and CS teams have all been top notch, and willing to help.","The flexibility of the software can be a double-edged sword at times. There are a hundred ways to do everything, and just like a complex excel model, there will be unforeseen challenges that arise from time to time. As a fairly young company with fairly new people handling your implementation, the quality of your implementation may vary from person to person. The ""white glove"" implementation is worth it unless you have very simple comp plans.",Finance Manager,Information Technology and Services,Used the software for: 1-2 years
captivateiq,Incredible,"My overall experience with CaptivateIQ has been very positive. The platform makes it much easier to manage commissions by automating calculations that would otherwise take significant manual effort. The user interface is intuitive, and once you get familiar with the layout, it becomes very simple to navigate through plans, statements, and payout details. I especially appreciate the transparency CaptivateIQ provides — I can clearly see how each commission amount is calculated, track adjustments, and compare month-over-month performance without needing to request data from finance. Notifications and reminders also help keep payout timelines consistent. Overall, CaptivateIQ has improved accuracy, reduced manual work, and created a fair and visible commission process for everyone involved.",Harsh K.,5.0,"November 25, 2025","What I liked most about CaptivateIQ is the level of transparency and clarity it brings to the commission process. Being able to see the exact breakdown of how each payout was calculated — including deals, quotas, accelerators, adjustments, and attainment progress — removes uncertainty and eliminates the need to chase finance for updates. The platform also provides real-time visibility, which helps with planning and motivation throughout the month. Notifications and monthly summaries are very helpful, and the interface makes it easy to compare payouts across periods. Overall, CaptivateIQ empowers sales teams with confidence, accuracy, and control over their commission information.","Although CaptivateIQ is a strong platform, there are a few areas that could be improved. The learning curve can be fairly steep in the beginning, especially when trying to understand how plans are structured and how each calculation rule impacts payouts. Sometimes the interface feels a bit complex, and it can take time to locate specific details or historical adjustments. In addition, when commission plans change mid-year, updates aren’t always reflected immediately, which can create temporary confusion. Reports and dashboards could also be more customizable. Overall, while the system works well, simplifying usability and speeding up data updates would make the experience significantly better.",SR. BDR,Information Technology and Services,Used the software for: Less than 6 months
captivateiq,Captivate Review of Information,I really have no use for it if it isn't going to share what/why we are being paid and explanations as to what we are being paid for.,Rita W.,2.0,"November 25, 2025",Captivate is easy to login to. It is hard to list a lot of things I like when the information entered is not enough,"It may not be a Captivate IQ issue, may be a BD issue. There is no information within Captivate that allows us to understand how we are paid and what we are paid for. It is way to vague",Micro Instrument Specialist,Capital Markets,Used the software for: Less than 6 months
captivateiq,The most optimal product for anything commissions related.,In my opinion Captivate is a perfect compromise between the efficiency of ERP system which is very effective but takes team of consultants to implement a simple change and the flexibility of Excel spreadsheet. It's a perfect tool for commissions team to handle everything commissions related and report on it.,Andrzej S.,5.0,"December 5, 2025",Mainly how easy it is to implement and learn plus the flexibility it offers. Pair that with speed and efficiency of the system that also helps with planning/simulation and it's honestly the best commissions product I've used in my entire career. The ease of implementing even the most complex plans allows you to keep everything in one place and therefore track spending and performance. It is also extremely easy to use for the end users and when you get stuck you can count on instant support from their team. I would definitely recommend this product.,"It's not so much the product's fault but the great flexibility it offers can turn against you if your organisation is not careful with plan design. Sometimes it would be easier to just be able to say 'no, this can't be done in our system' to some of the exotic, one off requests.",Commissions Advisor,Computer Software,Used the software for: 2+ years
captivateiq,Easy to use tool,"I have used CapitivateIQ for several years across multiple organizations and it has been consistent with use and ability to track commissions. In general, I have very positive sentiment towards the tool and find that I would recommend it to my colleagues or companies that I work for in the future.",Brittany B.,4.0,"November 25, 2025",It is very easy to use and the click paths to accomplish what I need in the tool are limited. The tool also gives me access to historical commission information that is very helpful for me to understand how I am performing against my plan.,There aren't any specific cons that come to mind with the tool. It accomplishes everything that I need.,Account Manager,Computer Software,Used the software for: 2+ years
captivateiq,Wonderful Change,Overall experience is a breath of fresh air. It is honestly everything I’ve been looking for when it comes to business tracking.,John G.,5.0,"November 26, 2025",The difference of using CIQ compared to our prior platform is night and day different. Extremely easy to learn and quite customizable.,There is not much I don’t like about CIQ. It genuinely is a night and day difference from an awful system we previously used.,Financial Advisor,Investment Management,Used the software for: 6-12 months
captivateiq,Does what it says it will,So far so good. I like it based on everything I have written above. It works well with our process and helps me see what my expected payouts will be. No real learning curve,Jon F.,5.0,"December 1, 2025",I like being able to see my commission numbers easily and understand my payouts including percentages.,it does what it needs so nothing on my side as a rep that I find issues with. I feel that it updates timely and does what It says it will.,Account Executive,Financial Services,Used the software for: 1-2 years
captivateiq,Great use of money,,Nathaniel C.,5.0,"December 8, 2025","CaptivateIQ has been a strong addition to our revenue operations process. The platform makes compensation modeling clear and flexible, which helps our sales team understand exactly how their payouts are calculated. The reporting is reliable, the interface is easy to navigate, and changes can be tested without risk. Our finance and sales leaders both appreciate how quickly we can adjust plans as the business evolves. Support has also been responsive and helpful. Overall, CaptivateIQ has improved transparency, reduced manual work, and given us confidence that our compensation plans are accurate and aligned with our goals.","The platform has been effective, but there are a few areas that took time to learn. Initial setup required careful attention to detail and coordination between sales operations and finance. More complex compensation plans sometimes need extra configuration to get the results we expect. While documentation is solid, a few sections could be clearer for new users. Once everything is in place the system runs smoothly, but the early ramp can be slower than expected. These points aside, CaptivateIQ has still been a valuable tool and the ongoing experience has remained positive.",Account Executive,Computer Software,Used the software for: 6-12 months
captivateiq,Best platform ever!,Overall its the best commissions/rev platform. I love how easy it is to use and how user friendly it is!,Connor M.,5.0,"December 1, 2025",I love how easy it is to track my months progress. I know where I can improve in each area to improve my paycheck.,Its been showing a few error codes the last few weeks but its not that big of a deal. I love everything else about it.,Account Executive,Banking,Used the software for: 6-12 months
captivateiq,Streamlining Commissions with Ease and Transparency,"My overall experience with CaptivateIQ has been very positive. The platform is intuitive, reliable, and has significantly streamlined our commission management process. It saves time, reduces errors, and provides both admins and reps with transparency into earnings. While setup for complex plans can take some effort, the benefits far outweigh the initial learning curve.",Matthew K.,5.0,"November 25, 2025","CaptivateIQ is incredibly intuitive and dramatically reduces the time it takes to manage commissions. The platform gives full visibility into calculations, makes adjustments simple, and eliminates a lot of manual spreadsheet work. Their workflows feel thoughtfully designed, and the transparency it provides to both admins and reps is a major win.","There’s a bit of a learning curve when setting up more complex plans, and some customizations require support or additional time to configure. The platform is powerful, but getting everything tailored exactly the way you want can take some upfront effort.",Sales Development Representative,Human Resources,Used the software for: 6-12 months
captivateiq,Itemizes all commision payouts,It's fairly new and we keep working out the bugs of accuracies,Brandon M.,4.0,"October 29, 2024",Gives you an itemized layout of your commision breaddown.,Between approvals and payday there isn't enough time for errors.,Account Executive,Transportation/Trucking/Railroad,Used the software for: Less than 6 months
captivateiq,Solution Engineer,,Sachidananda G.,4.0,"November 27, 2025","The information should be effortlessly accessible and easy to reference whenever needed, ensuring users can quickly find and utilize the required details without any difficulty.","By reducing the number of tabs, we can significantly improve the overall look, feel, and clarity of the information presented.",sales egineer,Computer & Network Security,Used the software for: 1-2 years
captivateiq,Good platform,,Gonzalo W.,4.0,"November 26, 2025",Transparency and simple UX. Easy to digest information and ways to also track payment. Forecast is also good.,Could allow for better data visualization as well as more ability to attach documentation that explains compensation.,Account Executive,Information Technology and Services,Used the software for: 1-2 years
captivateiq,Definitely recommend CaptivateIQ,It's a great tool I would highly recommend it for commission calculations.,Jackson B.,5.0,"October 31, 2024",It's easy to use and you can raise requests directly within the application.,that sometimes it doesn't load quickly and data isn't pulling right away.,Commercial Account Director,Information Technology and Services,Used the software for: 2+ years
captivateiq,Great product that makes life awesome,,Juliette C.,5.0,"December 1, 2025","Love it Absolutely love this product — it’s reliable, easy to use, and makes life so much easier great","Nothing, I liked it I’ve used this product and can confirm there are no issues — it works perfectly yes",Recruiter,Airlines/Aviation,Used the software for: Less than 6 months
captivateiq,"Michael, Nov review. ","I've only been using it for 3 months, as I've recently joined Ramp, but I am enjoying it.",Michael B.,5.0,"November 7, 2024",I love the clear and concise display of my payouts with the deal information attached.,I would like to see future *potential payouts* to understand how my performance may effect my next paycheck.,Account Executive,Financial Services,Used the software for: Less than 6 months
captivateiq,Pleased with QiQ,"Solid , I really like the specifics details that it shows",Robert G.,5.0,"October 29, 2024",The details on payouts is good and the metrics are good,Having to log into it each time externally from websites,Regional manager,Retail,Used the software for: 6-12 months
captivateiq,Account Executive,overall have had no issues with the softare,Jeffrey R.,4.0,"October 29, 2024",How easy it is see the dollar amount break out of each deal,It would be nice to see the current payout for the next month instead of having to click preview,AE,Information Technology and Services,Used the software for: 2+ years
captivateiq,Easy to use & find info,Very good -- I was new to this tool coming into my new company a couple years ago and have loved the easy access to my commission data,Blake H.,5.0,"October 29, 2024",It's simple and intuitive -- super easy to find exactly what you're looking for,My only complaint is sometimes the load times are extensive,AE,Internet,Used the software for: 1-2 years
captivateiq,Great Payout Tracker,,Janice F.,5.0,"October 29, 2024",it updates frequently and I can keep track of what my payout would be,sometimes it isn't accurate the whole time,AE,Financial Services,Used the software for: 1-2 years
captivateiq,Making Payout Tracking Simple,Happy with CaptivateIQ. Works well and provides me with detailed info.,Will A.,5.0,"November 14, 2024","Easily Readable, sortable, exportable to manage and track commission statements.",In the payout it lists all line items including previous months. I would like to be able to seperate without having to do it my self when exporting.,Sr. Partner Business Manager,Computer Software,Used the software for: 2+ years
captivateiq,great experience ,"very good and efficient, simple and practic and easy to use",eyad D.,5.0,"November 18, 2024",simplicity and ease of use and the clarity of information,captivateIQ works just fine and there is nothing I didn't like,Junior Cloud Advisor,Computer & Network Security,Used the software for: 2+ years
captivateiq,CaptivateIQ Review | Carta employee,,Jazalyn C.,5.0,"October 29, 2024",I like the interface and transparency there is to my information.,Maybe smaller font for the numbers on the main screen so nobody looks behind you ..,Sales Development Representative,Financial Services,Used the software for: 6-12 months
captivateiq,Racks the boss,,Monique H.,3.0,"November 8, 2024",My pay when it’s accurate and I don’t have to worry,My pay not being correct a lot of times its frustrating,Sales rep,Utilities,Used the software for: 6-12 months
captivateiq,Ease of use!,Very pleasant product experience. Simple/intuitive to navigate and learn.,Maddie M.,5.0,"November 5, 2024","I love how easy it is to navigate the tool. Without any training, I'm able to bounce around and view different aspects of the reporting available.","N/A... however maybe it would be beneficial to work with company's revenue teams to build in a paycheck calculator to take other things into consideration like accelerators, addtl kickers, etc.",Regional Sales Manager,Computer Software,Used the software for: 6-12 months
