product_index,software_category,product_id,name,url,rating,reviews_count,description
1,Generative AI,zoom_workplace,Zoom Workplace,https://www.capterra.com/p/144037/Zoom-Video-Conferencing,4.6,14561,"With Team Chat, Phone, AI Companion, and more, Zoom Workplace is the platform for your best work. Learn more about Zoom Workplace"
2,Generative AI,adobe_creative_cloud,Adobe Creative Cloud,https://www.capterra.com/p/48969/Adobe-Creative-Cloud,4.7,7334,"Adobe Creative Cloud is a suite of creative software and services including design, photography, video, and web development tools. Learn more about Adobe Creative Cloud"
3,Generative AI,grammarly_business,Grammarly Business,https://www.capterra.com/p/170306/Grammarly-Business,4.7,7207,"Grammarly is the AI writing partner that helps people at every stage of the writing process, from blank page to final draft. Learn more about Grammarly Business"
4,Generative AI,writesonic,Writesonic,https://www.capterra.com/p/219972/Writesonic,4.8,2102,Writesonic is an AI-powered writing assistant with a mission to empower everyone in the world to write anything and publish anywhere. Learn more about Writesonic
5,Generative AI,jasper,Jasper,https://www.capterra.com/p/217242/Jasper,4.8,1855,AI writing assistant that breaks through writer's block and saves hours every week writing copy. Learn more about Jasper
6,Generative AI,adobe_express,Adobe Express,https://www.capterra.com/p/174232/adobe-express,4.6,1229,"Collaboration and graphic design solution that enables users to create social media content, videos, and logos on a unified interface. Learn more about Adobe Express"
7,Generative AI,talkdesk,Talkdesk,https://www.capterra.com/p/132852/Talkdesk,4.5,733,"Talkdesk is intuitive, cloud-based contact center software with advanced features, comprehensive reporting and seamless integrations. Learn more about Talkdesk"
8,Generative AI,blaze,Blaze,https://www.capterra.com/p/10013921/Blaze,4.8,719,AI that does marketing for you Learn more about Blaze
9,Generative AI,honeybook,HoneyBook,https://www.capterra.com/p/162588/HoneyBook,4.7,679,"HoneyBook is a client management software that helps small businesses handle proposals, contracts, invoices, payments, and projects. Learn more about HoneyBook"
10,Generative AI,prowritingaid,ProWritingAid,https://www.capterra.com/p/170745/ProWritingAid,4.7,497,"Grammar checking, style improvement, and terminology management software to ensure that your writing is always of the highest quality. Learn more about ProWritingAid"
11,Generative AI,1min_ai,1min.AI,https://www.capterra.com/p/10020011/1min-AI,4.7,470,🔮 1min.AI is an all-in-one AI app that offers a variety of AI features powered by various AI models Learn more about 1min.AI
12,Generative AI,surfer,Surfer,https://www.capterra.com/p/218703/Surfer,4.9,421,"Surfer is the all-in-one platform for AI Search Optimization. Show up on Google, in AI answers & beyond. Learn more about Surfer"
13,Generative AI,invideo,invideo,https://www.capterra.com/p/180680/InVideo,4.5,409,"At invideo, our mission is to re-invent video creation and make it accessible to the world ultimately. Learn more about invideo"
14,Generative AI,anyword,Anyword,https://www.capterra.com/p/229878/Anyword,4.8,391,"Generative AI for Performance Writing platform that empowers marketers to create scalable, on-brand content that converts! Learn more about Anyword"
15,Generative AI,texta_ai,Texta.ai,https://www.capterra.com/p/240296/Textaai,4.6,346,Get Professional Level Blog Articles in Seconds. Market leading Long content AI copywriting tool. Learn more about Texta.ai
16,Generative AI,fliki,Fliki,https://www.capterra.com/p/246351/Fliki,4.7,345,Fliki is a Text to Speech & Text to Video converter that helps you create audio and video content using AI voices in less than a minute Learn more about Fliki
17,Generative AI,chatgpt,ChatGPT,https://www.capterra.com/p/10009334/ChatGPT,4.4,343,ChatGPT is a natural language processing tool that leverages AI functionality and helps users converse with chatbots like humans. Learn more about ChatGPT
18,Generative AI,synthesia,Synthesia,https://www.capterra.com/p/198045/Enact,4.6,313,Synthesia is the world's first AI video communications platform - in a browser. Learn more about Synthesia
19,Generative AI,heygen,HeyGen,https://www.capterra.com/p/10015133/HeyGen,4.7,309,HeyGen is a cloud-based video creation tool that allows you to easily create professional-quality videos. Learn more about HeyGen
20,Generative AI,simplified,Simplified,https://www.capterra.com/p/237334/Simplified,4.7,304,"Create stunning designs, videos, and write copy using our ai copywriter tool. Learn more about Simplified"
21,Generative AI,vcita,vcita,https://www.capterra.com/p/142264/Appointment-Scheduling,4.5,291,"Manage & grow your business with one app that does It all. Goodbye endless phone calls, so-long paperwork, hello client loyalty! Learn more about vcita"
22,Generative AI,textcortex_ai,TextCortex AI,https://www.capterra.com/p/236373/TextCortex-AI,4.7,236,TextCortex is designed to meet the specific needs of your enterprise through customized content creation and secure data integration. Learn more about TextCortex AI
23,Generative AI,uizard,Uizard,https://www.capterra.com/p/170822/Uizard,4.6,193,Boost your productivity. Design at lightning speed. Collaborate in real-time. Take control of the design process like never before. Learn more about Uizard
24,Generative AI,neuroflash,neuroflash,https://www.capterra.com/p/207149/Neuro-Flash,4.8,184,neuroflash’s AI powered marketing copy creation software helps marketing teams create short- and long-form copy much faster. Learn more about neuroflash
25,Generative AI,fusebase,Fusebase,https://www.capterra.com/p/147496/Nimbus-Note,4.7,176,"Generative AI workspaces to create content, automate workflows, and accelerate business processes—adapted for your team’s needs. Learn more about Fusebase"
26,Generative AI,adcreative_ai,AdCreative.ai,https://www.capterra.com/p/253052/AdCreativeai,3.3,167,AI-powered ad creation for high-converting creatives. No design skills are needed—just results. Start generating ads today! Learn more about AdCreative.ai
27,Generative AI,pictory,Pictory,https://www.capterra.com/p/229347/Pictory,4.8,163,"Pictory is an AI solution that transforms long content such as blogs, webinars, & white papers into dozens of short social videos. Learn more about Pictory"
28,Generative AI,replit,Replit,https://www.capterra.com/p/10011212/Replit,4.4,156,"Replit turns your ideas into apps, fast. With Replit's Agent and Assistant, create apps from natural language and launch. Learn more about Replit"
29,Generative AI,contents_ai,contents.ai,https://www.capterra.com/p/10002114/contentsai,4.6,154,Supercharge your creativity with Contents.ai Genarative AI Platform and generate original content across all your marketing channels. Learn more about contents.ai
30,Generative AI,flexclip,FlexClip,https://www.capterra.com/p/234132/FlexClip,4.5,133,FlexClip is a user-friendly and intuitive online video editing platform that empowers users to create stunning videos effortlessly. Learn more about FlexClip
31,Generative AI,copilot_ai,CoPilot AI,https://www.capterra.com/p/185258/CoPilot-Prospecting-Dashboard,4.5,119,"An AI-powered sales enablement tool that find quality LinkedIn leads, engage them with smart messaging, and drive more booked meetings. Learn more about CoPilot AI"
32,Generative AI,b12,B12,https://www.capterra.com/p/172544/B12,4.1,113,"Attract, win, and serve your clients online with a modern, all-in-one professional website by B12. Learn more about B12"
33,Generative AI,virbo,Virbo,https://www.capterra.com/p/10014640/Virbo,4.9,105,Virbo harnesses the potential of artificial intelligence to generate high-quality videos using customizable avatars and voices. Learn more about Virbo
34,Generative AI,eloomi,eloomi,https://www.capterra.com/p/150609/eloomi,4.4,95,"eloomi is an LMS that helps organizations train, develop, and engage employees with comprehensive learning and development tools. Learn more about eloomi"
35,Generative AI,coursebox,Coursebox,https://www.capterra.com/p/276074/Coursebox,4.7,94,Coursebox is an AI-powered training course creation tool. It helps training providers rapidly develop engaging training courses! Learn more about Coursebox
36,Generative AI,plytix,Plytix,https://www.capterra.com/p/149113/Plytix-PIM,4.7,93,"AI built for product content. Generate, update, and optimize products and images in bulk from the content you already have. Learn more about Plytix"
37,Generative AI,quantive_strategyai,Quantive StrategyAI,https://www.capterra.com/p/156365/Gtmhub,4.7,90,Quantive helps organizations modernize outdated approaches to strategic decision-making and execution to achieve strategic agility. Learn more about Quantive StrategyAI
38,Generative AI,hubspot_content_hub,HubSpot Content Hub,https://www.capterra.com/p/201318/HubSpot-CMS,4.6,89,CMS Hub is a web content management system that gives teams all the tools needed to build digital experiences that customers will love. Learn more about HubSpot Content Hub
39,Generative AI,feedhive,FeedHive,https://www.capterra.com/p/240356/FeedHive,4.9,85,"FeedHive software enables users to create, schedule, analyze, and collaborate on content across networks with AI tools. Learn more about FeedHive"
40,Generative AI,beautiful_ai,Beautiful.ai,https://www.capterra.com/p/171959/Beautiful-AI,4.2,85,Beautiful.ai is presentation software that makes it easy and fast for anyone to create beautiful presentations. Learn more about Beautiful.ai
41,Generative AI,nightcafe,NightCafe,https://www.capterra.com/p/255557/NightCafe,4.7,83,NightCafe Creator is an AI Art Generator app with multiple methods of AI art generation. Learn more about NightCafe
42,Generative AI,seo_writing,SEO WRITING,https://www.capterra.com/p/10017894/SEOWRITING-AI,4.8,78,"SEO WRITING simplifies blogging with 1-Click article generation, bulk options, and SEO tools, ensuring quality content effortlessly. Learn more about SEO WRITING"
43,Generative AI,sked_social,Sked Social,https://www.capterra.com/p/210659/Sked-Social,4.4,77,"The social media management platform with AI-optimized tools, visual planner, unlimited collaboration and seamless approvals workflow. Learn more about Sked Social"
44,Generative AI,koala_ai,Koala AI,https://www.capterra.com/p/10011831/Koala-AI,4.5,70,Create high-quality SEO-optimized articles in minutes. Learn more about Koala AI
45,Generative AI,goskills,GoSkills,https://www.capterra.com/p/155254/GoSkills,4.8,68,GoSkills equips organizations with a robust LMS and AI-powered LXP to create and manage personalized and engaging learning experiences. Learn more about GoSkills
46,Generative AI,copy_ai,Copy.ai,https://www.capterra.com/p/236813/CopyAI,4.4,67,"Copy.ai is the first Go-to-Market AI Platform that can codify best practices, unify data, connect teams, and eliminate GTM bloat. Learn more about Copy.ai"
47,Generative AI,gemini,Gemini,https://www.capterra.com/p/10020130/Gemini,4.6,60,"Gemini is an AI chatbot software from Google that assists users with writing, planning, learning, and more tasks. Learn more about Gemini"
48,Generative AI,onetake_ai,OneTake AI,https://www.capterra.com/p/10017052/OneTake-AI,4.7,57,OneTake AI is an autonomous AI video editor that enables users to turn raw footage into professional presentations in a single click. Learn more about OneTake AI
49,Generative AI,lovo,LOVO,https://www.capterra.com/p/211776/LOVO,4.5,57,"LOVO is a Content Creation Platform for marketing, corporate training, elearning & entertainment, powered by Generative AI & Voice Tech Learn more about LOVO"
50,Generative AI,memoq_tms,memoQ TMS,https://www.capterra.com/p/162762/memoQ,4.6,55,Boost translation quality with memoQ AGT: •Immediate Domain Adaption •Maximum AI Potential •Cost Saving •Full Data Protection Learn more about memoQ TMS
51,Generative AI,longshot_ai,LongShot AI,https://www.capterra.com/p/240382/LongShot-AI,4.5,51,"LongShot AI is an AI writing assistant designed to generate high-quality, fact-checked blogs loved by humans and search engines alike. Learn more about LongShot AI"
52,Generative AI,mailmaestro,MailMaestro,https://www.capterra.com/p/10006437/MailMaestro,4.3,51,MailMaestro is your AI email assistant on Outlook and Gmail that helps you achieve inbox zero much faster with AI. Learn more about MailMaestro
53,Generative AI,sloyd,Sloyd,https://www.capterra.com/p/10015811/Sloyd,4.2,47,"AI generation of 'game ready' 3D models, in real-time. Learn more about Sloyd"
54,Generative AI,github_copilot,GitHub Copilot,https://www.capterra.com/p/10011215/Copilot,4.6,44,"Copilot uses advanced AI algorithms to suggest code and entire functions to users in real-time, right from their editor. Learn more about GitHub Copilot"
55,Generative AI,skai,Skai,https://www.capterra.com/p/138608/Kenshoo-Search,4.3,42,"Skai is an omnichannel advertising platform, uniquely focused on walled garden media. Learn more about Skai"
56,Generative AI,singlestore,SingleStore,https://www.capterra.com/p/143032/MemSQL,4.5,39,"SingleStoreDB combines transactional, analytical, & vector data workloads in a real-time, unified, distributed SQL database. Learn more about SingleStore"
57,Generative AI,socialbee,SocialBee,https://www.capterra.com/p/210359/SocialBee,4.4,39,SocialBee is a social media management tool that empowers its users to share content across multiple social networks from one place. Learn more about SocialBee
58,Generative AI,yellow_ai,yellow.ai,https://www.capterra.com/p/194013/Yellow-Messenger,4.5,37,"Yellow.ai empowers enterprises with generative AI customer service automation, serving 1100+ clients in 85+ countries. Learn more about yellow.ai"
59,Generative AI,claude,Claude,https://www.capterra.com/p/10011218/Claude,4.3,35,"Anthropic's flagship product is Claude, an advanced AI assistant designed to handle tasks of any scale. Learn more about Claude"
60,Generative AI,sunoh,Sunoh,https://www.capterra.com/p/10016372/Sunoh,4.1,35,"Powered by AI and voice recognition technology, Sunoh.ai generates clinical documentation from patient-provider conversations. Learn more about Sunoh"
61,Generative AI,breeze,Breeze,https://www.capterra.com/p/156024/Clearbit,4.5,34,"Cloud-based lead management solution that helps businesses track website visitors, manage campaigns, generate leads, and more. Learn more about Breeze"
62,Generative AI,perplexity,Perplexity,https://www.capterra.com/p/10014721/Perplexity,4.3,33,Perplexity leverages the latest advancements in artificial intelligence and machine learning to provide unparalleled solutions. Learn more about Perplexity
63,Generative AI,ekr_orchestra,EKR Orchestra,https://www.capterra.com/p/202202/EKR-Orchestra,4.1,29,"Binds the technology of EKR PIM and the EKR Orchestra method to support R&D, marketing, technical documentation, and training offices. Learn more about EKR Orchestra"
64,Generative AI,steve_ai,Steve AI,https://www.capterra.com/p/253410/Steve-AI,4.2,28,Experience the new way of video creation powered by patented AI and GenAI technology. Start with any input types like Text or Audio and Learn more about Steve AI
65,Generative AI,copysmith,Copysmith,https://www.capterra.com/p/214919/Copysmith,4.2,27,"Uses GPT-3 and other generative NLP models to help you draft copy for ads, products, landing pages, blog posts, and more. Learn more about Copysmith"
66,Generative AI,attensi,Attensi,https://www.capterra.com/p/228155/Attensi,4.9,26,Attensi empowers people to master new skills and behaviors. We achieve this by creating game-changing simulation training solutions. Learn more about Attensi
67,Generative AI,genie_ai,Genie AI,https://www.capterra.com/p/10003121/Genie-AI,4.5,26,"Genie AI is your legal assistant -draft, review, and negotiate contracts faster with AI. Save time, cut costs, and close deals quicker. Learn more about Genie AI"
68,Generative AI,boost_ai,Boost.AI,https://www.capterra.com/p/184561/Boost-AI,4.8,23,"boost.ai is an industry leader in AI-powered customer experiences, trusted by enterprises worldwide. Learn more about Boost.AI"
69,Generative AI,cognigy_ai,Cognigy.AI,https://www.capterra.com/p/176610/Cognigy-AI,4.8,22,"NiCE Cognigy delivers Agentic AI for enterprise contact centers to deliver instant, multilingual, hyper-personalized customer service. Learn more about Cognigy.AI"
70,Generative AI,gathr,Gathr,https://www.capterra.com/p/240768/Gathr,4.8,22,"Gathr.ai helps enterprises rapidly deliver production-ready data and AI products, with ease, scale and confidence. Learn more about Gathr"
71,Generative AI,akool,Akool,https://www.capterra.com/p/10013539/Akool,5.0,21,"AKOOL is a Generative AI platform for creating personalized visual marketing content, offering AI videos, cost savings, and security. Learn more about Akool"
72,Generative AI,mini_course_generator,Mini Course Generator,https://www.capterra.com/p/238683/Mini-Course-Generator,4.7,21,"Mini Course Generator is the fastest, easiest, and simplest way to turn your know-how into a mini-course. Learn more about Mini Course Generator"
73,Generative AI,elevenlabs,ElevenLabs,https://www.capterra.com/p/10013392/ElevenLabs,4.7,21,"ElevenLabs is a platform that combines generative AI text-to-speech, voice cloning, dubbing, and voice changing all in one place. Learn more about ElevenLabs"
74,Generative AI,tali,Tali,https://www.capterra.com/p/10006853/Tali,4.6,21,"Tali will write your clinical notes, so that you don't have to. Learn more about Tali"
75,Generative AI,synthesys_studio,Synthesys Studio,https://www.capterra.com/p/242212/Synthesys-Studio,4.5,21,"AI-based content generation solution that helps businesses with voice, video, and image generators to automate content creation. Learn more about Synthesys Studio"
76,Generative AI,dall_e_3,DALL-E 3,https://www.capterra.com/p/10009399/DALL-E-3,4.4,21,DALLE 3 is a fully functional visual art generation system that uses natural language to describe the content of an image or canvas. Learn more about DALL-E 3
77,Generative AI,reelcraft_ai,Reelcraft.ai,https://www.capterra.com/p/10020288/Reelcraft-ai,4.8,20,ReelCraft.ai is an AI video creation platform that transforms text into animated story videos. Learn more about Reelcraft.ai
78,Generative AI,trendsights,TrendSights,https://www.capterra.com/p/10011853/TrendSights,4.8,19,"Elevate your marketing and sales with TrendSights: AI-powered insights, influencer detection & content creation. Maximize your ROI. Learn more about TrendSights"
79,Generative AI,adobe_firefly,Adobe Firefly,https://www.capterra.com/p/10012410/Adobe-Firefly,4.5,19,Adobe Firefly is a user-friendly AI-powered content creation tool. Learn more about Adobe Firefly
80,Generative AI,rytr,Rytr,https://www.capterra.com/p/10004456/Rytr,4.6,18,"AI writing assistant tool that helps writers create long-form content, edit product descriptions, and format brand taglines, and more. Learn more about Rytr"
81,Generative AI,branding5,Branding5,https://www.capterra.com/p/10019782/Branding5,5.0,17,"AI-driven brand positioning, strategy, and campaign planning in minutes Learn more about Branding5"
82,Generative AI,kua_ai,Kua.ai,https://www.capterra.com/p/10016544/Kua-ai,4.9,16,"You can Create eCommerce Content Like a Pro, with Kua.ai's solution you'll get research and content creation done in a simple workflow! Learn more about Kua.ai"
83,Generative AI,jeda_ai,Jeda.ai,https://www.capterra.com/p/235393/Dojoit,4.6,16,"Jeda.ai stands at the forefront of the AI revolution as an unparalleled Generative AI Visual Workspace, purpose-built for strategizing. Learn more about Jeda.ai"
84,Generative AI,brain_pod_ai,Brain Pod AI,https://www.capterra.com/p/10002134/Brain-Pod-AI,4.8,15,"Brain Pod AI is the only unlimited, whitelabel generative AI platform that simultaneously creates text, images, and audio. Learn more about Brain Pod AI"
85,Generative AI,ada,Ada,https://www.capterra.com/p/164470/Ada-Support,4.7,15,"Ada is the omnichannel AI platform for customer service - built to automate, scale, and elevate the customer experience across channels Learn more about Ada"
86,Generative AI,max_ai,Max AI,https://www.capterra.com/p/152303/AnswerRocket,4.6,15,"A GenAI-powered analytics assistant that automates analysis, visualizes data, and composes data stories. Learn more about Max AI"
87,Generative AI,chatgpt_writer,ChatGPT Writer,https://www.capterra.com/p/10015128/ChatGPT-Writer,4.6,15,ChatGPT Writer is a cloud-based AI-enabled tool that harnesses the power of ChatGPT AI to assist users in various writing tasks. Learn more about ChatGPT Writer
88,Generative AI,flagright,Flagright,https://www.capterra.com/p/10021163/Flagright,4.9,14,The AI operating system for financial crime compliance Learn more about Flagright
89,Generative AI,bing_image_creator,Bing Image Creator,https://www.capterra.com/p/10015328/Bing-Image-Creator,3.9,14,Bing Image Creator is an innovative image creation tool that uses artificial intelligence to turn your words into stunning visuals. Learn more about Bing Image Creator
90,Generative AI,vt_writer,VT Writer,https://www.capterra.com/p/182595/VisibleThread-Readability-Server,4.9,13,RFP software for creating and editing proposals. Trusted by leading Government Agencies and Enterprises. Learn more about VT Writer
91,Generative AI,pyxa_ai,PYXA.AI,https://www.capterra.com/p/10026018/PYXA-AI,4.7,13,"Pyxa.ai uses generative AI to streamline text, image, voice, and video creation in one platform. Learn more about PYXA.AI"
92,Generative AI,causalfunnel,CausalFunnel,https://www.capterra.com/p/10017567/CausalFunnel,5.0,11,CausalFunnel increases site conversion by custom AI models such as personas and AI shop assistants. Learn more about CausalFunnel
93,Generative AI,typingmind,TypingMind,https://www.capterra.com/p/10014630/TypingMind,5.0,11,"TypingMind provides a professional UI to help individuals, teams, businesses interact with multiple LLMs at its full capabilities. Learn more about TypingMind"
94,Generative AI,leonardo_ai,Leonardo AI,https://www.capterra.com/p/10014773/Leonardo-AI,5.0,11,"Leonardo AI offers a comprehensive toolkit that includes Image Generation, AI Canvas, and 3D Texture Generation. Learn more about Leonardo AI"
95,Generative AI,hour_one,Hour One,https://www.capterra.com/p/204378/Hour-One,4.5,11,AI generative platform to create a realistic synthetic video for companies with prograde production capabilities. Learn more about Hour One
96,Generative AI,forethought,Forethought,https://www.capterra.com/p/196175/Agatha,4.5,11,Forethought is the first AI-native platform for enterprise customer experience. Learn more about Forethought
97,Generative AI,cosupport_ai,CoSupport AI,https://www.capterra.com/p/10016583/CoSupport-AI,5.0,10,"CoSupport AI is a fully customizable AI Agent for customer service, designed to automate, scale, and enhance support operations. Learn more about CoSupport AI"
98,Generative AI,easy_peasy_ai,Easy-Peasy.AI,https://www.capterra.com/p/10002907/Easy-Peasy-AI,4.9,10,Your intelligent AI assistant that helps you create amazing content 10X faster Learn more about Easy-Peasy.AI
99,Generative AI,llm_software,LLM Software,https://www.capterra.com/p/10030576/LLM-Software,4.8,10,LLMSoftware is an AI agent software that helps businesses automate tasks and extract valuable insights across multiple departments. Learn more about LLM Software
100,Generative AI,verloop,Verloop,https://www.capterra.com/p/172660/Verloop,4.7,10,"Verloop.io automates customer support effortlessly, enabling brands to deliver delightful CX with advanced conversational AI Learn more about Verloop"
101,Generative AI,inxide,Inxide,https://www.capterra.com/p/237162/INX-app,4.6,10,Inxide is the omnichannel conversational AI platform that enhances end-customer interaction in a dynamic and engaging way Learn more about Inxide
102,Generative AI,watsonx_assistant,watsonx Assistant,https://www.capterra.com/p/247516/IBM-Watson-Assistant,4.4,10,"AI-powered virtual assistant that helps with automating customer support, sales and marketing, and answering FAQs. Learn more about watsonx Assistant"
103,Generative AI,twistly,Twistly,https://www.capterra.com/p/10028056/ChatGPT-For-PowerPoint,4.9,9,"Twistly.ai is an AI PowerPoint add-in that turns text prompts into professional, ready-to-use slides. Learn more about Twistly"
104,Generative AI,craftly_ai,Craftly.AI,https://www.capterra.com/p/236638/CraftlyAI,4.8,9,"Craftly is the AI copywriter that generates original, high performing content the way you like it. Have that content ready in seconds, Learn more about Craftly.AI"
105,Generative AI,rezolve_ai,Rezolve AI,https://www.capterra.com/p/233152/Rezolve-AI,4.8,9,Rezolve.AI is an Agentic AI platform for employee support and ITSM inside Teams and Slack Learn more about Rezolve AI
106,Generative AI,mesha,mesha,https://www.capterra.com/p/10009352/mesha,5.0,8,"Mesha is an AI-powered platform that helps brands scale revenue by automating their ad creation, optimization, and landing page perform Learn more about mesha"
107,Generative AI,growthbar,GrowthBar,https://www.capterra.com/p/210785/GrowthBar,4.8,8,"The #1 SEO Tool for Marketers & Bloggers. Perform keyword research, rank tracking, competitive analysis and create content that ranks. Learn more about GrowthBar"
108,Generative AI,writer,WRITER,https://www.capterra.com/p/10004485/Writer,4.5,8,"The end-to-end platform for building, activating, and supervising AI agents in the enterprise. Learn more about WRITER"
109,Generative AI,hal9,Hal9,https://www.capterra.com/p/10011586/Hal9,4.5,8,"Hal9's open-source AI platform empowers startups to build chatbots, apps, and more, with fully managed MVP development in 30 days. Learn more about Hal9"
110,Generative AI,ai_docs,AI Docs,https://www.capterra.com/p/10012930/AI-Docs,5.0,7,Not Applicable Learn more about AI Docs
