product_id,review_title,description,author,rating,date,pros,cons,author_profession,author_industry,author_duration
sematext_cloud,One Stop Solution,"We have been using sematext for more than 8 months and we are having a great experience. This tool has helped us to fully secure our online infrastructure with its various components that are deployed in almost every field.And more over we have seen a growth in our business and this tool is one of the reasons for the same, We look forward for our relationship with sematext in future too.",Aaryan A.,5.0,"September 19, 2023",Detailed Log MnanagementBusiness Heatth Monitoring by a full monitoring of cloud and online servers.An Exceptional Customer Support team willing to help 24/7Application Performance Monitoring which cheack health of our deployed applications and check the performance bugs igf any and troubleshoot the problem for a better solution.,The deployment of the tool was bit hectic in the begning but customer support team helped us with a dedicated team for us to completely setup and deploy the tool. Pricing can be lower.,Senior Financial Analyst,Financial Services,Used the software for: 6-12 months
sematext_cloud,One stop solution for infrastructure insights!,I used this to manage my infra and this has really helped me a lot to understand the usage pattern of the app and also helps in safely predicting when the load will be high and when it will be low. Finding out memory leaks for JVM has also been very easy when I was trying to get insights about GC and JVM pool.,Debodirno C.,4.0,"September 24, 2020",- Very detailed reports - Installing an agent happens in a jiffy - Very intuitive UI - Good support from the Sematext team,- Documentation missing for old agents - Ubuntu < 16 - Agent once crashed - cause is still unknown!,Member of Technical Staff,Computer Software,Used the software for: Less than 6 months
sematext_cloud,Worth switching from other logging aggregation,Satisfied but need more time to evaluate,Chao Y.,5.0,"September 24, 2020","I just switch from ELK. Sematext is a surprise to me. It is so easy to integrate and so easy to use. The web UI is so intuitive and the query syntax is so easy to use even if you are not a technical guy. Compared to ELK, it is a real cloud service, you never need to worry about you lose the logs .",I haven’t found so far. Only thing is the price is a little bit high for a standup.,Software Engineer,Construction,Used the software for: Less than 6 months
sematext_cloud,IoT log monitoring made easy,"We have been monitoring a fleet of IoT devices with Sematext. Using it we can quickly send data from the devices and analyze it later, making feature development faster and debugging way easier.",Lucas P.,5.0,"September 25, 2020","Easy to use and extremely fast to filter log data. Ready-to-use Java and Android libraries made integration a very fast process. Main UI is very similar to Kibana, and it also provides the full experience if you need it. Fast and knowledgeable tech support.",There are rare instances where the UI becomes unresponsive or slow.,Embedded Systems Architect,Automotive,Used the software for: 6-12 months
sematext_cloud,Much More Than Log Aggregation,"Sematext is a proven and reliable offering, without a single outage I can recall in the past 2.5 years. The customer support is amazing and queries are answered without fail within a couple of hours. They are constantly working on the product and increasing their offerings. They offer customers the chance to trial new products and give feedback, which is fantastic. We use Sematext for: * Log Aggregation * Monitoring and Alerting * Incident Investigation * Log Retention * Debugging I love how we can easily set up alerts on logs and receive Slack or OpsGenie notifications when events occur. I would highly recommend Sematext as a vendor.",Verified Reviewer,5.0,"September 24, 2020",* Super Reliable * Excellent Customer Support * Constantly Adding Features * Constantly Improving,"There are very few things not to like about this software and company. The way accounts are set up, where you have to log in then ""become"" the account owner to see your logs is strange, and needs to be explained to each new user.",DevOps Lead,Construction,Used the software for: 2+ years
sematext_cloud,Advance and special next generation monitoring tool,,Lawne P.,5.0,"April 5, 2024",Sematext let easily develop interfaces to retrieve logs for test application.The pricing model - the cost per month are exactly predictable. Sematext give us beautiful insights of Infrastructure by fetching logs of remote end point.,The pricing structure is a little bit costly in my opinion and Needs more integrations with security tools for better optimally use.,Chief vice president,Marketing and Advertising,Used the software for: 6-12 months
sematext_cloud,Way more than a log tool,"Sematex has become increasingly essential in our tool set. It goes far beyond a simple log manager, delivering valuable information from this huge amount of data.",Guilherme G.,5.0,"September 25, 2020","Sematex has impressed us in recent months for its ability to deliver robust tools for analyzing and mining the information present in our logs. Through its customizable Dashboards, we can analyze very important statistics both to characterize the behavior of our users and to help us identify problems in our code.","The experience of using the Sematex interface has improved a lot, but it is not always so intuitive to find the resources we want. Reading the logs is also not as clean as I would like to see.",Software Engineer,Computer Software,Used the software for: 1-2 years
sematext_cloud,A cool managed service coming from seemingly technically versed people,"Easy setup, no-headache operations, flexible and instant sizing and fantastic technical support",Szabolcs S.,5.0,"October 31, 2017","Fantastic technical support, even feature requests (for sematext-agent) were sometimes implemented within hours. Sematext even setup its EU data center (partly) on our request. Thank you very much!","Business arrangements like a custom contract or plan sizes are not so easy and speedy to ""implement"" - but that's only a non-technical issue in the case of bigger probably public corporations.",Senior IT Architect,Transportation/Trucking/Railroad,Used the software for: 1-2 years
sematext_cloud,Log Aggregation that works,,Patrick B.,5.0,"November 9, 2017","- Choice of Sematexts own simple UI, and Kibana - Easy to integrate, since the API supports a number of common standards (elasticsearch, syslogd)","- User Management could be improved, members added to the team have to switch to the team sphere, even if they dont have and apps configured themselves - Missing feature: Filtering the context view (e.g. if there is an exception, displaying its context works, but I cannot limit that context)",Lead Software Engineer,Used the software for: 6-12 months,
sematext_cloud,Works as expected,,Michal B.,4.0,"September 28, 2020","The UI is quite easy to use, intuitive, does not reinvent the wheel.","Setting up logging from a serverless nodejs app was quite complicated. I could not get the logsene-sematext library provided by Sematext to work and I could not find a solid documentation for how to use the log API myself. Luckily, the library is open source so I could figure out how to post log messages directly from the source code.",Product Development Consultant,Information Technology and Services,Used the software for: Less than 6 months
sematext_cloud,Logging at its finest,Overall great experience and we use it daily. Have had no real issues,Justin M.,5.0,"September 24, 2020",Logs are sent quickly and the search features work great.,Have ran into issues running out of log storage for the day which can impact production logging,Devops,Computer Software,Used the software for: 2+ years
sematext_cloud,Great but with a small caveat for what is probably an unusual setup,,Matthew P.,4.0,"November 1, 2017",Super easy way to see metrics and do log analysis with alerting! We have clusters running in six regions around the globe and use Sematext for all our log analysis and error alerting.,"If you have a lot of clusters that you would like to keep separate in Sematext for various reasons (for us we have the same setup running in different regions of the globe) but want the same Sematext configuration (filters, alerts, etc) then you have to manually keep things in sync. Currently, it is impossible to have the same Sematext configuration applied to multiple apps...",CTO,Used the software for: 1-2 years,
sematext_cloud,"Sematext shows one unified view for all of our Docker log, events, and metrics! ",,Ben R.,5.0,"November 8, 2017","Docker Metrics and Docker Logs all in one place! Correlating between logs, metrics, and events is awesome! Hosted Kibana without the hassle of setting it up ourselves.","Sometimes the UI can be a bit cramped, and slow. Features of the UI, like getting a list of events when correlating is not as intuitive as it could be (little spreadsheet icon). Logsene searching has a learning curve. Having logs, events, and metrics on one page can be cramped, and sometimes results in the page becoming unresponsive.",DevOps Engineer,Used the software for: 6-12 months,
sematext_cloud,Our experience with Sematext,,Steven I.,5.0,"September 24, 2020","We are using Sematext as a logging solution for early detection of unanticipated error conditions, both server-side and in our front-end JavaScript. We needed a system that would provide enough context so we could debug any issues detected. Overall, Sematext does the job. By logging what's going right as well as what's going wrong, It's pretty easy to understand the broader context.","It is a bit pricey, but not out of line with other products in this space.",VP Technology,Consumer Goods,Used the software for: 6-12 months
sematext_cloud,Good For Monitoring,,David C.,5.0,"September 24, 2020","Great for monitoring Solr, with great memory use graphs.",We wished the retention period was a bit larger for the free tier.,CTO,Entertainment,Used the software for: 2+ years
sematext_cloud,Wonderful product,,Clayton S.,5.0,"September 24, 2020",Very easy to use Good support staff Efficient and easy billing,User interface took me a second to get used to,Software Developer,Computer Software,Used the software for: 1-2 years
sematext_cloud,Very easy to work with ,,Verified Reviewer,5.0,"September 24, 2020",Sematext is very easy to navigate by providing a nice interface environment without complicated clutter. The documentation is also amazing.,It needs more integrations with security tools.,CTI analyst,Computer & Network Security,Used the software for: 6-12 months
sematext_cloud,Best monitoring tool under the budget,,Verified Reviewer,5.0,"September 29, 2020",Easy to setup and configure addons. Log Monitoring & Infra monitoring is good.,"None, it suited within our budget. You can add option for real time monitoring. The current poll interval is 1 min I guess.",DevOps Engineer,Information Technology and Services,Used the software for: I used a free trial
sematext_cloud,Intuitive server metrics tracking,Sematext support was overall positive and they are super helpful when integrating with the tech stack.,Guru S.,5.0,"September 25, 2020","Sematext provided support for our GoSchedule engineering team to track server logs, exceptions, and other essential metrics in a single dashboard. This helped the whole engineering team to decide when to scale and add more machines for production load. This increased our engineering team productivity and sleep well during night.",So far we didnt have any negative experience with the software.,Co-Founder,Computer Software,Used the software for: Less than 6 months
sematext_cloud,Easy of use,"I have a feeling of an easy to understand product, and that motivates people to adopt new platforms and the paradigm it represents.",Carlos M.,4.0,"September 24, 2020","I am impressed with how easy it is to learn, start using the product, and the more I use it the more I discover features that I did not know I needed and makes my life easier.",UI sometimes is in my opinion kind of slow,Software Engineer,Computer Software,Used the software for: Less than 6 months
sematext_cloud,Great monitoring,"Very positive, love the UI and ease of use.",Claire R.,5.0,"September 24, 2020",I really enjoy the flexibility Sematext allows,Integration was less straightforward than anticipated,Software engineer,Telecommunications,Used the software for: I used a free trial
sematext_cloud,Sematext is an excellent monitoring and logging platform for Docker and Kubernetes,Excellent platform for monitoring and logging for Kubernetes.,Deepak V.,5.0,"October 13, 2020",Easy to install. Collects relevant metrics.,Does not integrate with AWS web services.,Web Developer,Computer Software,Used the software for: Less than 6 months
sematext_cloud,Good monitoring product,I have moved the company into docker containers. Semester has been very helpful to show what is happening with our container infrastructure.,jason B.,5.0,"September 25, 2020",Ability to drill down to see exact metrics. Ease of use.,None. I like it. Trying to get company to commit to larger engagement of SEMA text.,Systems architect,Information Technology and Services,Used the software for: 6-12 months
sematext_cloud,Straitforward and easy setup.,,Joseph H.,4.0,"September 30, 2020",The software was quick and easy to get up and running in our test environment.,"There were some glitches with their management console, a little to much email notifications.",President,Computer Software,Used the software for: I used a free trial
sematext_cloud,I'm using on the heroku,,Verified Reviewer,4.0,"September 25, 2020",surely sends logs to me on my heroku app,"Not supported Japanese language, English only",Programer,Automotive,Used the software for: 1-2 years
