product_id,review_title,description,author,rating,date,pros,cons,author_profession,author_industry,author_duration
trackbee,Good quality,It's a good company,Verified Reviewer,5.0,"October 12, 2023",Products are very good and they have a good quality compared to others,Due to the terms and use of Trackbee its important to ensure that everything is done according to how is planned,Entrepreneur,Logistics and Supply Chain,Used the software for: I used a free trial
trackbee,Garden Art by Layla review,The tool has helped me track all my ads records and was easier to use by my team,Layla S.,5.0,"February 6, 2024",The tool was very friendly and easy to use,User manual not available especially for beginner,Managing director,Arts and Crafts,Used the software for: Less than 6 months
trackbee,Logo design,,Haji Y.,3.0,"October 29, 2023",They are so good in writing simple english,Too many question which are not important,Creating a logo,Design,Used the software for: Less than 6 months
trackbee,SEO trackbee rting,The versatility in handling multiple data sources contributes to a comprehensive understanding of marketing campaigns across various channels,Isabella M.,5.0,"November 25, 2023","Server-to-server tracking mechanism, ensuring accurate and efficient conversion tracking",More extended free trial period to thoroughly evaluate TrackBee's capabilities before committing to a subscription,Project Manager,Education Management,Used the software for: 6-12 months
trackbee,Baby Charlotte Children's Store,Tracking software that adheres to robust security and privacy standards,Carla M.,5.0,"December 1, 2023",The ability to export reports facilitates collaboration among team members,"Response Time for Support Queries, they should prioritize quick issue resolution",Store Operation manager,Apparel & Fashion,Used the software for: 6-12 months
trackbee,Trackbee experience user review,"The integration with Shopify is particularly praised by e-commerce businesses, allowing for seamless tracking and optimization of online store performance directly within the TrackBee platform.",Logan L.,5.0,"November 25, 2023","Designed with a user-friendly interface, making it accessible to marketers of varying experience levels. An intuitive design can reduce the learning curve and enhance overall usability.","Initial setup process as complex, particularly if they are not familiar with server-to-server tracking",Digital marketer,Marketing and Advertising,Used the software for: I used a free trial
trackbee,Valley Wine and Spirits user,A well-designed and comprehensive dashboard provides users with a centralized view of key metrics and performance indicators,Benjamin B.,5.0,"December 7, 2023",The user-friendly interface of TrackBee makes it accessible to both beginners and experienced advertisers,TrackBee's functionality depend on internet connectivity,Operation Manager,Food & Beverages,Used the software for: 6-12 months
trackbee,Product design tracking conversions ,"Creating design to be used as brand identity and running ads, ads conversions are as i expected",Verified Reviewer,5.0,"October 24, 2023",One of the standout features of Trackbee is its ability to seamlessly post conversions back to your ad dashboards on Facebook and Google.The product was easy to use and easy intergration,"Integration was not difficult, i don't see features to be added, expect more updates",Graphic Designer,Arts and Crafts,Used the software for: Less than 6 months
trackbee,Research,,Verified Reviewer,4.0,"October 27, 2023",It easier to use and make life more easier,It required a lot of time until to master it,Research assistant,Biotechnology,Used the software for: 6-12 months
trackbee,Researcher,,IDD S.,5.0,"November 3, 2023",It helps user to have credibility to buyers,It takes time to complete login in your account,Researcher,Higher Education,Used the software for: Less than 6 months
trackbee,User experience with tracbee,Knowing that sensitive data is handled securely contributes to user trust and confidence in the platform,James C.,5.0,"December 7, 2023",The ability to export reports facilitates collaboration among team members and stakeholders,Frequent updates and new feature releases,Managing director,Warehousing,Used the software for: 6-12 months
trackbee,User review,"The server-to-server tracking ensures that conversion data is more precise, even in the challenging post-iOS 14 landscape",Liam O.,5.0,"November 15, 2023","Unlike some competitors, TrackBee not only tracks conversions but also directly posts them back to your ad dashboards on platforms like Facebook, Google, TikTok, and others.","For marketers who are relatively new to advanced tracking solutions, there might be a slight learning curve when getting accustomed to TrackBee's features",Lead generation manager,Financial Services,Used the software for: I used a free trial
trackbee,Action Jackson Fitness,Tracking software that is easy to set up and integrate with their existing systems,Jackson B.,5.0,"December 1, 2023","The incorporation of artificial intelligence in analytics processes provide with enhanced insights, such as anomaly detection and predictive analytics",Compatibility with Emerging Advertising Platforms,personal trainer,Sports,Used the software for: Less than 6 months
trackbee,Toy Store Review,A well-designed and comprehensive dashboard provides users with a centralized view of key metrics and performance indicators,Aiden W.,5.0,"December 2, 2023",Advanced data visualization tools contribute to a more insightful analysis of campaign performance,"Depending on the user's budget and specific needs, the cost of using TrackBee might be a consideration",Owner Mudpuddles Toy Store,Apparel & Fashion,Used the software for: Less than 6 months
trackbee,Illusion marketing experience,"The ability of TrackBee to post conversions back to various ad dashboards, including Facebook, Google, and TikTok, has streamlined the optimization process",Ethan W.,5.0,"November 20, 2023",Direct integration with platforms like Shopify is a game-changer,"The initial setup process, although streamlined, might take a bit longer for users who are new to tracking solutions",Chief Marketing Office,Media Production,Used the software for: Less than 6 months
trackbee,Footware lead generation,"The automated reporting to ad dashboards on platforms like Facebook, Google, and TikTok has been highlighted as a time-saving feature",Amelia P.,5.0,"November 29, 2023","Data validation and quality control, ensuring the accuracy and reliability of the transferred data",Found certain customization features complex,Footwear Designer,Apparel & Fashion,Used the software for: I used a free trial
trackbee,Say Media Group review,"Unlike traditional methods relying on complex JavaScript pixels, Trackbee seamlessly integrates with TikTok ads and various platforms, eliminating the need for extensive developer experience.",Noah C.,5.0,"November 18, 2023","Ease of integration with various platforms, including popular e-commerce platforms like Shopify, eliminating the need for extensive developer experience.",The cost of TrackBee could be a potential downside. It's essential to weigh the features and benefits against the pricing structure.,media buyer,Media Production,Used the software for: Less than 6 months
trackbee,Hunt & Hall review,"Integration with various advertising platforms, such as Facebook, Google and TikTok",Harper H.,5.0,"December 7, 2023","Comprehensive analytics suite that covers various aspects of digital advertising, from real-time performance monitoring to in-depth data analysis",Integration Challenges with Unique Systems,International Fashion stylist producer and art director,Apparel & Fashion,Used the software for: Less than 6 months
trackbee,Nyumile agency experience with trackbee,"If you're looking for a Shopify app that simplifies order and return tracking while enhancing your conversion tracking capabilities, Trackbee is definitely worth considering. It's the smart choice for e-commerce businesses aiming for accuracy, ease of use, and integration with major ad platforms.",Isaya N.,5.0,"October 18, 2023","nlike some other solutions that require coding or developer experience, Trackbee offers direct integration with Shopify and many other platforms. This means you can get started quickly without the need for technical expertise.",order and return tracking still learning more from this tool so far,Media buyer,"Health, Wellness and Fitness",Used the software for: I used a free trial
trackbee, jewelry store review,Effortless Integration: The direct compatibility with popular e-commerce platforms adds to the positive integration experience.,Emily L.,5.0,"December 4, 2023","TrackBee stands out due to its user-friendly interface, direct integrations, and the ability to seamlessly work with various ad platforms",The pricing structure of TrackBee less favorable compared to alternatives,Jewelry,Apparel & Fashion,Used the software for: Less than 6 months
trackbee,Reynolds Marketing reviews,consistent and user-friendly experience across various devices,Emma R.,5.0,"November 14, 2023","clicks, conversions, and other relevant KPIs",The free plan is not friendly to medium businesses,Manager,Marketing and Advertising,Used the software for: Less than 6 months
trackbee,Buzzing with effieciency,The data and insights provided by TrackBee can support better decision-making and resource allocation something which is good indeed.,Verified Reviewer,5.0,"November 4, 2023",It offer real time track of product by giving acurate data,Cost for subscription can be expensive for some businesses,Human Resource Officer,Real Estate,Used the software for: I used a free trial
trackbee,Best tracking software ,,Verified Reviewer,5.0,"October 11, 2023",Easy tool to integrate with any leads conversion,Friendly that anyone can use and integrate with any website,Designer,Food & Beverages,Used the software for: Less than 6 months
trackbee,Ideal platform to improve scales and marketing. ,"Amazing platform for businesses, particularly small businesses operated online and offline.",Zephar M.,5.0,"October 23, 2023","Easy to operate; Information storage is advanced; Less ads, thus more efficient; Data accuracy is ideal",Needs clear intentions of use like any other platforms,CEO and Crafter/Designer,Arts and Crafts,Used the software for: I used a free trial
trackbee,Track bee good app i recommend for any digital worker,,albert P.,4.0,"October 27, 2023",track bee is easy to use and its price is cheap,the app is difficult to integrate with other apps,marketer,Fund-Raising,Used the software for: 6-12 months
