product_id,review_title,description,author,rating,date,pros,cons,author_profession,author_industry,author_duration
avepoint_cloud_backup,Evaluation Avepoint Cloud Backup,,Simon G.,5.0,"October 25, 2023",It is a Simple and efficient solution that offers us a lot of security,The costs associated with the backup solution,IT Administrator,Information Technology and Services,Used the software for: 2+ years
avepoint_cloud_backup,AVE Point Backup,,Luca J.,5.0,"October 24, 2023","Die Simple Methode Datein wiederherzustellen, es ist leicht einbindbar in Teams, wodurch durch einen simplen Teams Chat deine Daten wiederhergestellt werden kann","Es ist bei der Beschreibung der Daten der ungenau, beispielsweise zeigt es an das Microsoft O365 Gruppen wiederhergestellt werden können, als End User würde ich mich erstmal fragen was dies für eine Datei ist.",Systemintigrator,Information Services,Used the software for: 2+ years
avepoint_cloud_backup,I recommend Exclaimer to all of my customers,,GianPaolo P.,5.0,"October 8, 2021",The ability to backup all data from our Office365 tenancy is a key part of our Disaster Recovery Plan. AvePoint makes it super simple to restore emails/files/folders whenever a request is raised.,"One thing that is missing is the ability to do on Demand Backup's(incase we need to push a change), we can change the schedule as needed, but it'd be easier to be able to do a one touch On Demand backup.",Director,Computer & Network Security,Used the software for: 2+ years
avepoint_cloud_backup,Avepoint Tägliche Backups & Datenwiederherstellung,,Marion F.,5.0,"September 26, 2023",Wir nutzen Avepoint um tägliche Backups jeglicher Services zu erstellen und um Daten wiederherstellen zu können. Es ist übersichtlich und leicht zu nutzen.,"Viele Features muss man noch dazu buchen, es ist nicht direkt alles dabei.",IT Consultant,Information Technology and Services,Used the software for: 1-2 years
avepoint_cloud_backup,Avepoint Backup and Restore,,David A.,5.0,"October 16, 2023",It is a perfect solution for backup and recovery.We use it to back up the sharepoint with usRestoring works without problems and the exact file search is also wonderful.,"The costs are not exactly low, but the range of functions is huge.",IT Administrator,Information Technology and Services,Used the software for: 6-12 months
avepoint_cloud_backup,avepoint rating ,i have realzded that im only going to be using this application in the future and that if i ever need help i will be using this,devran R.,4.0,"October 24, 2023",the backup funktion or the part where it shows you how to use the software,nothing really maybe i would wish for more features for customeers,Fachinformatiker,Information Technology and Services,Used the software for: Less than 6 months
avepoint_cloud_backup,Backups as a User,,Maren C.,5.0,"October 24, 2023","I really like the fact that it is so easy, I just call an Admin if I am missing files and they get recovered in not even a day.",I dont really understand the tool in the background. For me everything is amazing!,Marketing Consultant,Information Technology and Services,Used the software for: 6-12 months
