product_id,review_title,description,author,rating,date,pros,cons,author_profession,author_industry,author_duration
my_askai,"MyAskAI will save you time, I promise.",I work with a number of small businesses an this is a fast and easy way we can improve the on boarding process. They can quickly connect all of the onboarding documentation allowing new team members to ask questions and find the answers without search through files.,Don H.,5.0,"August 31, 2023",The ease of getting started is the best. I've tried numerous AI assistants and solutions to access your personal knowledge base. This one is the easiest to start. I was up in less than 5 minutes asking questions to the files,The limited number of integrations is probably the biggest issue.,Founder,Insurance,Used the software for: Less than 6 months
my_askai,A decent chatbot for dcouments,"Overall, this was a good chatbot app as it allweod a lot of documents to be uploaded. However the outputs I am not sure whether they took from 1 document by itself or via many different documents and synthesised/summary together.",Verified Reviewer,4.0,"September 8, 2023","What is unique regarding this was the fact that you could upload multiple documents (pdfs), webpages etc - in parallel. There was a limit to the number of pdf size but it was easy to manually split the pdfs in size and then upload. Some places place a limit to the number of pdfs that can be uploaded to any chatbot - but the limits here are very much generous. Documetns and webapges can have images within without need to do any formatting which made it easier.","The pricing was a bit more expensve than competitors. It would be better if the subscription price can be reduced if you can integrate in your own OpenAI key. The output was decent but was limited in the sense that there was very much limited ability to converse with the chatbot beyond what was output. Very frequently the chats ceased, and limited followup questioning.",Tutor,Education Management,Used the software for: 6-12 months
my_askai,Many other better options,"Very poor, the service was down most of the time.",Thomas S.,1.0,"January 30, 2025","it was easy to use, but the web crawling did not work","they cancelled my personal account for no reason, then said I needed to use a ""work"" account.",Specialist,Government Relations,Used the software for: 6-12 months
my_askai,"Customizable, Easy-to-use Chatbot Platform","Fantastic. I’ve experimented with several different tools. The platform offers everything I need to create tailored, engaging chatbots for my website. The chatbots have significantly improved customer interaction and experience, leading to increased sales and customer satisfaction. I've also enjoyed the efficiency and ease of use the platform provides, making it a breeze to manage and optimize chatbots.",Chris M.,5.0,"August 19, 2023","I like the extreme flexibility and customization it offers. It allows you to build and personalize chatbots that perfectly fit your specific needs. Additionally, the user-friendly interface and the robust features make it an excellent tool for both beginners and experts alike.","It may feel a bit overwhelming for complete beginners due to the plethora of customization options. However, the platform does offer excellent customer support and detailed tutorials to help users get the hang of it quickly.",Program Director,Education Management,Used the software for: Less than 6 months
my_askai,Very useful,,Verified Reviewer,4.0,"February 6, 2024","AskAI offers a variety of features, including answering questions, writing different kinds of creative text formats, and translating languages. AskAI is designed to be easy to use, with a simple and intuitive interface. AskAI is constantly learning and evolving, so it has the potential to become even more helpful and informative in the future.","Limited understanding of context and nuance: AskAI sometimes struggles to understand the full context of a question or request, which can lead to inaccurate or irrelevant responses.",Creative,Consumer Electronics,Used the software for: Less than 6 months
my_askai,CPA website feedback,"So far, I need this to improve. Customer Service responded quickly initially but then took a few days for the follow up.",Hector C.,2.0,"August 10, 2023",It fulfills the novelty that I was looking for on my website.,"It does not function great. It needs to speak the language it is spoken to and provide more answers based on the content. My first AI straight up didn't answer simple questions like, do I get taxed on a home sale when I had added the publication for home sales from the IRS website. Things like that",President,Accounting,Used the software for: Less than 6 months
my_askai,A partner in crime! ,,Verified Reviewer,4.0,"August 19, 2023",Being able to personalise AI according to my business and needs is an amazing tool,the ease of access to a vast amount of personal data and content make me feel a bit uneasy on how safe this could be in case something goes wrong,Cardiologist,"Health, Wellness and Fitness",Used the software for: I used a free trial
my_askai,My AskAI is amazing!,Large amount of data to be searchable with the help of ChatGPT.,Kamil N.,5.0,"May 5, 2023",Very accurate answers from my personal data.,Styling my Ask AI could be better with more customization features.,Front end developer,Computer Software,Used the software for: Less than 6 months
my_askai,It's an okay tool perhaps made better by spending money on customization or chatbot for customers,,Jessica M.,4.0,"January 26, 2024",It was easy to setup and use. I was able to dive right in.,"It wasn't necessarily as ""smart"" as I needed it to be. I wanted to build a chatbot for my own research and the answers it provided were very basic and not super helpful. I was researching a complicated subject though so I am thinking this is perfect for websites and consumer/customer questions.",Producer,Marketing and Advertising,Used the software for: Less than 6 months
my_askai,A really great product,,Alexander K.,5.0,"February 16, 2024",easy of installation and operation + analytics,very time limited free trial and no lifetime free layer,Lead Software Engineer,Electrical/Electronic Manufacturing,Used the software for: I used a free trial
my_askai,Versatile and easy product FAQs for every visitor,,Marcus H.,5.0,"May 6, 2023","The simplicity of use and the warm support of My AskAI, which has incorporated many of my wishes and ideas directly into the product development.",I really can't think of anything to write here that would detract from the genius of the product. It's super easy to set up without having to know any programming and so anyone can set it up and use it or make it available to their customers.,CEO,Alternative Medicine,Used the software for: Less than 6 months
my_askai,Using MyAskAI for AI driven customer support,"Great product, easy to use and solved our needs in a way that required minimal internal support to begin using.",Olivia L.,4.0,"February 5, 2024",Super easy to set up. My team was able to begin using the tool immediately within 5 minutes of setting up to help manage our customer support channels. It was also a less expensive solution than many other tools out there which was a huge help. We also were able to customize the branding and settings to meet our use case.,No major cons just that certain features are unavailable unless you move to a higher pricing tier. I also think that it would be better if more of the bots could be connected to dynamic data sources but those are enhancements that should come with time.,Product Manager,E-Learning,Used the software for: 6-12 months
my_askai,Great tool ,,Claudia S.,5.0,"August 10, 2023",The flexibility and huge scope of knowledge.,"I always still need to double-check the information given. More often than not I need to edit and cut down sentences/paragraphs. It would be amazing to connect to apps we use at work, to help us write observations, emails and reports easily.",Head of Forest School,Education Management,Used the software for: 6-12 months
my_askai,Great Tool for Company FAQs,I have been using it to load complete instructional documentation and contracts and then asking it to pull specific informaion I need. It helps save massive amounts of time since I don't have to scroll through hge docs,Marc R.,5.0,"August 25, 2023",Super easy user interface. Clear directions and helpful chat.,"I don't have any major issues with the tool. I have noticed that if I ask questions using wording that may not neccessarily be tied to any of the information or sections in the information uploaded, sometimes it struggles to understand the question to give the answer.",President,Accounting,Used the software for: Less than 6 months
my_askai,AskAI unlimited embeddings,I use it almost everyday and I’ll be making a queriable codebase repository as a next step,Joseph P.,5.0,"May 5, 2023","Askai with unlimited embeddings just becomes a sort of usual or daily necessity , integrating with other services with limited embeddings","It’s too easy to make an askai , but it works great",Junior executive,Biotechnology,Used the software for: 6-12 months
my_askai,AskAI in education,Great so far.,Harry R.,4.0,"August 25, 2023","The customisation is so important to me in the role we're giving it. It's also very important to me that it logs all conversations, allowing us to check for any issues or inappropriate usage.","I'd like to be able to go further along the road with the customised background prompt, to be honest I'm not sure how that would even work though!",Head of Physics,Education Management,Used the software for: I used a free trial
my_askai,Important step towards an easy integration of AI into our membership relations management,We started out of curiosity. It was a great experience right from the start. We didn't need to involve developers or administrators of our webpage. It worked right away.,Philipp E.,5.0,"October 27, 2023","It was easy to integrate into our webpage. So, we can support our front desk employee and also give 24/7 replies to frequently asked questions.",Some of the new and cool features are not available on the smallest contract.,President,Sports,Used the software for: Less than 6 months
my_askai,My AskAI is the fast solution for custom Chatbots,We will consider to use My AskAI in future for our stores.,Patrick W.,5.0,"June 29, 2023",I really liked the speed to set up the Chatbot.,I am missing other languages in the backend,CTO,Retail,Used the software for: I used a free trial
my_askai,Really Cool Product,,Jennifer K.,5.0,"May 5, 2023",This is obviously an innovative feature and it's exciting. The software is very straightforward and easy to use.,Nothing yet...the real test will be making sure we load in enough content to get the AI to respond appropriately to user questions.,"Head of Risk Management, Technology Architect",Financial Services,Used the software for: Less than 6 months
my_askai,Easy to use,"Clean, easy to use interface. Was able to quickly prototype a web application with chatbot functionality.",Richard B.,4.0,"July 5, 2023",Was easy to use and set up. Bubble plug in functionality was super helpful.,On the free version so a bit limited but worked well for a prototype.,Presentation Strategist,Management Consulting,Used the software for: Less than 6 months
my_askai,Nice system that's really easy to set up and use,Great :),Carl M.,5.0,"August 1, 2023",really quick and easy to build your own chatbot - we use it for our staff handbook,I needed a bit of help to integrate in our sharepoint intranet - but their support were good,cto,Online Media,Used the software for: Less than 6 months
my_askai,Excellent way to deploy AI for your business,Solved an issue with deploying AI for small businesses,Doug D.,5.0,"October 27, 2023",You can add your own content to the tool so answers are company centric.,Would like option to extend its knowledge interactively as needed.,Developer,Real Estate,Used the software for: 6-12 months
my_askai,"I tried the free trial, but didn't subscribe.... yet","My AskAI is going to help solve the perennial problem of getting quick but accurate answers to the end user. Infobases are great, but people get lost in looking for answers. Harnessing AI to build answers using trusted data is going to be a huge growth area.",David B.,4.0,"June 19, 2023","The concept is brilliant - harness the power of AI, but limit it to the trusted info that you provide. This is the future of AI, and I'm looking for this concept to expand.","The price gap between the Hobby and Pro. Hobby is too small, and Pro is too much. I'd like to see a mid-range product.",President & Owner,Accounting,Used the software for: I used a free trial
my_askai,Great Resource,Overall this is solving the issue of the challenge of deploying and training on company materials,Josh G.,5.0,"May 5, 2023",We're loving having this product as a better way to deploy our employee manual and policies and procedures.,My biggest con is that the interface functions fairly slowly. They need to speed up their website.,CFO,Hospital & Health Care,Used the software for: Less than 6 months
my_askai,Easy to use,,Randy F.,4.0,"June 20, 2023",Very simple to implement. Compared to other options I find that this platform is easy to implement.,"Although I'm using the free version, to upgrade I find it to be moderately expensive.",Consultant,Computer Software,Used the software for: I used a free trial
