product_id,review_title,description,author,rating,date,pros,cons,author_profession,author_industry,author_duration
oxylabs,Best Poroxy Provider in The Market.,"My overall experience with Oxylabs has been very positive. The platform’s robust proxy network has made data gathering straightforward and effective, and the support team has been responsive and helpful. I also value their focus on ethical data sourcing and compliance with privacy regulations, which gives me peace of mind. Oxylabs has proven to be a reliable choice for my needs.",Priyanshu S.,5.0,"November 5, 2024","I really appreciate Oxylabs for its reliable and extensive proxy network, oxylab labs proxy quality is amazing and they provide high speed proxy service. im using oxylabs since 7+ years.","they don't have domain block option. like i want to block some hidden request from google, but in oxylabs not have that option to blocked unwanted domains.",CEO,Online Media,Used the software for: 2+ years
oxylabs,OXYLAB MY ALL TIME PROXY SERVICE PROVIDER ,Oxylabs has proven to be a really good proxy provider by meeting most of my proxy needs and requests i would absolutely recommend it to anyone looking for proxy services,Verified Reviewer,5.0,"November 25, 2024",Whats most exciting about using oxylabs is how they make everything super easy from getting setup up and even purchasing of packages. With oxylabs your guaranteed of worldwide geo targeting that makes their services amazing. When it comes to their customer service thats top notch and they are always there in case of any query,I had only one issue in terms of dashboard and accessibility but that has been resolved and its good to see that they listen to customer request on improving the services,Tutor,Education Management,Used the software for: 1-2 years
oxylabs,Oxylabs Review,Overall I did not like using Oxylabs their customer support was not good at all and I just did not like using them,Anwaar M.,2.0,"May 14, 2025",- Ease of use to actually get setup without a lot of integrations which was very nice also the packages,- Their customer support is horrible. It is impossible to reach them and was the #1 reason why i stopped using them,CEO,Financial Services,Used the software for: 6-12 months
oxylabs,Works better than some of the leading proxy providers for us,"Really positive so far, support is good and the proxies are performant.",Verified Reviewer,5.0,"November 19, 2024",We've managed to index some ecommerce sites that were causing us issues with other proxy providers.,Some proxy config options are not quite as easy to implement as some other providers.,CTIO,Marketing and Advertising,Used the software for: 6-12 months
oxylabs,Works like magic,"It is a pretty positive experience; it took seconds to set it up, and it works like magic after",Alex A.,5.0,"November 4, 2024","There are plenty of options to choose from, lots of new innovative products","nothing really, works perfectly well for my use cases",Founder,Information Technology and Services,Used the software for: 1-2 years
oxylabs,Great Real-Time SERP Scrapper API,"We needed to monitor AD SERP results in google to see if any unwanted, forbidden action is happening (like brand bidding or ad hijacking) for our clients, and Oxylabs for it is just great",Bartosz J.,5.0,"October 29, 2024","Sandbox - free version, where we could test if it meets our expectations Well documented API Responsive support Stable and responsive",it meets 100% of our needs. It great solution for monitoring AD serp in google,Head of Technology,Marketing and Advertising,Used the software for: 1-2 years
oxylabs,Quick and Efficient! ,It's the most user friendly service I've come across to get the job done,Lauren C.,4.0,"October 31, 2024",The data scrapping is quick and efficient for my needs,Many sites are unable to be data scrapped. So I wish it was more expansive,CEO,Consumer Services,Used the software for: 1-2 years
oxylabs,Great Proxies,Very good. No complains. Have been using it for over a year,Eric B.,5.0,"November 6, 2024",Very reliable service. I never had issues with the proxies,We did not get alerts when our plan would run out,CEO,Computer Software,Used the software for: 1-2 years
oxylabs,Flawless Experience. What more can you ask for.,,Shannon A.,5.0,"December 16, 2024",Ease of setup and distribution of proxy servers,Nothing. The entire process was easy to understand and I love the customer service.,CEO,Consumer Services,Used the software for: 6-12 months
oxylabs,Useful platform,"The dashboard is intuitive and well-designed, making it easy to manage proxy settings and monitor usage. Their customer support team deserves special mention - they've been incredibly responsive and knowledgeable, available 24/7 to help with any technical questions. What really sets Oxylabs apart is their cutting-edge proxy rotation technology and sophisticated targeting options. Whether you need country, city, or even ASN targeting, their system delivers flawlessly. The proxy success rates are outstanding, and their integration options are perfect for both beginners and advanced users.",Mangane A.,5.0,"November 24, 2024","Oxylabs has exceeded my expectations in every way. Their residential proxy network is truly impressive, offering lightning-fast speeds and exceptional reliability. I've been consistently amazed by their 99.9% uptime and the vast pool of over 100 million residential IPs spanning across the globe.","The only downside is their premium pricing, which might be a barrier for smaller businesses or individual users.",CFO,Building Materials,Used the software for: Less than 6 months
oxylabs,Review of the Web Unblocker,,Fan J.,5.0,"October 25, 2024","Very good web unbloker, I was able to get my data within 5 seconds and the success rate is over 90%.","The web unblocker is quite pricy the use, and there is no option to get the original response headers.",Software Developer,Computer Software,Used the software for: 6-12 months
oxylabs,Ideal proxy and ecommerce scraping SaaS,Excellent proxy service and eBay scraping SAAS that I'd thoroughly recommend to people that have these requirements.,Joshua G.,5.0,"December 5, 2024",I really liked how easy the API was to use with PHP for rapid scraping.,I found that their Web-Unblocker service couldn't pass through Cloudflare's proxy.,Director,E-Learning,Used the software for: Less than 6 months
oxylabs,Oxy labs review. ,Amazing. Best proxy experience this far. And I’ve tried a couple providers.,Christian M.,5.0,"November 4, 2024",Quality proxies. Very fast response time for customer service.,Haven’t had any negative experience as of yet. Customer for 3 months.,Owner,Marketing and Advertising,Used the software for: Less than 6 months
oxylabs,Payment Problems,We have been working with OxyLabs for a long time.,Yakup Y.,4.0,"December 12, 2024",It's really a very high quality service. It's the best we've ever used.,"We have payment problems. We usually use the OxyLabs DC package. We need it for 1 month, we don't need it for 1 month. If the subscription continues the next month, there is no problem when extending the current package. But if we haven't used it for 1 month and want to use it the next month, we can't pay. Every time we have to contact support to solve this problem.",Founder,Accounting,Used the software for: 2+ years
oxylabs,Great service!,"Good, I tried other similar services and Oxylabs is one of best available.",Adam B.,5.0,"November 15, 2024","Back office, responsible customer service, great documentation.",Some fixes takes long time and there is no good enough communication.,CEO,Logistics and Supply Chain,Used the software for: Less than 6 months
oxylabs,Oxylabs Review,My overall experience in this platform was great and i am looking forward to continue using them,Dun M.,5.0,"December 9, 2024",It is easy to use. This website offers great proxy services that are clean,I have nothing in particular thatvinhag about tjis platform,Not applicable,Computer & Network Security,Used the software for: Less than 6 months
oxylabs,Good experience for a new user of proxy services,"Generally very good so far. Good support, stability of services and transparency on my spending.",Gustavo V.,5.0,"October 24, 2024","Ease of use, transparency in the reports","Price steps between tiers are a bit steep, lack of more pay as you go options for scraper plans.",Director of Technology,Information Technology and Services,Used the software for: Less than 6 months
oxylabs,"Smooth, Fast, and Reliable","I've been really happy with Oxylabs. It was super easy to set up, and the whole thing just makes sense—no complicated hoops to jump through. The proxies are fast and reliable, which has made a big difference in our work.",Ernest D.,5.0,"November 11, 2024","Quick and easy to get started, simple to understand and use, reliable with great response times.","Honestly, none that come to mind. No significant issues to report so far!",Software Developer,Retail,Used the software for: Less than 6 months
oxylabs,Incredible! Request-based ISP Proxies with No Bandwidth Limits!,Very happy overall. Great instructions on how to use and test the ISP proxies and the rotation feature,Joseph R.,5.0,"December 13, 2024",The only provider I could find that supplied rotated ISP proxies on every request with no bandwidth caps! I didn't get blocked or flagged as a bot very often. Incredible price to value ratio!,They didn't allow a free trial for a one man operation,Owner,Real Estate,Used the software for: Less than 6 months
oxylabs,Great customer service ,"The customer support is truly great, always available to chat and answer my questions",Svetlana K.,5.0,"November 4, 2024","Customer support is really great, available 24/7",Cost. I buy mobile local proxies and I wish cost will be lower.,Marketing,Market Research,Used the software for: Less than 6 months
oxylabs,Recommandation,,Yassine R.,5.0,"November 6, 2024",Proxy fast speed Instantané activations,There are no discounts every time …..:,Ecome,Accounting,Used the software for: 1-2 years
oxylabs,Best US ISPs,Very good ISP proxies Residential and mobile proxies are quite pricey though.,Marvin I.,4.0,"October 19, 2024",Fast and clean proxies Good price for your money,No unlimited bandwidth for mobile proxies,Analyst,Computer & Network Security,Used the software for: 1-2 years
oxylabs,Excellent product,Has enabled my workflow for web scraping,Matt T.,5.0,"October 28, 2024","Very easy to use, fast and effective - great product",cost - it can be costly to run the residential proxies many times,Data Scientist,Media Production,Used the software for: Less than 6 months
