product_id,review_title,description,author,rating,date,pros,cons,author_profession,author_industry,author_duration
web_scraper,A fast and practical extension for downloading data,"Thanks to Web Scraper, I can quickly download data from sites with a simple interface. Padding is pretty easy.",Verified Reviewer,5.0,"December 2, 2022","One of the best data collection extensions. I learned a lot about the extension from the forums. You can download many data by browsing through the pages without writing code. Text, link, image etc. It's completely free.",The information in the file I downloaded is mixed. There are shifts in the columns.,business intelligence manager,Research,Used the software for: 2+ years
web_scraper,A powerful yet demanding scraping tool,"A rather demanding tool, Web Scraper is not for the faint-hearted! Among the no-code folks, it's a safe bet to say that only the rather tech-savvy tier will be able to find their way in this tool, but it's definitely worth the effort. The learning curve may seem intimidating at first and the results are sometimes less spectacular than expected, but it's a readily available tool that can save the day when other no-code tools just won't work.",Guillaume M.,5.0,"February 17, 2024","Web Scraper is very thorough and will help you get out of many an awkward situation. When your target site is too exotic for PhantomBuster and you can't be bothered to set up properly the sometimes-labytinthine Octoparse, this tool will help you out! It integrates easily within Google Chrome's developer tools. Also, you get a choice of csv of xlsx format files to save your data.","For a no code tool, Web Scraper is rather demanding and you'll have to face a learning curve before you can get proper results out of it. The absence of a proper graphical interface for the scraped data tree may seem intimidating at first, but you soon find your way. Also, sometimes (especially with poorly-made websites and directories) you may have a hard time getting already discriminated data. Oh, and don't forget to save your data immediately after it was scraped: one more scraping afterward and it's lost forever!",Growth Hacker,Computer Software,Used the software for: Less than 6 months
web_scraper,A good tool for web scraping and data extraction,"A good tool for web scraping, including for those without significant expertise in this area (ie: non-programmers).",Julian H.,4.0,"June 6, 2023",A decent option for web scraping / data extraction from websites. It's relatively easy to use; those without deep knowledge in this area can still set up and execute tasks. The scheduling options are also a big bonus here.,"There are some specific problems with more complex websites, or websites that differ significantly in structure. This can cause issues, but can ultimately be worked around as long as the setup is done correctly - but this obviously adds time to the overall process.",UX Consultant,Design,Used the software for: 1-2 years
web_scraper,Un modo semplice per raccogliere informazione da pagine web ,"Utilizzo Web Scraper per monitorare il contenuto degli annunci pubblicati sul sito per cui lavoro, migliaia al giorno, e salvarli in database specifici da dare in pasto ad un modello pre-addestrato in grado di individuare potenziali annunci fraudolenti o che violano le policy del sito. I dati salvati, inoltre, sono usati a fini statistici e per migliorare il modello su citato. Con Web Scraper posso semplicemente identificare il contenuto dell’annuncio, il prodotto venduto ed il suo prezzo, e per esempio, rilevare oggetti molto costosi venduti ad un prezzo sospettosamente basso.",Rosa B.,5.0,"August 10, 2023","Web Scraper è un estensione web semplice da installare, in grado di navigare, in autonomia, tra pagine web multiple scritte in AJAX o JavaScript. L’estensione è in grado di estrarre informazioni anche da pagine che si caricano dinamicamente e può salvare le informazioni di interesse in file, di vario tipo, che è possibile utilizzare per analisi specifiche. La configurazione dei selettori CSS nel sitemap per avviare il processo di scraping risulta molto agevole.","L’aspetto da migliorare del software è legato al blocco che lo stesso incontra in caso di errore. Nel momento in cui non riesce ad estrarre informazioni da una determinata pagina si blocca e non prosegue con i task che gli erano stati indicati. Sarà e opportuno superare questo scoglio, consentendo all’estensione di completare il lavoro anche in presenza di errori.",Data engineer,Internet,Used the software for: 1-2 years
web_scraper,Simply AMAZING and a time saver,,Hemal B.,4.0,"August 11, 2023","A simple and powerful tool that surpasses others out there. It includes multiple elements for extracting data from the web. I have tested numerous tools, but Web Scraper is truly amazing. It's easy to use, fast, and allows exporting to Excel and CSV files. Highly recommended.","In the beginning stage, it is quite complicated to use.",CEO,Marketing and Advertising,Used the software for: 2+ years
web_scraper,One of the best web data handler,,Verified Reviewer,5.0,"January 4, 2023",It is really working well and stable. It allows us to get data from websites.,Sometimes it crashes and all process is being stopped.,Head of Enterprise Systems,Food & Beverages,Used the software for: 6-12 months
web_scraper,Ideal para tienda de viajes online,,Mónica D.,5.0,"February 4, 2023","Me resultó siempre muy fácil de escrapear el contenido de guias de viaje. En mi caso lo utilizaba para crear contenidos de viajes de golf, y extraer algunos detalles e imágenes.","La dejé de utilizar, porque fallaba en mi ordenador, y no sincronizaba todo. Posiblemente era un error mio de no saber utilizarla bien, porque es potente y asequible.",Founder,Marketing and Advertising,Used the software for: Less than 6 months
