product_id,review_title,description,author,rating,date,pros,cons,author_profession,author_industry,author_duration
ranklytics,Worth every penny. A must have!,Love it. Worth every penny. I hardly use anything else now.,Jason O.,5.0,"December 20, 2024",It's an all-in-one SEO solution. I used to use several different tools but now I only use Ranklytics.,I really cannot think of any cons. Maybe just not finding it sooner. :o),Consultant,"Health, Wellness and Fitness",Used the software for: Less than 6 months
ranklytics,Strong SEO and Ai Writing contender,"Intrigued, So many useful good features.",Rick S.,5.0,"September 23, 2024","AI-powered SEO platform offering tools for content optimization, keyword research, and competitor analysis. Leverages AI to streamline processes and provide data-driven insights. Strengths include long-form content generation, detailed content audits, and competitor analysis features. Well-suited for content-centric SEO strategies. May require supplementation for local SEO-focused users.","As typical for an early stage startup, they need more thorough help and user documentation. As with many comprehensive SEO tools, there may be a learning curve for new users to fully utilize all of Ranklytics features effectively. I hope to see this documentation or help videos built out over time in the near future.",Director,Marketing and Advertising,Used the software for: Less than 6 months
ranklytics,A excellent SEO software,"so far so good, is very intuitive and easy to use",MArio C.,5.0,"March 24, 2025",usefully and tactical SEO software for my website,few automatized AI content monthly to my site,CEO,Consumer Goods,Used the software for: 6-12 months
ranklytics,"Great for SEO, but still needs some improvement","Ranklytics has been a valuable tool for improving my SEO strategy, providing useful insights and features that streamline the optimization process. Despite some minor performance issues, it has greatly enhanced the efficiency of my content creation and keyword tracking efforts.",Pierre F.,4.0,"September 23, 2024","This tool has an intuitive interface and the ability to generate optimized content quickly, thanks to its powerful keyword research and content planning tools.","The occasional slow performance when generating reports, and the lack of seamless integration with other third-party tools.",Admin and posts writer,Internet,Used the software for: Less than 6 months
ranklytics,Great Tool for SEO Beginners and Pros Alike,"So far, very good. Still exploring features and capabilities. Looks like it is a robust program overall.",Richard W.,5.0,"September 24, 2024","As someone relatively new to digital marketing, I was excited to find a tool like Ranklytics that could help me on my SEO journey. Since getting started, I’ve already noticed a bump in my Google PageSpeed Insights rating, which has been a definite win for my website. The platform is user-friendly and offers a wealth of features that are both accessible to novices like me and, I suspect, powerful enough for more experienced users. What I appreciate most is how intuitive the interface is, making it relatively easy to understand what needs improvement and how to tackle it. The insights provided are clear and actionable, which has been motivating as I continue learning. I’m excited to explore more of what Ranklytics has to offer and to become more proficient in using its tools. Whether you’re just starting with SEO or looking to refine your strategy, Ranklytics is definitely worth checking out.","As a relative beginner, a step-by-step guide to get the most out of Ranklytics would be nice. I realize not everyone will need it.",Owner,"Health, Wellness and Fitness",Used the software for: Less than 6 months
ranklytics,Outstanding All-in-one SEO toolkit,"This tool is very promising as it offers an all-in-one solution for SEO and keyword research, technical SEO, on-page SEO, and keyword planning. Overall, it's the most outstanding tool I've come across in a long time that provides such comprehensive features. I'm looking forward to seeing its future developments.",NASH Y.,5.0,"September 29, 2024","Ranklytics is a very powerful tool that offers great potential. It provides unlimited keyword research and keyword audits. I believe it is the only tool on AppSumo that includes all-in-one technical SEO, on-page SEO, and SEO writing. Overall, it offers a really great experience.","This software is still in its early stages, but it has significant potential. I hope that in the future, they will add features for both internal and external linking. Additionally, it would be great if they could include an FAQ section and improve the image generation, perhaps by using the flux model.",Founder,Education Management,Used the software for: Less than 6 months
ranklytics,Ranklytics helps me post consistently,"I've had a really positive experience with Ranklytics. The tool has made it so much easier to keep up with my content schedule and track how my sites are performing. Even though I need to touch up the AI-written content, it's still way faster than writing everything from scratch. Keyword research helps me with my writing topics and shows if my SEO efforts are working. For what I paid, I feel like I got a great deal. I'm posting more consistently, spending less time writing, and getting better results. I'm excited to see what new features they add, but even with what it offers now, I'm a happy customer. If you're looking for a way to streamline your content creation and SEO, I'd definitely recommend giving it a try.",John H.,5.0,"November 9, 2024","The best thing about Ranklytics is how it helps me stay on top of my content schedule without spending hours writing. The AI writer gives me good drafts to work with, and the keyword research shows me exactly what topics to focus on. While I still need to edit the content, it's way faster than starting from scratch. I really like that I can track everything in one place. Instead of guessing whether my posts are doing well, I can see actual results. After struggling to post regularly for so long, it's nice to finally have a tool that makes the whole process easier. I feel like I'm finally getting ahead with my content instead of always playing catch-up.","The only real downside I've found is that I still need to edit the AI-written content before posting it to my sites. While it's not a huge issue and the edits are pretty quick to make, it would be nice if the content was ready to publish right away. Still, this is a minor complaint considering how much time I'm saving overall.",Founder,Legal Services,Used the software for: Less than 6 months
ranklytics,Great SEO Content Writing Software,Great SEO Writing Software with Content Gap and Competition Analysis Feature. Very beginner friendly as well,RAKHUL P A.,5.0,"September 27, 2024",Liked the Content Gap Feature and the Competitor Analysis. Very easy to use as well,As of now no drawbacks and all features are getting updated properly.,Marketing,E-Learning,Used the software for: 1-2 years
ranklytics,Very promising tool,I'm a new user but have run two test projects out on my account to learn that this is worth rolling out to our SEO clients.,Zack E.,5.0,"October 23, 2024",The interface is logical so that it is easy to see where you are in the keyword research and content planning phases without being overwhelming.,Currently there isn't an integration with Google Search Console and I'd like to see more controls for client access. This has the makings of being a fantastic tool I could share with my clients if there is more development in this area.,Owner,Information Technology and Services,Used the software for: Less than 6 months
ranklytics,Content Writing Made Simple,,Austin N.,5.0,"June 2, 2025","How easy it was to write content and how much their platform is capable of generating. SEO optimized blogs can be generated in large batches, ensuring an extra value-add for all our agency clients.","I wish that Ranklytics had better keyword tracking dashboards, but the content writing alone makes this well worth the money spent.",CEO,Marketing and Advertising,Used the software for: Less than 6 months
ranklytics,Sorprendido para bien,me ha sorprendido que es muy fácil de usar y muy completo,ADRIAN RODOLFO H.,5.0,"September 23, 2024",Muy fácil de usar e intuitivo. Venía de estar usando Chat GPT y la diferencia es muy grande.,"Sinceramente, por ahora todo ok. No hay nada que eche de menos.",CEO,Market Research,Used the software for: Less than 6 months
ranklytics,New to SEO and content writing,"Running a new business, where I have to look at competition and potentially outrank them SEO-wise, Ranklytics proves to be a really good tool to have on hand. You get great insight into how your website performs, and it can also help you write SEO-optimized text.",Sigurd R.,5.0,"September 24, 2024","Easy entry into SEO and content writing, that is a huge help.",Being new doing SEO requires a bit more work.,Owner,Information Technology and Services,Used the software for: Less than 6 months
ranklytics,Great tool to optimize publications,"It is a basic tool for solopreneurs, but also for companies that want to improve their competitive position. It connects to schedule and calendar publications, which can save a lot of time. It will be good to see how it develops over time.",Victor German H.,5.0,"September 26, 2024",You can connect the tool to wordpress sites and automate publications,More tutorials are needed to take advantage of all their functionalities,Founder,Marketing and Advertising,Used the software for: Less than 6 months
ranklytics,"Solid Tool for SEO, but Reporting Features Needed","My overall experience with Ranklytics has been positive. The tool offers powerful features like content gap analysis, which have helped me identify opportunities to improve my rankings. The user interface is fairly intuitive, and the AI-driven content creation is a real time-saver. However, I believe the keyword filtering options could be more advanced, and the inability to export reports is a limitation. Despite these minor issues, Ranklytics has proven to be a valuable tool for improving my SEO strategy.",Tuan T.,5.0,"October 9, 2024","What I liked most about Ranklytics is the Content Gap feature. It helps me identify opportunities where my website can improve by finding keywords and topics that competitors rank for, but I don’t. This gives me a clear roadmap to create targeted content that fills those gaps, boosting my chances of ranking higher in search results.","What I was least satisfied with is that Ranklytics doesn’t have a good keyword filter. For example, I can't filter keywords by including a specific word with a difficulty score between 0 and 10, which makes keyword research a bit harder. Additionally, it doesn’t yet allow exporting reports, which would be helpful for sharing and reviewing SEO data with my team.",SEO Specialist,Marketing and Advertising,Used the software for: Less than 6 months
ranklytics,Better than its competitors!,"I tested Ranklytics thinking it's going to be another AI content generator, similar with the dozen I already used. However, I discovered that content quality was much better than what I could get using the current AI models. Congrats to the devs!",George D.,5.0,"February 3, 2025","Ease of use, quality of generated content. Ability to publish content straight to WordPress.","Nothing to dislike so far. I needed to wait a few minutes until my project was set up, but it was a big site.",Consultant,Marketing and Advertising,Used the software for: Less than 6 months
ranklytics,"Does what it says, plus a great interface",Nothing but positives so far. The software is intuitive and visually appealing. It leads you step-by-step to great long-from content results.,Jonathan T.,5.0,"April 14, 2025","Extremely easy to use, and has a pretty comprehensive set of tools.","Like with any content writer, the output needs to be edited a bit to end up with the desired result.",Broker,Real Estate,Used the software for: Less than 6 months
ranklytics,A tool that enables both cost-effective and SEO scoring,,Eiichi M.,5.0,"May 14, 2025","Easy-to-use, in-depth article mass production for traffic acquisition and SEO improvement, as well as dedicated tools to enhance on-page SEO for any project.",It took me a little while to get over the learning curve. I was looking at scoring against outcomes to find the right answer,CEO,Computer & Network Security,Used the software for: Less than 6 months
ranklytics,Met my expectations and more,Easy to integrate and works like the software I was already using.,Shay D.,5.0,"February 12, 2025","This has SEO tools, rank tracking, and seo gap information all in one place. It replaces at least two tools I've been using.",I've only been using it two weeks so I don't have anything that has come up yet.,Therapist,Mental Health Care,Used the software for: Less than 6 months
ranklytics,Streamline Your SEO Strategy with Ranklytics.ai,"As an avid blogger, I am constantly looking for tools to streamline my content creation process. Ranklytics.ai has been a game-changer for me. This AI-driven SEO tool generates ready-to-rank articles on auto-pilot, saving me valuable time and effort. The intuitive interface and seamless integration make it a breeze to use, even for those with minimal tech skills. My articles have not only been easier to produce but have also consistently ranked higher on Google, faster than ever before. Ranklytics.ai has truly revolutionized my SEO strategy, transforming it into an efficient and effective process. The results speak for themselves—the improved rankings have boosted my site’s visibility and traffic. Highly recommended for anyone serious about improving their online presence!",Vatha P.,5.0,"September 18, 2024","Ranklytics.ai is a useful tool for bloggers. It helps create articles that can rank well on Google, saving time and effort. It's user-friendly, even for those who aren't tech-savvy. My articles get better rankings quickly, making my SEO process easier. These higher rankings have increased my site's visibility and traffic. I recommend it for boosting online presence!",The operation requires some getting used to.,Managing Director,Marketing and Advertising,Used the software for: Less than 6 months
ranklytics,Worth to purchase,"Ranklytics SEO Writing Tools offer a comprehensive solution for content creators and SEO professionals. With its user-friendly interface and powerful features, it’s designed to optimize content while making the writing process more efficient. Users can seamlessly incorporate relevant keywords, track SEO performance, and ensure their content aligns with current search engine algorithms. The tool is particularly useful for those looking to improve organic traffic and search rankings.",Andrew C.,5.0,"September 20, 2024","Semantic Keywords are good to go. SEO score perfect working, External link work well. Content so far i think okay.",*Analysis Pages are very very slow. *SEO Score not able to tune If you want to rank high score. ( Must have guide ),Marketing Team.,Marketing and Advertising,Used the software for: Less than 6 months
ranklytics,best seo tool,"i love it, it automates big part of my writing",Albert A.,5.0,"November 13, 2024","after months of playing with chatgpt and claude, i finally found an easy tool that just works. it even allows me to target specific keywords and provide with articles, is a marvel","i found dificult to set stats and for it to use them, and modify titles on the fly before the writing",Consultant,Fund-Raising,Used the software for: Less than 6 months
ranklytics,The option to analyse the content gap is amazing,"Intuitive and very efficient to use, to get rankings better.",Dirk M.,5.0,"September 26, 2024","Ranklytics is a robust AI-powered SEO tool that analyzes over 200 ranking signals to help marketers and small businesses improve their search rankings. The tool excels at generating SEO-optimized content using GPT-4, automating everything from keyword research to on-page audits. Its ability to identify content gaps, track competitors’ keywords, and provide actionable SEO insights is a major time-saver. With support for 58 languages and seamless WordPress integration, it’s ideal for global reach. A strong contender for those seeking to automate and enhance their SEO strategies efficiently.",I can´t say anything negative about this tool.,CEO,Online Media,Used the software for: Less than 6 months
ranklytics,"Excellent AI writer, and what is more, it can analyze every single existing article","I've tried AI writers like Junia AI and KWhero, but Ranklytics' ""AI Writer"" stands out. The content is well-structured with references, though some sources can't be verified, raising trust issues. The ""Audits"" feature provides detailed insights but includes some irrelevant suggestions. ""Analysis of Pages"" has a narrow score range, with most articles scoring high, making it difficult to identify which need improvement. Despite these areas for improvement, the tool offers a strong starting point for optimizing blogs.",Takeshi A.,5.0,"September 22, 2024",The quality of articles they create is excellent.,It sometimes takes long to complete audit.,Owner,E-Learning,Used the software for: Less than 6 months
ranklytics,Perfect for keywords and articles,I am really enjoying my experience. The topics are perfect even I want to read when I saw it.,Doruk K.,5.0,"September 19, 2024",First I was suspicous about the google hates gpt created blog posts. But you can adjust of them. The topics are perfect and keywords that ranklytics found are best.,Sometimes you should refresh the page but I think it will be gone with an easy fix.,Owner,Information Technology and Services,Used the software for: Less than 6 months
ranklytics,Ranklytics: A Solid SEO Solution for Ranking Monitoring,"I’ve found Ranklytics to be a great solution for those like me who work in digital communication and need a reliable system to monitor the ranking of their projects. The interface is very intuitive, and the ability to monitor keywords and competitor rankings in real time is a huge added value. I especially appreciate the clarity of the reports and the ease of use. Although it lacks some advanced features that could be useful for SEO experts, Ranklytics strikes the perfect balance between simplicity and functionality. I highly recommend it to freelancers and small businesses looking for an effective tool without the complexity of more intricate software.",Iacopo G.,5.0,"September 22, 2024","Easy-to-use interface, excellent tracking tools, quick support.",Could improve in terms of dashboard customization.,Visual Designer,Media Production,Used the software for: Less than 6 months
