product_id,review_title,description,author,rating,date,pros,cons,author_profession,author_industry,author_duration
similarweb,Must Have For Every Site,,ANDREY V.,5.0,"November 5, 2025",One of the most valuable softwares in my tool box for competitor analysis and helping rank my site. I am able to collect data quickly and pass it on to other members on my team.,"I can't really complain about anything, I have used similarweb for over 10 years now and use it for nearly every project.",CEO,Marketing and Advertising,Used the software for: 2+ years
similarweb,Similarweb is the leading industry market intelligence tool,"Similarweb is a market intelligence platform that provides meaningful insights to brands and agencies. Similarweb offers a number of key features including Search, Gen AI and Ad Intelligence, as well as website and app research. Similarweb enables us to provide our clients with detailed competitor benchmarking and understand the market landscape as well, both through the platform and their API offering, which is the most advanced API available compared to other relatable tools.",Ben N.,5.0,"September 9, 2025","By segmenting website traffic in Similarweb, we can now precisely measure website traffic to specific pages and folders across competitor domains. The new ""All Traffic"" view for marketing channel sources also allows us to determine which channel sources are driving traffic to the relevant page/folder being analysed.","I genuinely can't think of anything I dislike about Similarweb. They're consistently innovating with new features, such as their AI Intelligence tools, which have provided us with valuable insights into our clients' competitors and enabled us to learn more about new categories in global markets as well.",Insights and Effectiveness Manager,Marketing and Advertising,Used the software for: 2+ years
similarweb,"Fast and Reliable Digital Insights, with AI Potential","Overall, SimilarWeb is a fast and valuable tool for regional competitive analysis in organic and paid search, offering clear insights into trends. While I find the new AI features helpful as a data point, I'm currently assessing their long term reliability. It's become a staple in my SEO toolkit.",Edward T.,4.0,"April 13, 2026","What I value most is how it delivers quick, reliable data on competitor traffic across different regions, both organic and paid search. It's great for spotting trends. I also appreciate the recent addition of AI referral tracking, which provides an extra data point, even if I'm still assessing its trustworthiness.","The main drawback right now is the uncertainty surrounding the newer AI traffic metrics. While it's a useful additional data point for tracking referrals from things like Gemini or ChatGPT, the data is still in its infancy, and I’m hesitant to base major business decisions on those figures just yet. Also, because the platform is so comprehensive, it can feel like a lot of the broader features go underutilised if you're already running a specialised suite of other SEO and search tools.","VP, Earned Media",Marketing and Advertising,Used the software for: 2+ years
similarweb,Review of Similarweb,,Sahib S.,3.0,"July 9, 2024",Has tons of information shown on the platform,Not the most intuitive product out there,Sales Manager,Marketing and Advertising,Used the software for: Less than 6 months
similarweb,SimilarWeb Provides Robust Data Intelligence & Insights,"Overall my experience has been positive. It is relatively intuitive to navigate, is frequently updated, and provides valuable insights across a broad spectrum of digital activity.",Brian M.,5.0,"December 24, 2025","SimilarWeb is an extremely comprehensive platform for digital landscape insights. It is helpful with identifying competitor tactics, SEO-related research, and gathering general traffic insights. In my experience there is no other platform that comes close from a data robustness perspective.","There are inherent data accuracy limitations, although all similar tools face the same ones. The data should be taken with a grain of salt and used directionally as opposed to literally. There is huge number of sections within the platform which can make it challenging to navigate at times, but the search feature and customer service are very helpful.","Senior Director, SEM",Pharmaceuticals,Used the software for: 2+ years
similarweb,A Go-To Platform for Competitive Intelligence,"Overall, my experience with Similarweb has been very positive. It’s an easy-to-use platform that gives me the competitive insights I need quickly, without the long waits I’ve experienced with other tools. Similarweb has beta programs that help me think of new solutions for my clients and help me effectively tell a story.",Daniel R.,5.0,"September 9, 2025","Similarweb is an easy-to-use SEO tool that helps me deliver value and competitor insights to my clients. I use it to track how ads, audiences, and traffic shift over time, and I can quickly compare data across periods without waiting for the insights I need","No software is perfect, and I do have a few wish-list items I’m looking forward to. I’d like to see more creative examples across display, video, and social advertising, as I often have to rely on LinkedIn’s Ads Library to fill the gaps in creative reporting. I’d also like broader coverage of display networks, as well as estimated budgets for display, so I don’t need to turn to another tool like AdBeat.",Digital Media Manager,Marketing and Advertising,Used the software for: 1-2 years
similarweb,Similarweb has helped amplify my SEO strategy for clients,"After using a number of SEO tools over my 15 years in the practice, Similarweb is by far my favorite. There's so much impactful data I am able to extract and put into client presentations that help illustrate a story that I normally wouldn't be able to cover with other tools.",Leslie B.,5.0,"September 5, 2025","Incredible SEO data all in one place: Extensive competitive comparison data, search volume trends over time, visibility into AI referring domains and prompts, how all channels together are driving growth, and much more!","Sometimes it can be hard to find a certain feature you're interested in, so I end up looking it up. Some features are great but you have to pay for to see.","VP, Performance Content",Marketing and Advertising,Used the software for: 2+ years
similarweb,Best tool to benchmark performances of your competitors' website,Getting access to Similarweb is the best way to benhchmark your performances and progresses month over month versus your competitors in each country. Similarweb is also releasing regularly new functionalities to provide ever more insightful learnings (e.g. mobile app performances),Thibault D.,5.0,"September 1, 2025","I really like using Similarweb to benchmark the number of visits, duration and sources of traffic of my closest competitors in the different EU markets. Similarweb is offering a very intuitive user experience that directly provides a lot of insights to optimize my own traffic acquisition strategy (either on organic and paid channels)","The only negative point is the cost of the tool, which makes it too expensive for smaller companies (or companies with limited marketing budget)",Chief Marketing Officer,Automotive,Used the software for: 2+ years
similarweb,Similarweb can Accelerate Your Digital Growth,,Luciano T.,5.0,"April 14, 2026","From what I've seen in reviews of Similarweb's platform, I appreciate the wealth of data and competitive insights it provides. Many find it invaluable for understanding industry trends, benchmarking performance, and identifying high-quality leads. The platform's ability to offer a comprehensive view of digital activity, including traffic sources, audience demographics, and keyword analysis, is frequently highlighted as a key strength.",The fact that there's limited data regarding very small markets or regions like small countries in the Latin America region.,International Dev,Gambling & Casinos,Used the software for: 1-2 years
similarweb,Handy tool for monitoring market trends and competitor traffic.,Similarweb provided us with a better understanding of where we stand within the market. It’s affected both our product messaging and channel strategy.,Miles H.,5.0,"July 30, 2025","I enjoy seeing how competitors are doing in the terms of traffic sources, top pages and audience geography. It’s enabled us to benchmark ourselves and find gaps.","Much of the deeper data is locked behind the enterprise tier, and for niche B2B markets, the data can be hit or miss.",Product Analyst,Business Supplies and Equipment,Used the software for: 2+ years
similarweb,Game Changer For Net New Sales Reps!,"From my perspective, Similarweb is a tool that’s indispensable for one key thing: competitive analysis. When I need to understand what our competitors are doing, their overall digital strategy, and where they're getting their traffic from, this is the first place I go. I find the data on traffic sources—like which sites are sending referrals, what paid campaigns are running, and what keywords are driving organic search—to be incredibly insightful. It lets me see the full picture and helps me build a stronger case for a new strategy or a change in our approach. I love how intuitive the dashboards are; it’s easy to pull up a competitor and quickly get a clear snapshot of their performance.",Blake M.,5.0,"September 1, 2025","The primary strengths of Similarweb center on its powerful competitive intelligence and market analysis capabilities. It gives you a comprehensive, 360° view of the digital landscape. Other areas I use it for are: Detailed Traffic and Engagement Data & SEO and Keyword Research. It's definitely a must-have tool for marketers, strategists, and analysts who need to understand their competitors' digital strategies.","High Cost and Limited Features in Lower Tiers: The pricing expensive, especially for small businesses, freelancers, or individual users. Many of the most powerful and valuable features, such as granular country-specific data, more historical data, or API access, are locked behind expensive, high-tier enterprise plans.",Account Strategist,Information Technology and Services,Used the software for: 1-2 years
similarweb,Excellent Competitor Intelligence,We use Similarweb daily to inform our digital strategy for clients. It is an essential part of our toolkit.,Joe M.,5.0,"September 1, 2025","The wealth of features offered by Similarweb, across SEO, Market Insights and Competitor Intelligence.",Newer functionality is often gated behind ever-increasing subscription tiers. The sampled data and high threshold for analysis can also mean we are unable to use it to analyse smaller brands.,Head of Web Strategy,Information Technology and Services,Used the software for: 1-2 years
similarweb,SimilarWeb: a powerful SEO tool,,Liza R.,5.0,"September 1, 2025","Similarweb is an incredibly powerful digital intelligence platform. While I found its performance and speed to be excellent, the real value lies in its features for strategic competitive analysis. For SEO, it's a fantastic big-picture tool for understanding market trends and competitor strategies, though it doesn't replace dedicated platforms for in-depth keyword research. Ultimately, its ability to provide comprehensive market and competitor insights can justify the cost for businesses that need a holistic view of the digital landscape.","The initial learning curve, which may seem challenging at first, is simply a reflection of the platform's incredible depth and the sophisticated level of insights it provides to those who are willing to master its capabilities.",Analytics Specialist,Marketing and Advertising,Used the software for: 2+ years
similarweb,Strong Insights Tool,We have continued to enjoy similarweb and would recommend to anyone looking to gain actionable insights,James K.,5.0,"September 1, 2025",Great insights tool that proves its value for money time and time again - easy user interface makes finding relevent data easy,"There are no main issues with similarweb, and they are often rolling out new features that help with insights",Marketing Manager,Marketing and Advertising,Used the software for: 2+ years
similarweb,Essential Tool For Advertisers,,Amy G.,5.0,"October 7, 2025",It helps me to understand the competitive landscape in advertising. It is always improving its tool and looking for user input.,The interface is sometimes confusing to find features and doesn't flow very well from one section to the next.,Digital Marketing Specialist,Computer Software,Used the software for: 1-2 years
similarweb,Great for my purpose!,I love using SimilarWeb to look at website visits in my role,Verified Reviewer,5.0,"February 4, 2025",Similar web is great for me to see site visits and determine if it is an account I can work or not,Have not ran into any issues with SimilarWeb yet,Sr SDR,Computer Software,Used the software for: 6-12 months
similarweb,Good and fast overview of traffic stats,"I use it to get a quick overview of web traffic and stats for important websites in my niche. This can give me inspiration. Also, the comparison tool is a good way to directly and visually compare my own website with others.",Mikael M.,5.0,"May 5, 2025",It is easy to get an overview of website traffic and it gives you a great overview of the most important metrics.,"It used to be easier to use, but it has become a bit more confusing to get started, in my opinion. It will still not be too difficult, but if you are a beginner, you just need to be prepared to spend some time getting started.",Owner,Entertainment,Used the software for: 1-2 years
similarweb,Director of Media Partnerships,I have been using SimilarWeb since 2016 for research and marketing strategy purposes and it's an essential tool for me and my team.,Shiran H.,5.0,"September 19, 2024","Website performance, Similar Sites, and the extension are awesome, I use them daily.",Sometimes the data is not 100% accurate but the trends are accurate.,Director of Media Partnerships,Financial Services,Used the software for: 2+ years
similarweb,Use as a Guide and not as a Decision Maker,"Its decent. I use it on a daily basis to help guide decisions but I don't use it to be the main deciding factor. If any platform can become the main decision maker, then you know its the best. Right now SW is more like a guide rather than a confirmation.",Raj G.,4.0,"September 27, 2024",Its easy to navigate and quickly gives you a wealth of information.,Too costly without knowing with certainty that the data is a 100% accurate.,Business Development Manager,Online Media,Used the software for: 1-2 years
similarweb,Must-Use Product,"Similarweb helps me be ""smarter"" at my job. Their platform is easy to use, and I love that they are constantly innovating. Their team is also very hands-on and is available whenever I've needed help.",Karly A.,5.0,"September 23, 2024",The custom industries feature—it allows me to look at a collection of website and view their aggregated data more holistically.,"This is a larger industry problem due to privacy issues, but I wish it had more mobile data.",Marketing Analytics and Research Manager,"Leisure, Travel & Tourism",Used the software for: 2+ years
similarweb,Great amount of data and easy to use,It´s a faschinating product that provides valuable insights,Ola W.,4.0,"September 27, 2024",The easy of use and the large amount of data available,I am lacking filters and views for vendors/brands,Business Development Manager,Information Technology and Services,Used the software for: 1-2 years
similarweb,financial affiliates research ,"overall my experience with similarweb is good, the tools help me to find new affiliates + analyze website traffic",ariel R.,4.0,"September 18, 2024",website analysis + affiliate research tools,i would like to get more similar sites results + easier ways to find financial affiliates,account manager,Financial Services,Used the software for: 2+ years
similarweb,Similarweb use for germanos.gr and competitors,"Overall very good, useful to create reports for a multitude of uses.",Thanasis P.,4.0,"September 27, 2024","Very easy to create various report, the ui is top.","It hadn't caught properly our site traffic lately. we have had increase in traffic over the past 4-5 months, and Similarweb measures a drop.",Digital SoMe senior specialist,Telecommunications,Used the software for: 1-2 years
similarweb,Unlocking Online Success: How Similarweb Elevates Your SEO and Competitive Intelligence,,JITEN M.,5.0,"July 10, 2024","What I love most about Similarweb is how it gives me a deep dive into my competitors' traffic and strategies. The keyword insights are invaluable for planning content that hits the mark. I also appreciate the detailed analytics, which help me track my site's performance and pinpoint areas for improvement. The user interface is intuitive, making complex data easy to understand and act upon. Overall, it feels like having a powerful toolkit for staying ahead in the digital game!","While Similarweb is great, there are a few things I wish were better. Sometimes the data isn't as up-to-date as I'd like, which can be a bit frustrating. Additionally, it has so many features that it can feel a bit overwhelming at first. Despite these minor issues, it's still a super valuable tool for SEO and competitive insights.",Asso. Director Strategy,Marketing and Advertising,Used the software for: 2+ years
similarweb,"A Powerful Platform for Traffic Intelligence, Market Research, and Competitive Benchmarking","Overall, our experience with Similarweb has been very positive. We use it extensively for market research and competitive analysis, as it provides reliable traffic estimates, strong benchmarking capabilities, and valuable insights into digital performance and acquisition channels. The platform stands out for the depth of its analysis, especially when comparing competitors and understanding market dynamics. Features like the Industries section already offer a broad and useful view of the competitive landscape, and the addition of AI-related traffic insights has further increased the platform’s value. In particular, these new capabilities make Similarweb even more relevant today for understanding how visibility is evolving in areas connected to AI-driven discovery, including AEO and GEO. Integration options, including Excel exports and APIs, add significant value to our workflow, allowing us to incorporate data into reports and internal tools. While there is an initial learning curve, and some sections are more detailed than others, the platform remains highly effective once fully adopted. Although pricing is on the higher side, it is consistent with the platform’s professional positioning and the value it delivers. Overall, Similarweb is a key tool in our daily activities, helping us provide more accurate, data-driven insights to our clients and support better strategic decisions.",Caterina V.,5.0,"April 23, 2026","We rely on Similarweb on a regular basis in our market research work to estimate website traffic, benchmark competitors in specific industries, and gain a clearer understanding of traffic acquisition trends. It is an extremely useful platform for comparing companies operating in the same market and highlighting differences in channel mix, growth trajectories, and overall digital performance. One of the aspects we value most is the level of detail the platform provides. The Industries section is particularly helpful because it enables us to analyze several websites within the same category at once, making it easier to identify leading players, detect up-and-coming competitors, and build a more complete picture of the competitive landscape. The platform also offers many ways to explore the data in depth, and the introduction of AI traffic insights is a very welcome addition that makes the analysis even more relevant in today’s context. From a usability standpoint, the interface is clear and user-friendly, even though there is a bit of a learning curve at the beginning due to the breadth of features available. Because the platform includes so many data points and sections, it takes some time to learn where everything is. Once that familiarity is built, however, it becomes a very efficient and powerful tool. Integration is another major strength. The option to export data into Excel is very practical for everyday work, while the APIs offer significant value for more advanced applications. We use them both to feed data into Looker Studio and to support integration with an internal software solution we are currently developing, which makes Similarweb even more important within our workflow. In terms of performance, Similarweb is currently the strongest solution we use for traffic analysis. It combines broad coverage, ease of use, and analytical depth, making it highly effective for competitive benchmarking and market intelligence activities. Pricing is certainly a factor, as it is a premium platform, but this is aligned with its professional positioning. For organizations that depend heavily on traffic intelligence and competitor analysis, the value delivered can justify the investment. Lastly, our experience with support and onboarding has been very positive. We have a dedicated contact person who is consistently available and helpful, and we stay in regular contact. This ongoing support makes it easier to take full advantage of the platform and contributes to a smoother overall experience. Overall, Similarweb is an excellent solution for market research and competitive benchmarking, especially for teams that need dependable traffic data, strong comparison capabilities, and flexible integration options.","On the downside, some areas of Similarweb provide more depth than others. For instance, sections like Industries are extremely helpful for obtaining a high-level view of the market and comparing several players at the same time, but they do not always offer the same level of detail available when analyzing individual websites or conducting direct comparisons between a smaller group of up to five sites. Another point to consider is that the user experience evolves quite often. Although the platform remains highly capable, frequent interface updates can require users to spend time readjusting and locating features or data again, which may temporarily reduce efficiency. Lastly, while many datasets can be exported easily, not every insight is equally accessible in a structured format. In some cases, the most practical way to capture certain information is through screenshots rather than downloadable files, which can be a limitation when that data needs to be reused in reports or integrated into internal tools.",Founder and CEO,Market Research,Used the software for: 2+ years
