product_id,review_title,description,author,rating,date,pros,cons,author_profession,author_industry,author_duration
urllo,"Reliable, easy for non-technical users, great analytics","We use urllo for a few things: managing client-facing VDR links, shortening URLs for social media, and to manage when we move content. When I first used urllo I was surprised at how robust and affordable it is - I remember thinking ""why didn't I already know about this??"" I also have really appreciated the learning resources and guides that urllo puts out, they're clear and in-depth so I don't have to wade through forums to find information on best practices.",Jenny M.,5.0,"January 20, 2026","Configurable and reliable redirect tools, with crystal clear instructions and great analytics. Urllo makes it super straightforward for me to manage many redirects with multiple source hostnames, even without a technical background.",Not a single complaint - if anything I'm disappointed I don't have more use cases for it right now. I'm looking forward to doing a site rebuild because urllo will make the url management a breeze.,Chief Marketing Officer,Investment Banking,Used the software for: 6-12 months
urllo,An original service that accomplishes a simple ask but complex job,My experience with Urllo has been extremely positive and I've been a customer for 8 years. I've been on the ground floor with them when they were a small shop and they've always proved their value and worth to me and my employers to accomplish the job and get it done on a project plan or on an overnight request.,Wesley K.,5.0,"January 14, 2026",I've used Urllo as several companies which one of those powering one of the largest streaming services on the planet. Their price point is very appealing and their service accommodates a simple redirect scenario or a complicated one with UTM Parameters and split path redirects with defaults and additional redirects based upon the paths which is very useful for marketing campaigns. Their support is incredible for the platform and they strive to deliver a top tier service and support experience.,"There isn't much to not like about Urllo, it accomplishes everything I've needed and more. My only complaint is the API not offering a full suite of endpoints for the current feature set.",Sr. DevOps Engineer,Broadcast Media,Used the software for: 2+ years
urllo,"Easy Platform, Fast Customer Service","Working with URLLO has been a great experience. Their customer service is fast, thoughtful, and genuinely helpful. The platform is intuitive and easy to set up.",Ben M.,5.0,"February 26, 2026",URLLO is a reliable tool backed by people who clearly care about their customers. Would highly recommend URLLO.,"We honestly have no cons to share about URLLO. The platform has been reliable, and backed by responsive customer support.",Web Applications Manager,Building Materials,Used the software for: 6-12 months
urllo,"Good experience, timely customer support and the software does exactly what is expected.",,Hiep D.,4.0,"July 28, 2017",- Timely and thoughtful customer support - Software is stable and does what it is required to do always,"- Pricing model is a little bit too expensive for companies with only 1 or 2 redirect URLs. - At first, it's not clear that the SSL i provide is not compatible",Head of Architecture,Used the software for: Less than 6 months,
urllo,Set it and Forget it (if you want),,Robert S.,5.0,"March 3, 2022","Easy to setup, deploy, and manage. It's one of those systems that you can configure and forget about. However, if you want to see traffic reports and other data they have that as well.",When first purchasing I thought it was a little expensive (for the SSL redirect). However when I got in and actually saw everything I could do I easily saw the value.,COO,Marketing and Advertising,Used the software for: 2+ years
urllo,Great service. Easy to use and good value.,I can create redirects that aren't possible with any DNS services I've used before.,David H.,5.0,"January 20, 2023",The intuitive dashboard makes it easy to add redirects.,"Honestly, I can't find fault with it. Our needs are pretty simple so EasyRedir has more than we need.",CTO,Financial Services,Used the software for: 2+ years
urllo,So easy to use!,We needed to securely redirect our domain apex to our www subdomain. EasyRedir's team was great to deal with and their automatic SSL certificate provisioning and renewal is awesome! We can set it and forget it!,Alyssa J.,5.0,"October 29, 2018","Once I set the software up, everything else ran automatically. We outsourced our website redesign, so having EasyRedir really helped us get the new site up and running without issue. The directions on how to set everything up were incredibly easy, and I think anyone with basic computer understanding could do it. Definitely recommend!","Nothing bad to say! Everything was easy, from implementation to management.",Marketing Manager,Renewables & Environment,Used the software for: Less than 6 months
urllo,Data Processing Systems Programmer,,Joseph L.,5.0,"April 21, 2023",Easy to configure and use. Great support!,Our colleagues all love this product.....,Data Processing Systems Programmer,Government Administration,Used the software for: 2+ years
urllo,Satisfied User of EasyRedir,,Steve K.,5.0,"January 6, 2022","From my perspective, EasyRedir is the web service equivalent of a Swiss Army knife. It packages a lot of very useful features in a very reasonably priced package. I've been using EasyRedir for a number of years and it has added features that I think I'm not even yet taking advantage of. It's a really useful service for our work.",I'm completely satisfied. There are probably other service available that could meet my needs but I don't see any point in even considering them. EasyRedir is easy to use (especially for someone like me who only dips into EasyRedir a few times a year) and it meets all my needs.,President,Design,Used the software for: 2+ years
urllo,EasyRedir enables quick solutions,,Michael W.,5.0,"October 17, 2022","The simplicity of this software along with its wide reach is invaluable to us. Being able to quickly deploy a global redirect for an advertising campaign, legal initiatives, or M&A activities has never been easier.",Know what you really need from this service and it's hard to identify anything that is unfavorable about it.,Senior Network Systems Engineer,Hospital & Health Care,Used the software for: 6-12 months
urllo,EasyRedirect,Very Good.,Patrick B.,5.0,"March 11, 2020","Being able to redirect a URL is essential for our business, Easyredirect is easy to use and just does what it says on the tin.",Nothing that i can think of at the moment.,IT Manager,"Leisure, Travel & Tourism",Used the software for: 1-2 years
urllo,Secure Redirection,,Terry T.,5.0,"January 28, 2022",Ability to mass import redirects; HSTS redirect support!,Needs better reporting on unlinked target URL's or URL's that get very little/no traffic,VP of Enterprise Security,Building Materials,Used the software for: 2+ years
urllo,web Redirection,"Fantastic, awesome",Sanjay B.,5.0,"October 6, 2022","Easy to use, fast and easy UI, ample redirections",Every aspect was bult for ease of use. great,Security Architect,Computer Networking,Used the software for: 6-12 months
urllo,Easy to redirect,,Manoj P.,5.0,"September 30, 2020",It made it easy to redirect some of our links.,We do not have any bad to say about this software.,VP of IT and Engineering,Hospital & Health Care,Used the software for: 6-12 months
urllo,Pretty simple stuff,Simple tool for startups in mid-development,Angell T.,5.0,"July 20, 2017",Makes it easy to redirect a URL. Worked out great to allow me to have a placeholder for my domain while worked on developing it.,None. I had no problem finding what I needed to do and doing it on my DNS settings etc. There is no other service as simple as this for a cheap price.,Co-founder,Food & Beverages,Used the software for: 6-12 months
urllo,Has made our redirect process for site mergers 10x easier,"Customer support has been very responsive. Lag times on responses are a non-issue, and the staff they have in place to answer support questions almost know too much, and easily communicate it.",Robert S.,5.0,"August 30, 2022","It's hard to narrow it down to just one thing, but the setup, security, and analytics are all incredible. I can't imagine the amount of work that went into building out this software, but it was time well spent.",Really no qualms (so far) on my side. I'll make sure to update if that changes!,Lead Developer,Online Media,Used the software for: Less than 6 months
urllo,"Simple, reliable and fast",,David O.,5.0,"July 25, 2017","The service is very simple, quick to set up and make changes to so far very reliable. That's all I have to say really.","I haven't yet found anything which I think is a con. Some alerting when changes made to redirects would be good, if this was implemented in the form of a Slack integration that would be ideal.",DevOps Manager,Hospitality,Used the software for: 6-12 months
urllo,Easy to use handling for our needs very good.,,Thomas G.,4.0,"July 25, 2017",We need to create shortlinks for our domain. Therefor easy redir is easy to handle - as the name already says. You just have to enter both URLs and here we go. I doesn't work any easier.,To keep the overview of my re-direct is not that easy. You can't filter them by URL oder save search-terms or something.,Marketing Germany,Electrical/Electronic Manufacturing,Used the software for: 6-12 months
urllo,Great fix to host lots on domain name on AWS to get a A-Record issue with ELB's,,Shane B.,5.0,"July 20, 2017",Allows us to host multiple domain name on AWS through ELB's. Great solutions and very easy to use. Would recommend to anyone with the same issue.,The product does everything we wanted it to so we really don't have any cons about it. May be the price could be lower.,Development Manager,Automotive,Used the software for: 1-2 years
urllo,Secure Redirects,"Following a website migration, I needed to setup two secure redirects that had previously been done on-prem. The service I received from EasyRedir was first class, from the point of initial contact all the way through to successful redirects being in place. I was provided very clear instructions of how to setup the redirects and during the waiting period for the certificate to become active, I felt fully supported by their team.",Dan K.,5.0,"June 24, 2019","I particularly like the visitor information dashboard, this is certainly an added bonus. I also like just how easy it is to setup the redirects, the admin portal is very easy to navigate.",There is nothing I do not like about EasyRedir.,IT Support Specialist,Management Consulting,Used the software for: Less than 6 months
urllo,"Simplified redirects, and great support",Until I found this service I didn't even know it could be this easy! I've had a few questions and the developer has been quick and very helpful.,Marc B.,5.0,"January 19, 2016",,,Used the software for:,,
urllo,Super Easy,,Emanuel L.,5.0,"July 13, 2020","The install was simple and straightforward, but the support was beyond what I expected. I did not expect anyone to reply to my chat messages in the middle of the night!",There wasn't anything I didn't like about the software.,Registration and Data Systems Manager,Non-Profit Organization Management,Used the software for: I used a free trial
urllo,This tool is easy to use and does the job very well,Solved many problems and cutcost,Kristjan T.,5.0,"July 25, 2017",It is easy to use the tool. Support for it is great. Pricing is fair. Different payment plans available.,Looking forward for integrated SSL issue (you have to bring your own SSL today) that can be used with re-directs,Director of IT,Transportation/Trucking/Railroad,Used the software for: Less than 6 months
