product_id,review_title,description,author,rating,date,pros,cons,author_profession,author_industry,author_duration
riyo_ai,Best tool for Website Audit,,Aadeeb S.,5.0,"February 2, 2022",We use Traek to track the traffic trends of our website & are quite happy with its performance so far. It is a simple to use tool that offers rich analytics for website monitoring and lead generation. Customer mapping is largely simplified with Traek now. Functional features galore at this analytical tool. Notification alerts and chatbot features are some of the amazing properties of Traek that helps us to get a real-time view of our website traffic and prospective business leads.,"Traek seldom disappoints its users. There is nothing to disregard in terms of functionality and feature set of Traek. However, the software runs slow at times that prolongs the entire process and also disrupts the user experience.",Brand Manager,Food Production,Used the software for: 1-2 years
riyo_ai,Traek - One of the Best Tools You Need For Lead Generation,"i Love this new tool and i have used this now for my business, finding leads and generate sales is essential for online business visitors that traek have provided with my website.",Verified Reviewer,5.0,"August 19, 2022","I like the software interface, it's clean and i can read all data i needed to know about my visitors","I like and love the product but i think they should provide training as this is essential to new user like me, although i figure this out because i have used and tested a lot of lead generation tools so im just very familiar to it.",Digital Marketer,Marketing and Advertising,Used the software for: Less than 6 months
riyo_ai,Good starting point,,Jacob H.,4.0,"February 2, 2022",The product has a good ability to show a point in time view of where you are. This helps with taking a proactive approach to mitigating risk.,Seems like they are somewhat trying to boil the ocean. Need to make sure that they are covering the key value areas and doing them well prior to building out more feature areas.,Product Owner,Information Technology and Services,Used the software for: I used a free trial
riyo_ai,Best Platform to Keep Track of Tasks,"I've been using Traek software for a little over a year now, and I absolutely love it! It's saved me so much time and hassle when it comes to managing my business finances. The customer support is also excellent - they're always quick to respond to any questions or issues I have. I highly recommend Traek software to any business owner looking for an easy and efficient way to manage their finances.",Akshay S.,4.0,"February 8, 2022","Traek software is simple to use and makes it easy to keep track of my tasks and projects, There are many things to like about Traek software. One of the things that I like most is the ability to quickly and easily create custom reports. This allows me to get the information that I need in a format that is easy for me to understand.",There is not much that I did not like about Traek software. One thing that I found to be a bit of a hassle was inputting all of my inventory information.,CEO,E-Learning,Used the software for: 2+ years
riyo_ai,Amazing product with additional features than other Website analytics tool,,Hemant W.,5.0,"January 31, 2022",1. Visitor Tracking 2. Adding companies to the watchlist 3. Real-time monitoring 4. Chat option with real-time visitors.,1) Should have fixed pricing model rather than pay as you go.,Founding Member,Internet,Used the software for: Less than 6 months
riyo_ai,Satisfied with the product,Overall I am happy with the product and the promised done to me while selecting it,Mihir C.,5.0,"February 3, 2022","Chatting, real-time, and watch are the best",Data is comparatively less but it is okay,Marketing Executive,Internet,Used the software for: 6-12 months
riyo_ai,Right for my website,I am really glad I started using this product. Now I can see what happens on my website and also work on it. Leads are more and we are happy.,Rucha J.,5.0,"February 18, 2022","Amazing insights and UX, Very good traffic analytics. Chatting feature is an add on.","Can work on database, it is a bit less or now but they are promising and will upgrade",Product Manager,Internet,Used the software for: Less than 6 months
riyo_ai,Essential Lead Gen Tool ,Great onboarding experience :),Vivek G.,5.0,"March 10, 2022",Traek is one of the essential lead generation tools in Notesally's tech stack. Traek helps us by enabling us to convert a casual visitor to our site into a lead. I love that I can initiate a chat with a visitor using Traek Realtime. Integrating Traek was a no-brainer and their commitment to data privacy is also commendable :),I would love to see a clear demarcation of ISP Name Vs. Visitor's organization in leads view,Co-Founder,Computer Software,Used the software for: Less than 6 months
riyo_ai,Really good for lead Generation and Analytics.,,Verified Reviewer,5.0,"April 28, 2022","Analyzed detailed, actionable marketing reports and the good quality of leads generated.",there are certain similar software with a lower price/lead.,Team Lead,Marketing and Advertising,Used the software for: Less than 6 months
riyo_ai,Get the most out of web traffic with Traek,Lead generation and prioritization.,Brittany F.,5.0,"February 28, 2022",Traek help target quality leads through it’s full-featured lead generation and website monitoring tools.,"Traek offers dynamic data, which is completely different from other related tools.",Sales Marketing Manager,Retail,Used the software for: Less than 6 months
riyo_ai,Amazing Product!,,Nithusha V.,4.0,"February 1, 2022","Easy to use and userfriendly, would try to process is for teams within my organisation","Expensive for startups, but the free trials help to see how amazing it is.",Product Executive,Education Management,Used the software for: I used a free trial
riyo_ai,Very helpful product ,Amazing,Romy D.,4.0,"February 5, 2022",This software has increased efficiency in lead generation,It would be great if a free tier can be implemented for start up companies,Sales Manager,Banking,Used the software for: I used a free trial
