product_id,review_title,description,author,rating,date,pros,cons,author_profession,author_industry,author_duration
glpi,Why recommend to GLPI than other opensource ITSM software,"GLPI is most of the powerful opensource ITSM softwares which can be available to implement both on-premise and cloud hosting. For on-premise, it is totally free of charge or zero cost. There is pricing on cloud hosting if you like to use cloud. There is no limitation for agent counts and IT technicians for IT administration which is very useful for unpaid users. As overall, GLPI is most recommended open-source software when you are searching for similar one.",Aung Htun O.,5.0,"January 31, 2025","GLPI is ITSM software and I am using it in my one of the global leading steel manufacturing. It is easy to management and powerful opensource software. There are rich of features on-premise version when compared to other opensource ITSM softwares. Such as IT Asset Management and IT helpdesk management is really powerful and able to use for enterprise office. Moverover, it is also support to install plug-in by searching it marketplace for integrating. I love that.",Plug in features are need to more improve. Some of management function are need to more improve. Need to improve reporting and auditing logs,IT Manager,Mechanical or Industrial Engineering,Used the software for: 1-2 years
glpi,GLPI as a daily-use product,"It is an advanced and highly developed tool for open-source software. Comparing it to other commercial solutions, I always found myself coming back to GLPI. Although the entry barrier is relatively high, with proper configuration, it becomes a truly excellent ITSM tool.",Verified Reviewer,4.0,"November 25, 2024","GLPI is an interesting tool that facilitates work and organization in the helpdesk department. It allows for numerous automations, such as assigning tickets to specific units based on rules. SLA/OLA times can also be easily configured within the system. It offers a wide range of free plugins, and its large user base makes it easy to solve any potential issues.","The distribution and official support for the product are not the best. In daily operations, some features, such as customizing ticket forms, are often problematic for new users. As a team leader, onboarding new members to the system often takes quite a long time. Many features are not very intuitive.",Coordinator of Service Desk First-Line Support,Outsourcing/Offshoring,Used the software for: 1-2 years
glpi,"Comprehensive administration of IT resources, but not very friendly and dated interface",,Verified Reviewer,3.0,"February 2, 2018","It is free, and even if you are not dealing with IT resources, you can tailor this software to use it to manage your support service. I have used it a couple of years to manage an academic research laboratory in a public University, but migrated to another solution because usability drawbacks and old-fashioned interface. Anyway, I do recommend it for people working with IT, because it is rich inbuilt-in features that makes easier to use it for the purpose he was originally designed for. On the user side, however, the software works without much problems.","The interface is dated, and initially may be very difficult to find where are the settings that the administrator want/need to change.",Assistant Professor,Used the software for: 2+ years,
glpi,glpi a must have tool,managed 1300 workstations and ticketing smoothly for everybody in the interprise a great asset to have,bruno C.,5.0,"January 6, 2025","it is really a multipurpose tool, we are using with the ticketing, but also for maintaining our CMDB. IF you don't need extended features it is free.",If you want to customize the UI it is import to modify php files and understand the glpi DB structure,cio,Hospital & Health Care,Used the software for: 2+ years
glpi,GLPI is an open source ITSM,"For companies who have little budget and they need an ITSM tool is ok, but it's not awesome at all.",Verified Reviewer,4.0,"September 14, 2022","After other ITSM tools, GLPI was not very hard to configure and deploy.",The flexibility for changing the standard behaviour of the solution. You should develop your functionalities. User interface was old style and the users didn't like it at all.,CIO,Information Technology and Services,Used the software for: 1-2 years
glpi,Good open source service management platform,Using that was ok with no big problems. The main point would be the reports and how to export information from there to have dashboards to support business.,Ronald M.,4.0,"November 4, 2021",It is an ITSM that guarantee the management of large IT infrastructures with lots of assets.,It is an expensive tool and it is not easy to configure to have the broad view of all information in there.,Security Information Analyst,"Health, Wellness and Fitness",Used the software for: 1-2 years
glpi,One application for all IT Solutions,"We have been using this software from years now and it has helped a lot to keep track of assets and all the call or tickets reaised, Also can be tracked all the remedy provided.",Raju S.,4.0,"August 14, 2019","This single software has many components software which has helped a lot in tracking the asset and the tickets raised along with solution provided history. All the assets are once updated into the system, It has helped to track assets in and out. It also provides desk support feature by which any body in organization can raise a request and can be tracked the same.","Manual updation, all asset entry has to be done manually. There is no feature for auto discovery like in OCS. Since it is a paid software subscription is required.",IT Engineer,Computer & Network Security,Used the software for: 2+ years
glpi,GLPI is a gem for network inventory and order management once you get past a difficult installation.,"Overall this is a fantastic open source network inventory tool that is free to use and can also be used for order tracking, helpdesk ticketing and more.",Tom R.,4.0,"February 12, 2025","Excellent options for network inventory management, easy to implement with agents on the network (script can be added to GPO) and good selection of very useful plugins.",Diffucult installation and scattered documentation for installation that did not always address issues that came up along the way. Does not always pickup significant peripherals.,IT Specialist,Government Administration,Used the software for: 1-2 years
glpi,GLPi - Solves Asset Management at a Low Cost,"We have been using this system since 2022 and it has made asset tracking, ticketing and even human resources (employee account information) management very simple. For the minimum cost for licensing an open source product, it is well worth the money.",Lew N.,5.0,"February 25, 2025",Inexpensive to purchase and operate. Customizable including branding with break/fix support if paid for license rather than use as open source.,"It isn't the most user friendly system. Some of the menus are ""clunky"" and it can be confusing what the different buttons/options do.",Director of IT,Farming,Used the software for: 2+ years
glpi,perfect combination of asset and service management,"I have been using GLPI since 2007, and i must say that this open source project has developed fantastically. GLPI is, in my opinion, the perfect tool to fully manage an IT department, whether it be IT assets, services, incidents, requirements, projects or licenses of any sized IT environment. But since marketing is rather poor, as is the case with so many open source solutions, GLPI is relatively unknown compared to other ""professional"" solutions. Unfortunately. Because every IT department could easily save thousands of euros/dollars in money.",Karsten F.,5.0,"November 7, 2024",GLPIs combination of asset management and service management makes it unique and extremely useful. GLPI can be used to fully record and manage a company's entire IT. It is also open source and therefore the price starts from exactly $0 / €0 ... The prices for support and the cloud solution are very moderate and the support quality is very good.,"Unfortunately, there is little new in asset management since there was apparently a dispute with the developer of Fusioninventory. For example, I miss the ""recording"" of kubernetes with pods and services. Services, processes and used network ports are also missing on Windows and Linux systems. But it is becoming increasingly important to keep an overview of this.",SAP Basis Admin,Information Technology and Services,Used the software for: 2+ years
glpi,complet et simple,"très satisfait, il permets de suivre nos interventions et l'état du parc très simplement.",Marc H.,5.0,"October 22, 2024","simple à utiliser, dispose de pleins d'option modulable en fonction des besoins. Sert aussi bien de logiciel de ticketing que d'inventaire et de gestion de parc","la configuration peut être difficile, comme il s'agit d'un logiciel open source, pas de support autre que les forums",Technicien informatique,Individual & Family Services,Used the software for: 2+ years
glpi,"GLPi, gestión de bienes.",,Nestor S.,4.0,"November 23, 2022",La facilidad de implementación y utilización.,Complejidad de carga masiva e importación.,Técnico IT,Computer Hardware,Used the software for: 2+ years
glpi,GLPI - review ,Thanks this software I had no issue to plan the budget and manage all IT equipment in company.,Pawel C.,5.0,"May 8, 2020",I worked as a IT asset manager in the past and I've used GLPI to manage all IT equipment in large company (1500+ employees). The software was very helpful and customisable.,The most difficult part of using the software was implementation and configuration- I had internal technical support especially to GLPI.,License manager,Financial Services,Used the software for: 2+ years
glpi,Controle de serviços,não tenho queixas,Fabiana M.,5.0,"April 14, 2023",Ferramenta foi implantada para vários setores da empresa que ofertam serviços e aceita facilmente,"acho o design da estrutura dos serviços oferecidos arcaica, podia inovar",supervisor,Human Resources,Used the software for: 6-12 months
glpi,Simple et efficace ,"Mis en place par notre service informatique, cet outil est simple de prise en main",Rodolphe I.,4.0,"May 2, 2025","Simple d'utilisation, cet outil permet de centraliser facilement la gestion des demandes des utilisateurs auprès du service informatique","Le suivi des tickets n'est pas toujours homogène pour les utilisateurs, ne permettant pas de savoir si le ticket a ete traité ou non. Comme tous les outils de ce type, il supprime le contact humain.",Chef de projet digital,Automotive,Used the software for: 1-2 years
glpi,Monitoring and tracking ,,Carlos S.,4.0,"October 21, 2024",The great app to monitor and tracking our company devices infrastructure,Difficult to implement and configure tua monitoring options.,Quality Engineer,Electrical/Electronic Manufacturing,Used the software for: 6-12 months
glpi,Simple and very useful has helped me to keep my activities organized,"I have had several benefits in my work, I have installed it and everyone likes it, the incidents are handled in an orderly manner and are addressed by priority, it has allowed me to deliver reports with graphics to senior management, in my independent work it allows me to have the incidents of my clients ordered to know what the state is, so that they and I are informed of the situations that arise.",Aníbal M.,5.0,"July 8, 2018","I have installed GLPI in three medium companies and I also use it for my personal projects, I like that it has two large modules, the first of which is the inventory manager, equipment, servers, peripherals, software licenses, network, reservation of shared resources, among others. The second module is the helpdesk for the follow-up of the interventions, allows the administrators and the support staff to link the interventions made to the users and equipment, and can obtain a complete history of maintenance. The graphic interface is currently very well developed and has improved a lot over time. Another thing that I like is that it is easy to use and train the end users is very fast and easy, when you create a incident, it is possible to visualize the state in which you are, which is great to follow. Its integration with ""OCS Inventory"" is one of the best things you can have, after careful work you can get all the information of a company's hardware in an instant, this improves my analysis and planning with my team. I can not forget to mention that the free software that leads to zero installation costs among the many that I have tried GLPI has always been my favorite.","GLPI is a great software, however, there are things that I have had problems with in these years, the integration with LDAP is not stable, it is difficult to obtain the data correctly, I have had difficulties with the assignment of profiles to the users that are imported of LDAP, another thing that I do not like is that it is not compatible with Postgresql, which forces me to use mysql.",Programador,Used the software for: 2+ years,
glpi,"Manage your requests, problems, incidents and projects from a Global platform!","With this tool I managed to consolidate all the inventory of operational areas in a single tool, allowing control to be established, and notifying the involved areas when an asset of the company is incorporated or disincorporated. In addition to the above, I can centralize project management, taking control of the activities that make up the operational projects.",Mairina V.,5.0,"March 19, 2019","GLPI, is the most complete platform to take the management of requirements or requests, incidents in customers or IT systems, Projects, problem management, inventories, finally .. Through this great platform I could organize the management of the entire IT infrastructure . When I started using this great tool, I only managed internal requests, later we added incident management and from one case the client was notified, today I carry the projects of the area and all the inventory control of the operational unit. The truth that has allowed me to optimize operating costs since with the free version I can have breadth when managing the entire area of ​​network operations and administration of IT services.","The truth, with time using the tool there is not a single aspect that prevents me from achieving my operational objectives.",Gerente de Telecomunicaciones e Infraestructura,Information Technology and Services,Used the software for: 2+ years
glpi,Total Control Of IT Infrastructure,"We are top beneficiaries of GLPi's knowledge base - centralizing our corporate's internal knowledge has never been easier. Also, GLPi generates reports of IT equipment utility so you don't have logger heads with HR. GLPi's SQLdashboards and plugins work quite efficiently too.",Verified Reviewer,4.0,"August 24, 2022","Simple management of clusters as it indicates the elements alongside. Swift tracking of our domains and notifies you a week earlier before they expire. Utilizes GANTT model for visualization of assigned tasks, workflows and other collaborators. Integrates well with RSS feeds for real time updates.","For the twenty eight months I have used GLPi, I haven't had any issue with its performance.",Network Engineer,Information Technology and Services,Used the software for: 2+ years
glpi,Um Software ótimo para auxiliar o dia a dia da TI,"A ferramenta nos entrega mais do que imaginamos, só ao começar a usar e mexer na ferramenta que vamos descobrindo o seu real tamanho e aplicando na empresa.",Wilherme C.,5.0,"September 13, 2023","A praticidade em auxiliar tanto o usuario final como os usuários da TI, e quando bem configurado atende a empresa inteira.","Por ser uma ferramenta Free, não podemos exigir muito, mas ela entrega além do esperado, o que as vezes sinto falta é de mais suporte, tirando isso sem questionamentos.",Analista de Infraestrutura,Information Technology and Services,Used the software for: 1-2 years
glpi,GLPI is good product to manage ticket,,Verified Reviewer,4.0,"June 18, 2024","GLPI is very easy to setup and use, provide a good reporting.",I think there is no disadvantage now that the glpi cloud solution exists,Manager On-Premise and Cloud Infra.,Retail,Used the software for: Less than 6 months
glpi,Using GLPI in the Municipal Government of the City of São Paulo,"To meet the goals of the Information and Communication Technology Strategic Planning of the City of São Paulo, we implemented a customized instance of GLPI for the Management of Calls and IT assets. For asset management we used Fusioninventory. This successful implementation allowed us to have better information that supported several decision making processes. From there we expanded the possibility of using the solution to other municipal public administration agencies that needed a solution for the systematization of Call and IT Asset Management The end users learned to use it quickly and it was very well accepted in general. It facilitated and optimized IT Management in all Sectorial Organs where it was implemented. Translated with www.DeepL.com/Translator (free version)",Ricardo O.,5.0,"April 13, 2021",Customizable Robust and easy-to-deploy solution There are several plugins that further assist the customization and solution possibilities for the most diverse challenges The GLPI community is very supportive and helpful in solving any problems,"The use of server disk space can be high depending on the configurations and error logs, which can bring down the application, depending on how disk space management is done.",Planning and Development Analyst Organizational - IT,Government Administration,Used the software for: 2+ years
glpi,El mejor software de monitorización y además hecho en España.,Muy buena,Javier S.,5.0,"March 13, 2023",Facilidad de usa y la ponencia que tiene en funciones de monitorización.,Más plugins abiertos. Algunos plugins antiguos han dejado de tener soporte,Responsable de proyectos IT,Renewables & Environment,Used the software for: 2+ years
glpi,"In my opinion, the most complete tool for an IT department","All about ITIL and a great community providing support, complements that improve the experience as much as user level as administrator.",Daniel A.,5.0,"July 11, 2018","The best tool of all, for the management of Tickets. With its update to 9.3 it took a giant leap with the administration of Racks, excellent visual implementation of the rack and the equipment that is there, easy to manage and manage.","The few shortcomings that you have been able to perceive in each version, always solve them and bring much more improvements with each version, there is a large community that supports and helps the continuous improvement of the tool",Analista de infraestructura,Used the software for: 2+ years,
glpi,We use GLPI and we love it,We have been working with GLPI for 8 years. We have been offering product support in Poland for 3 years. We've spent thousands of hours working with the system and we consider it the best product on the market. We work with the system and offer it to our clients.,Verified Reviewer,5.0,"November 8, 2018","Very extensive functional modules, regular system updates, good product support. Intuitive system operation.",The system accelerated and became even more readable.,Prezes Zarzdu 99NET Sp z o.o.,Outsourcing/Offshoring,Used the software for: 2+ years
