product_id,review_title,description,author,rating,date,pros,cons,author_profession,author_industry,author_duration
manageengine_remote_access_plus,Well priced and very functional Remote Control solution.,Overall good experience and a damn sight cheaper than many other competitors. ManageEngine are a long established and reputable company which shows in the quality of the product.,Wayne H.,4.0,"April 15, 2026","Price and functionality are excellent value for money compared to competitors, it is exceptionally easy to use and roll out. Remote access, once connection is established is smooth and fully functional","Occasionally, for no discernible reason, an agent will fail to respond. Closing the browser and opening it again usually resolves this so maybe cookie handling?",IT Manager,Electrical/Electronic Manufacturing,Used the software for: 1-2 years
manageengine_remote_access_plus,ManageEngine Remote Access Plus Could Edition,"This is a very well rounded product that simply works as advertised. If the remote device has power and an internet/network connection, it connects the first time, every time. The initial setup was very easy and quick. We were up and running within 15 minutes.",Dan C.,5.0,"December 5, 2025","This product excels in ease of use. It simply, 'just works'. This is a full featured remote control, unattended access, product. This product has file transfer, chat and many essential system management tools. The pricing of this is a GREAT value for the features offered. I have not needed to contact their technical support on this product so I have no opinion on the quality of their support at this time.","There are very few things to report as a negative about the ManageEngine Remote Access Plus product. I suppose, the one thing I did notice, when using the remote command prompt, the up and down arrows, to recall previous commands and the tab key to complete a partially typed command, do not work.",Network Engineer,Hospital & Health Care,Used the software for: I used a free trial
manageengine_remote_access_plus,RDP-Manage Engine,"better,Windows Remote Desktop (RDP), macOS Screen Sharing, Linux VNC/SSH,Technicians can fix problems on user machines without being physically present.",mohamed F.,3.0,"January 27, 2026","its cost effective, asset management and Working from Anywhere: Access your office computer from home, a café, or while traveling. Accessing Specialized Software: Use high-powered or licensed software installed on a remote workstation.","slowness,Server Administration: Manage headless servers (like in data centers) from a single location. Collaboration & Training: Share your screen with a colleague or guide them through a process.",IT admin,Automotive,Used the software for: 1-2 years
manageengine_remote_access_plus,Remote Access Plus its a good alternative to traditional APPS,"In our organization, we use RAP for remote technical support to internal clients and to control remote access for external providers, who previously used TeamViewer and AnyDesk without oversight. Having RAP on an on-premises server gives us greater control over users and an additional layer of security, It also allows us to perform various functions without having to access the user's endpoint, thus avoiding interrupting their work",Gabriel C.,4.0,"January 8, 2026","Remote Access Plus connections works well within the LAN, but it's a bit slower outside of it. Its ease of connection, is a plus. You can access the CMD and perform tests without disturbing the user, or review the underlying services. The product's price isn't high and it offers interesting functionality, and if you want to go further, Manageengine offers alternatives with more options.","It is not very suitable for connection through the APP, and consumes too much RAM during the connection, sometimes even causing the endpoint to freeze.",IT infrastructure leader,"Health, Wellness and Fitness",Used the software for: 1-2 years
manageengine_remote_access_plus,"Powerful, Reliable, and Secure Remote Access Solution","Overall, ManageEngine Remote Access Plus has been a lifesaver for our distributed IT team. It’s cut down our response time for support tickets and made system maintenance a breeze. The product feels stable, secure, and well-supported. Even during peak usage, the performance has remained consistent. I also like the transparency of session logs and user activity tracking—it gives us peace of mind from a compliance standpoint.",Rich K.,5.0,"August 4, 2025","The seamless remote access functionality is incredibly reliable and responsive. I particularly appreciate the ability to manage endpoints across multiple networks without any noticeable lag. The UI is clean, intuitive, and makes it easy to navigate even more advanced functions. It’s a huge plus that it integrates well with our existing systems and provides detailed audit logs for all sessions.","Initial setup can be a bit confusing due to the number of configuration options. It would be great to have more in-app guidance or tooltips explaining each feature. Also, the mobile app could use some UX improvements to match the polish of the desktop version.",President,Computer Software,Used the software for: I used a free trial
manageengine_remote_access_plus,Good overall remote access tool for IT support,we use this tool for IT support and IT is a good system and easy to use. the only issue i have with it is that it is not direct connection.,Elie Z.,4.0,"April 5, 2026","Great Value for Money I've checked more than a few remote access on premises application and ManageEngine Remote Access Plus had the best Value for Money! Very Ease of Use, I've installed and configured every possible configuration and didn't have any issues.","had some Connection Issues, the application does not connect directly to the wanted client, the connection is throw the Server and need the server to have access to all vlans on the network. on slow connection the connection doesn't always work.",IT manager,Electrical/Electronic Manufacturing,Used the software for: Less than 6 months
manageengine_remote_access_plus,Infrastructure advisor,"From the very beginning, the installation and setup process is highly intuitive. During the testing phase, we submitted numerous requests, which ManageEngine accepted and added to their development roadmap. Configuring role-based permissions is relatively simple, and using additional tools significantly streamlines the work of IT technicians. The support from ManageEngine is simply excellent. Installing agents on end-user devices is fairly straightforward. I would appreciate having more information in the logs, but even with the current setup, it is still very manageable.",Bedrich B.,5.0,"March 4, 2025",Very easy to use. Support from ManageEngine. Helps and speeds up assistance for end users.,It happened that the link from the application to the manufacturer's website did not exist. The groups functioned slightly differently than I needed.,Infrastructure Advisor,Legal Services,Used the software for: Less than 6 months
manageengine_remote_access_plus,Manage Engine Remote Access Plus - Great value for money,The remote access plus product has been the winning choice for the business,Marius B.,5.0,"January 23, 2025","This is a fantastic cloud based remote access tool that is very good value for money. As many other Manage Engine products, the product excels at what it does, and it is quite comprehensive for the price paid.","So far, I would like to see this integrate with Service Desk Plus Cloud, which is not currently possible.",IT Manager,Electrical/Electronic Manufacturing,Used the software for: Less than 6 months
manageengine_remote_access_plus,ManageEngine hits a home run!,"From the moment I began using Remote Access Plus, it was clear that ManageEngine designed the setup process with simplicity in mind. The initial configuration was intuitive, requiring only a few steps to get the server up and running. What stands out is how straightforward it was to deploy to client machines. Whether you’re pushing the installation across a small number of endpoints or an entire enterprise, the process is smooth and remarkably fast. Within minutes, Remote Access Plus was functioning on multiple machines, without any need for manual intervention or complex configuration. One of the platform’s most beneficial features is its granular control over user roles. Setting up permissions for various IT roles is a breeze. Administrators can easily assign specific permissions based on responsibilities, which ensures that technicians only have access to the tools they need, enhancing both security and productivity. The user interface is well-organized, which makes configuring these roles quick and efficient. Remote Access Plus offers a powerful suite of management tools that allows IT technicians to take full control of remote systems. From its dashboard, you can monitor system health, resolve issues, and execute maintenance tasks. The availability of a command line interface (CLI) within the platform is particularly useful for advanced troubleshooting, allowing technicians to execute commands on remote machines without needing to be physically present. For registry edits, the built-in Registry Editor lets you access and modify system configurations with ease, which saves significant time compared to manual methods.",Tony H.,5.0,"September 25, 2024","Ease of setup and deployment, configurability, the ability to create roles with different levels of access. The ability to chat, share files, screen record, restart, update the registry, install software, etc. Multi-monitor and OS support.","The setup UI is a little disorganized, but that's on the backend only.",Systems Analyst,Education Management,Used the software for: Less than 6 months
manageengine_remote_access_plus,Reliable remote administration tool for enterprise IT support,"Overall, my experience with Remote Access Plus has been very positive. It is a powerful and practical tool for IT administrators who manage many computers in a corporate environment. The software provides fast remote troubleshooting, monitoring, and system management from a single console. Deployment and maintenance are simple, and the platform works reliably in a Windows domain infrastructure. It significantly reduces the time required to support users and maintain systems.",Hikmat M.,5.0,"March 10, 2026","Remote Access Plus is very reliable and easy to use for daily IT administration. The interface is clear and allows quick remote access to computers without complex configuration. I especially like the integrated tools such as remote desktop, file transfer, command prompt, and system manager, which help resolve issues without interrupting users. Deployment in a domain environment was straightforward, and the performance of remote sessions is stable even over slower network connections.","The web interface sometimes feels slightly outdated and some advanced settings are spread across different sections, which can take time to find. In addition, documentation for certain enterprise scenarios could be more detailed. However, these are relatively minor issues and do not affect the overall functionality.",IT Network Administrator,Newspapers,Used the software for: Less than 6 months
manageengine_remote_access_plus,All solutions one roof ,,Sanjay K.,5.0,"July 12, 2024",Admin tool are good inventory management,,IT,Electrical/Electronic Manufacturing,Used the software for: Less than 6 months
manageengine_remote_access_plus,Resolve issue faster with it's extraordinary features,It is one of the most advanced solution to remotely support users.,Shreedhar T.,5.0,"February 16, 2023","We are logistics company and we have our own inhouse ERP for inventory.As a inventory manager i have to take remote access of user's system frequently to resolve ERP related issues. Manageengine remote access plus is helping me to resolve user's issue by taking remote access of his system. Along with common features like screen sharing, chatting, File sharing it also provides advanced features like start or stop services from my laptop which helps me to troubleshoot and resolve issue faster.",I am using it since last 3 to 4 years and I didn't faced any issue with it.,Inventory manager,Warehousing,Used the software for: 2+ years
manageengine_remote_access_plus,Review ManageEngine Remote Access Plus,"ManageEngine Remote Access Plus is user-friendly and offers an intuitive interface, making it easy to navigate and use. It also provides robust security features to protect sensitive data and ensure compliance with industry standards.",vikas S.,5.0,"March 2, 2023","Improved productivity: IT professionals can remotely manage and monitor multiple computers and servers simultaneously, allowing them to be more productive and manage their time more effectively.","Compatibility issues: Remote access software may have compatibility issues with certain operating systems, hardware configurations, or network environments, which may limit its usability.User error: Remote access software requires users to have the appropriate technical knowledge and skills to operate it effectively, and user error can result in data loss or other issues.",Manager,Education Management,Used the software for: Less than 6 months
manageengine_remote_access_plus,Great Management and Remote Support without breaking the budget for small business,,Nelson H.,5.0,"October 7, 2022",We enjoy the ease of use and access. Logging into the control panel is so easy and takes seconds. This allows us to quickly handle IT issues within seconds rather than minutes using other alternatives.,"I don't have many cons to state. I believe that if I had a gripe about anything, it would be the lack of UI control. However, that would likely be more or less my own personal desire and not a needed feature.",Systems Administrator,Retail,Used the software for: 1-2 years
manageengine_remote_access_plus,Lovely SOfftware,,Vipul A.,5.0,"November 27, 2022",Remote support feature is the best feature,Wake on lan i dont fine much usefull for me,It head,Information Technology and Services,Used the software for: Less than 6 months
manageengine_remote_access_plus,Ideal for support,,Leonardo P.,4.0,"December 7, 2023","Always available, easy to use, branding,","Not working on Linux, Sometimes works weird when connecting more than one person",CEO,Computer & Network Security,Used the software for: I used a free trial
manageengine_remote_access_plus,so easy and cheap !!,Literally used the free trial for 30min and then signed up for the pro subscription. its so easy to use beets the pants of teamviwer,barry C.,5.0,"February 9, 2021",Been using this remote access plus for like 30min and love it its so cheap costs be around £7 to manage 15 of my clients computers,cant find any literally so easy to use straight away,web develioper,Information Technology and Services,Used the software for: I used a free trial
manageengine_remote_access_plus,Good Product for the price,,Mike L.,4.0,"June 18, 2021",Speed to implementation with AD and intégration with Servicedesk Plus cloud,Nothing to expected with the solution realy easy to use,IT Director,Consumer Goods,Used the software for: Less than 6 months
manageengine_remote_access_plus,Great Value for Product ,The application has dramatically improved our organization and IT support of tablet devices across our company.,Alysha D.,5.0,"June 1, 2021",I was drawn to the product due to the trial and price and impressed by the extent of the features.,No negative feedback at this time. Enrollment and set up was straightforward.,IT Administrator,Construction,Used the software for: I used a free trial
manageengine_remote_access_plus,Perfect remote access software,,Anna S.,5.0,"August 5, 2020",Perfect solution for troubleshooting any desktop computer remotely.,"Interface is old fashion, could be a bettter ui/ux experience.",Commerical Lines Account Manager,Insurance,Used the software for: Less than 6 months
manageengine_remote_access_plus,Remote access good for money but with acount integration issues with other manage engine products like patch management.,"The software is really good, sometimes it has some lag on the console, but it works fine, the ipad app is really good compared with other solutions in the market.",Verified Reviewer,4.0,"August 19, 2025","It provides real value for money, the other options are mote expensive and lack some really needed functionality like wake on lan.","The fact that at least from my perspective I was no able to review patch management along with Remote access, it created diferent install packages and only one was active. I needed to remove patch management and reinstall remote access to make it work.",Manager,Retail,Used the software for: I used a free trial
manageengine_remote_access_plus,AC Zohoh access,"I recently started using it for remote management, and the experience has been stable and reliable, making daily IT support tasks easier and more organized.",Alaa C.,5.0,"December 22, 2025","The tool is very fast and easy to use, with a smooth remote connection experience and clear reports that help monitor systems efficiently and save time.","So far, I have not faced any issues or limitations. All the features I need for remote management are available and working as expected.",IT Admin,Hospitality,Used the software for: Less than 6 months
manageengine_remote_access_plus,Great product at affordable price,"Manage engine remote access plus is a great product and easy to use, the powerful tools like file manager, task manager, ability to start or stop services without remoting into machine is absolutely game changer for me, I would continue using this product as support is amazing even for free editions",raj S.,5.0,"December 15, 2024",Easy to install and powerful bundle of tools available from single console,no option for one time run exe like team viewer quick support,IT Consultant,Accounting,Used the software for: 6-12 months
manageengine_remote_access_plus,Give access and stay safe and compliant,Easy to set up and reliable. Audits and records everything so you can safely give access to remote teams and subcontractors.,john K.,5.0,"June 23, 2025",Cloud convenience and security but also has an on-premises option. All the options you might need such as RBAC and assets groups plus session recording!,"In the cloud version the recorded sessions are stored in place without the option to choose your own cloud or storage space. Also, the recording download is only manual and can't be scheduled.",IT Manager,Information Technology and Services,Used the software for: I used a free trial
manageengine_remote_access_plus, ManageEngine Remote Access Plus,I use ManageEngine Remote Access Plus to provide support to the users in my job.,Elvison G.,5.0,"October 16, 2024","What I most like about ManageEngine Remote Access Plus 10 is the easy to use interface and its features like file transfer and screen recorder, above all the multi-monitor support feature. Also, it provides detailed reports on active remote sessions and tasks performed.","Configuring the ports required for agent-server communication can be complex. In addition, the effectiveness of remote access can be affected by network quality, which can cause delays or interruptions in the connection. Although the interface is simplified, it may require some adaptation time for new users who are not familiar with this type of tool.",Business Architecture Supervisor,Food & Beverages,Used the software for: 6-12 months
