product_id,review_title,description,author,rating,date,pros,cons,author_profession,author_industry,author_duration
dbforge_studio_for_sql_server,dbForge Studio for SQL Server keeps getting better!,"It has been very good. I still miss a few features, like keeping the database diagrams as part of the project. On the other hand, their resource control now allows them to manage source code and critical data without writing long scripts.",DAVID I.,5.0,"January 26, 2026","I have been using Microsoft SQL Server Management Studio for a long time, and dbForge Studio for SQL Server for the last 5 years. While SSMS was broken for several years, improving recently in version 22, dbForge improved all the time, adding good resource control and AI Assistant.",It was a little slow in introducing the latest authentication methods in the latest versions of SQL Server.,Director of IT and infrastructure,Hospital & Health Care,Used the software for: 2+ years
dbforge_studio_for_sql_server,After two years of usage,,bruno C.,4.0,"March 15, 2024","DBForge SQL Server Studio stands out as a comprehensive and versatile tool tailored for database management, development, and administration, making it a valuable asset for SQL Server professionals. One of the most impressive aspects of DBForge Studio is its wide array of features designed to streamline and enhance the workflow of database developers and administrators.","Learning curve: dbForge Studio for SQL Server is a powerful and comprehensive tool, offering a wide range of features. However, this richness can also translate into a steeper learning curve for new users or those without prior experience with similar tools. Beginners may find it confusing to navigate through the many features and options available.",ceo,Information Services,Used the software for: 2+ years
dbforge_studio_for_sql_server,"Buggy, but with potential","I still kinda like it, but I'm having so much issues that I'm probably going back to SSMS in the near future. Unfortunately I got the 3 year subscription, so that's making me still use it. You know - you bought it, so use it!",Ville P.,3.0,"March 15, 2024",The promise of code completion and formatting with more affordable pricing compared to competition drew me to this software. I also liked the idea of a standalone product instead of using SSMS + plugins. Importing and exporting data has been such an easy task after bare SSMS.,"Even after testing the software for a while, I keep bumping into bugs. In the beginning I was reporting them, but it feels like its not worth it. According to support some issues are because I'm using Azure SQL Database and other issues were just acknowledged as bugs but nothing has been fixed and it's been 4-5 months.",Systems Manager,Environmental Services,Used the software for: 6-12 months
dbforge_studio_for_sql_server,Excellent work tool,I increased my productivity with greater development satisfaction,DENIS B.,5.0,"March 15, 2024","Ease of use, convenient utility functions, such as data export, import, in many formats",Before I used SQL Server Management Studio and I can't find things worse,Senior developer,Computer Software,Used the software for: 6-12 months
dbforge_studio_for_sql_server,Great help with SQL server management,We had a customer with a lot of stores where the items didn't match up. With comparing tables between databases we found the issues and cound correct it fast.,Johan G.,5.0,"July 26, 2024",Compare and sync tables between databases is a lifesaver to find errors.,I think it works great for what I have used it for.,Allication Specialist,Computer Software,Used the software for: 2+ years
dbforge_studio_for_sql_server,Great productivity tool,"Productivity increases - for example in the past we needed to use a combination of SSMS, Excel and some query tuning utility programs - now dbForge Studio for SQL Server can replace and do them much better without needing to shift around dataTesting and debugging - ability to simply create tSQL scripts from output window or copy data from one server to another is fantastic for testing and debugging and saves a ton of time",Nicholas B.,5.0,"June 12, 2023","The worst part about SQL Server Management Studio is how it can just lose all Intellisense in the middle of a high-pressure situation. I have never had such a problem with dbForge. Additionally, the Intellisense is far superior and the ability to save (and share) customizable tSLQ templates saved so much time! Being able to see the history of query performance as you adjust it is also really good.","No integration with SQL Sever Agent is the only downside, so one has to keep SQL Server Management Studio around for that - otherwise I would switch over whole heartedly.",Software Engineer,Financial Services,Used the software for: 2+ years
dbforge_studio_for_sql_server,"Great tool for managing, analysing, and querying SQL database","It's a great tool for maintaining multiple connections, and many multiple queries / files open at once. I use this tool daily for everyday queries, and I use it's schema and data compare functionality to mirror and sync changes between different databases. These tools have a lot of customisability which is fantastic. The software is rock solid, and the ability for the software to keep un-saved documents in case of a reboot or scratch pad situation is fantastic. No more getting spammed to name or save files when closing SQL Management Studio",Amy H.,5.0,"June 13, 2023",The autocomplete and various time saving features are a must have in the modern tech landscape.,"The separate pricing for different flavours of SQL (MySql, SQL Server, etc.)",Senior Software Engineer,Computer Software,Used the software for: 2+ years
dbforge_studio_for_sql_server,Excellent MSSql IDE,I've relied on DBForge Studio to do my job.,Jared D.,4.0,"March 14, 2024","Ease of navigation, performance tuning tools, data discover/navigation tools, and data development utilities. This is a premium alternative to MS Sql Server Mgmt Studio.","The database connection UI, wizards and db drivers UI is a little clunky. Could use better source control and 3rd party database migration utility integrations ( even if these are competitors to your IP, you can't control what others use and should instead be flexible and supportive) - liquibase, GOMigrate, etc.",Staff Engineer,Farming,Used the software for: 2+ years
dbforge_studio_for_sql_server,More intuitive than SQL Server Management Studio (SSMS),"I am not critical of SSMS because it's a great free tool but dbForge Studio for SQL Server is so much more convenient and efficient. It is a paid tool that is worth the money because it has saved me so much time and stress. The customer support is great, also.",Greg R.,5.0,"August 31, 2023","For me, it's the ease of use that makes this a joy to use. I am not a SQL Server specialist (I only use SQL Server Express) but I write a lot of TSQL. The features I love are (a) Debug of Stored Procedure (this feature seems to be removed in later versions of SSMS (b) Database Sync: you can first compare either Schema or Data between two versions of the same database. Then you can update the target (e.g. production) database from the source (e.g. dev) (after selecting the differences you want to update). Previously I used Visual Studio for this but it stopped working and many users have reported the same. The dbForge Data Sync has a 100% success rate for me. It just works. (c) Duplicate Object: 2 clicks to copy a View or Stored Proc. Handy when you want to backup an object before updating it. (d) Find Database Object: easy to search for existing tables, views, procs etc. (e) Find data (f) Format document(g) Manage Index Fragmentation.",I can't really think of any. I can't speak to all the features because I don't consider myself to be a SQL Server expert.,Solutions Provider,Computer Software,Used the software for: 2+ years
dbforge_studio_for_sql_server,Excelent,,Verified Reviewer,5.0,"October 6, 2022",Excelent software database administrator excelent,,DBA,Animation,Used the software for: I used a free trial
dbforge_studio_for_sql_server,A great replacement for SSMS,,Scott M.,5.0,"June 12, 2023","The tabbed interface and ability to create tabs from several different SQL queries at the same time is a real time saver for me. I often do data comparisons and having several tabs each with a different view of the data makes my job much easier. Autocomplete and autojoin when creating queries also saves keystrokes. About the only thing I use SSMS for now is tracing, but you can also do that in some of the more expensive versions of dbForge Studio (I'm running the Standard edition).","I can't really find anything not to like. I've not used all the features, but the ones I've used have all done exactly what I expect them to do.",President,Computer Software,Used the software for: 2+ years
dbforge_studio_for_sql_server,dbForge Studio for SQl just makes my life easier!,"This has made coding and creating large projects for data conversion from one billing system to another so much easier as well as moving massive amounts of meter data from system to another, and i am so glad i bought it.",Craig C.,5.0,"April 20, 2022","One phrase: One Stop Shopping! it is easy to find what i need in the feature rich studio, from searching for fields across giant database, to looking at formatted code, to creating data dictionaries and reports.",I wish it had more integrations into SQL,Manager of Information Systems,Utilities,Used the software for: 2+ years
dbforge_studio_for_sql_server,dbForge Studio for SQL Server allows me perform many cyclical and daily tasks very quickly,"For specific situations, I particularly like the interface linked to queries which allows me to easily consult or modify the data by facilitating the mapping between the different relationships of the tables.",Steeve B.,5.0,"April 13, 2022","I have been using dbForge Studio Entreprise since 2013 to manage, develop, administer and maintain my MS SQL databases linked to my .net business applications. Given my workflow, I often have updates of my products, tests and other tasks on my development and production databases. dbForge allows me by simple script to perform these cyclical and daily tasks very quickly in addition to providing me with several tools to achieve this that can be found in the particularities of the product.",I have nothing special about it because this product fully meets my needs.,Concepteur/développeur,Computer Software,Used the software for: 2+ years
dbforge_studio_for_sql_server,Good choice for you to manage your SQL Server,,Isaac Y.,5.0,"March 15, 2024",Easy to use and UI interface is clear. The function provided to manipulate SQL Server are fully provided in the Studio. You can select an edition to fit your need with difference price.,It's kind of not so cheap software tool for an employee.,IT,Logistics and Supply Chain,Used the software for: 2+ years
dbforge_studio_for_sql_server,dbForge the number 1 product to turn to for DB management,"I had been using a competing product for some time and when ran into issues, I did a search for another solution and found dbForge and haven't regetted the decision.",Vaughn S.,5.0,"April 13, 2022","Creating, editing, and searching DB components.",Changing DB objects that have foreign key constraints could made more convenient.,Owner,Information Technology and Services,Used the software for: 2+ years
dbforge_studio_for_sql_server,The swiss-army chainsaw of SQL Server development tools,"I first purchased dbForge Studio for SQL Server for its database schema compare and synchronization features, and it does a wonderful job. I really like the SQL completion (e.g. predicting the JOINs that I'd want to do), so going back to SSMS to do something really sucks now.",Geoff A.,5.0,"April 13, 2022","It's pretty comprehensive. I use it for all of my entire SQL Server and Azure SQL Database development workflow. Everything from designing my schema, tables, views and triggers to synchronizing these changes between development, test and production environments.","Missing feature: I'm always writing and running SQL statements (some of them complicated), and I wish it would keep a history of my previously (successfully executed) SQL for each instance/database, so if I have a SQL tab that is connected to instance X on database Y that I can browse the history of SQL that I've run for that database (from newest to oldest) so that they're all automatically saved. Right now I do all that manually in a ""handy SQL"" file for each of my databases, but I often forget to save SQL that I end up re-writing again.",Software Architect,Information Services,Used the software for: 2+ years
dbforge_studio_for_sql_server,Excellent Database Tool,,Joseph S.,5.0,"June 12, 2023",Features and Cost as compared to SQL Toolbelt.,Very few negatives about this product. The suite is very helpful.,Lead Software Engineer,Information Technology and Services,Used the software for: 1-2 years
dbforge_studio_for_sql_server,The tool for SQL Server,"A nice smooth tool, a smart one, my go to tool when targeting SQL Server.",Catalin G.,5.0,"February 5, 2023","Is how SQL Server Management Studio should be, fast, good UX, lot of features.","The price is the issues, even though fair priced, the alternative is free.",CTO,Computer Software,Used the software for: 2+ years
dbforge_studio_for_sql_server,"great, but still doesn't eliminate the use ssms",,Amit N.,5.0,"April 24, 2022",data editor is best in class. very easy to use,several features are missing: data classification in both discovery and management. also missing from column editor,CTO,Information Technology and Services,Used the software for: 2+ years
dbforge_studio_for_sql_server,Everything you need,Overall I am satisfied. Thanks to dbForge I save a lot of time.,Robert B.,5.0,"April 11, 2022",dbForge studio has everything you need for the daily work of a developer. All tools integrated in one program. I like the dependency search option the most. Comparing snapshots with the current database state.,"Very few software updates, no new features.",developer,Cosmetics,Used the software for: 2+ years
dbforge_studio_for_sql_server,Good tools,"Analyze customer database , performance, schema Developpe database distribute modification",Laurent M.,5.0,"April 12, 2022",Data comparaison is a must have. the global ergonomy is good (devexpress inside).,There is no Basic scripting the tools is not open to other databse. it would be nice if you merge différent database product in the same tools,Consultant,Information Technology and Services,Used the software for: 1-2 years
dbforge_studio_for_sql_server,Fast is DBA ,,Omer C.,5.0,"April 11, 2022",very fast coding and usage and code sniffer ver like me,ssms result export to excel feature none,DBA,Mining & Metals,Used the software for: 2+ years
dbforge_studio_for_sql_server,dbForge Studio for SQL Server review,,Marcel V.,5.0,"April 12, 2022",Autocomplete and Format works very well.,Missing feature to configure the SQL Server Agent and the option to simplify statements as example switch CASE to IIF,IT Manager,Chemicals,Used the software for: 1-2 years
dbforge_studio_for_sql_server,Good bye RedGate!,"I'm extremely happy with it, it is my goto SQL IDE now and a full replacement (its now gone) for the way too expensive SQL belt from Redgate.",esteban P.,4.0,"April 27, 2022","The schema and data comparison are up to or even over Redgate similar tools. I love also the option to automatically generate SQL for structures and for data with a single right click. e.g. Data from a query, CRUD statements, etc.","There are some issues with the use of skins for the IDE (love the dark theme). You can see quite frequently refresh blinking while processing data. There are some small missing items to be a full replacement for MSSQL Studio e.g. schema creation, ability to see detailed information about the database (file location, db sizes, space available, etc)",Enterprise Architect,Gambling & Casinos,Used the software for: 6-12 months
dbforge_studio_for_sql_server,A nice tool for all that develop over SQL Server,,Jose Miguel C.,5.0,"April 20, 2022","Wealth of functionalities. Good ""intellisense-like"" auto-complete",Unable to change the visualization date format without changing the locale,CTO,Information Services,Used the software for: 2+ years
