product_id,review_title,description,author,rating,date,pros,cons,author_profession,author_industry,author_duration
dbhawk,Powerful database tool to track and secure database access,"DBHawk allows us to centralize the access to all of our production databases, and to track SQL activities per user in a very secured way. this tool is much more secured and much more suitable than classical SQL clients to track and secure production data fixing activities.",Verified Reviewer,5.0,"July 5, 2019",- Multiple database platforms - Web User Interface - LDAP(s) integration in front of database access (users do not have to know the database user and password to connect) - Strong 2-factor Authentication - Connections and queries per user tracking (perfect for production data fixing) - Powerful SQL editor - Powerful dashboards - Queries saving and sharing,Nothing ! It's just perfect for our requirement !,CIO,Insurance,Used the software for: Less than 6 months
dbhawk,DBHawk is amazingly versatile software. It is easy to setup and very easy to use. Users love it.,"More users have access to the data in a much easier way than ever before. Dashboards and snippets are very user friendly. We save a lot of time since the application is web-based, we don't need to install the DB client software on each machine. User access control - we can easily see and control who-access-what. Great technical support. In case of any technical issue, we have received almost immediate response and fast solution. All databases at one place.",Timotej M.,5.0,"June 11, 2018","It is supporting multiple database platforms, hence we don't need to switch between several Database clients. We can easily create snippets and share some access to the NON DBHAWK users in other departments. It is great, that we have one platform, that can be used inside of our company as well as outside - when connected on mobile device (iPad) via VPN. System is fast and reliable, it keeps the history of the queries, so can get back to your previous work easily. Inbuilt scheduler, TABLE import /export provides very agile scheduled system - we have replaced our customer build application with this feature. Dashboard is simply amazing. By couple of clicks you can create amazing GRAPHICAL presentation of your data - basically simple BI system. READ access to the DB - as simple as 1 click - you can define a database connection as read only without actually touching the DB user itself. This is great feature which we use when granting access to the Database to the non-technical people. User access control in general is very easy in DBHawk. Saves us a lot of time. Web-Based interface is saving us a lot of time with the local application setup. Everything is managed centrally and we can easily see, which use is working on what query. The queries can be shared. Great value for the money.","since it is web-based, there are some limitations defined by the browser - if by any accident the user press REFRESH WEBPAGE (or F5), the DBHawk gets refreshed and you may loose you recent work. Or in case you are using iPad with external keyboard, it is a bit harder to navigate through the SQL code with arrows. We are dependent on the availability of the server. Running a SQL PLUS code on the ORACLE database is a bit tricky, to get a spool file that is generated by the query is not really straight forward thing, but it works.",Application Developer,Banking,Used the software for: 6-12 months
dbhawk,Easy to search and locate data you need.,,Raynald M.,4.0,"March 20, 2018",Multiple Database Platform Support both SQL and NO SQL Robust Access Management Including 2 Factor Authentication LDAP Integration Intuitive UI All settings are configurable even logo branding.,"Not configurable with IIS, IIS is used by a wide variety of industries and it is not going anywhere. Need Java SSL Implementation is complexe.",Sr. System Administrator,Used the software for: Less than 6 months,
dbhawk,DBHawk is an easy to use WEB based tool for accessing internal databases,,Stefan L.,5.0,"March 10, 2018","We use DBHawk for administrating our Oracle databases as well as a reporting and data analysis tool since 2011. We mostly like the ease of use for our daily tasks like resizing data files, managing tablespaces or managing user credentials. The integrated schema and data browser helps us a lot analyzing data and finding errors.",,Manager IT,Education Management,Used the software for: 2+ years
dbhawk,"The software provided the web based, controlled access to the dbs that we needed.",Good security as well as a single access point to multiple data stores.,Robi D.,4.0,"September 7, 2017","The controlled access. The ability to create a fairly granular access account that is outside of the db security. This means the account used within the application can not be used to access the database directly. I also appreciated and needed multiple database access. We support relational and nosql databases, having one tool saves a lot of time.",Deciding on the access method was a little complicated. The added flexibility increased the complexity.,DBA,Airlines/Aviation,Used the software for: 6-12 months
dbhawk,Easiest way to connect to tables in database,,Joseph N.,5.0,"June 8, 2018",Been using this software for several years and appreciate ease of use and quality. Connects easily to our Oracle tables and allows us to pull in information quickly and easily. Highly recommended. Tech support (Shah and Manish) are the best there is.,Nothing. Its a great piece of software that keeps improving with each new update. Installation is straight forward.,IT Manager,Used the software for: 2+ years,
dbhawk,DBHawk is a great tool to manage our database platforms through web console .,"Open database in web browser and edit data like a form , less or no knowledge required to operate it , query in web and lot's of benefits.",Debasis S.,5.0,"March 26, 2018","Multiple Database Platform Support both SQL and NOSQL, Robust Access Management including 2 Factor Auth LDAP Integration , Intuitive UI , All settings are configurable even logo branding , No more SSMS just web browser can open and run in Linux , Mac and Windows.","Cannot configurable for IIS , need JAVA and SSL implementation is tricky , as one single login used for data source so who ever used it shows that connection.",Sr. Manager Database,Used the software for: Less than 6 months,
dbhawk,DBHawk provided a HTTPS-secured browser-based user interface for 3rd-party access to an internal DB.,,Nathan R.,5.0,"January 23, 2018",The granular access control for a given account and the graphical user interface is designed to be intuitive.,,Solutions Architect,Used the software for: 6-12 months,
