product_id,review_title,description,author,rating,date,pros,cons,author_profession,author_industry,author_duration
navicat_premium,Great tool for managing MySQL and other Databases,I am happy with overall usage of Navicat because it has helped in creating very complex SQL queries easily using its visual Query Builder. That's a plus,Irfan A.,5.0,"December 12, 2019","- Brilliant management of Several databases from one application. You can manage database on your local server or connect to any external server which is a great feature - One of the best feature which makes Navicat distinct to many other MySql applications is visual query builder where a user can drag and drop tables and make relationships using drag and drop - User can access more than one databases at the sometime - Very easy to use and supports so many database engines like PostgreSQL, MySql, Oracle and SqlLite plus cloud databases such as Amazon RDS, Microsoft Azure, Oracle Cloud, Google Cloud and Alibaba Cloud",- One of the disadvantage of Navicat Premium is its a bit expensive as compared to some other solutions but at the same time has some great features which others don't provide - Biggest issue of this tools is it doesn't have a native Linux build you can run it in Linux using wine but no native build for Linux which kind of makes it a bit slower on Linux desktops - There are few bugs in the application in general but those bugs get solved with updates so overall a good application - I believe user experience can improve a bit to make it more easier for new users too,Senior Software Engineer,Information Technology and Services,Used the software for: 2+ years
navicat_premium,"Excellent, Navicat saves you a lot of work","Navicat has brought me many benefits, first of all it saves me time, there is no need to use several database clients, it allows me to automate tasks that run at night outside working hours, generate reports for my bosses, migrate information from one database to another. I am very happy with this software simplifies my life at work.",Aníbal M.,5.0,"June 23, 2018","Navicat is an excellent database client, it simplifies a lot of work, it makes backups, the migration of information between tables even between different databases is simply incredible. The option to synchronize data is something that I use frequently in a positive way and I love that it is possible to automate the tasks. The graphical interface is very beautiful and attractive, it makes the work pleasant, it is very intuitive, which allows discovering new functionalities as the tool is used. A great point in its favor is the report creator. This functionality is vital for my daily work. Reverse engineering for an amazing and surprising database has helped me develop new systems that already exist and do not have database documentation. The SQL editor is very well done. I could not ask for more than what needs to be done.","Not everything can be perfect Navicat can not connect to the database DB2-AS400 which forces me to connect from another client this feature is important, another point against Navicat is that there is no native version for the Linux environment is necessary the wine emulator.",Programador,Used the software for: 2+ years,
navicat_premium,Moving up in the Technology World to be the best we can be for our members,It is Navica - Systems Engineering Inc. - They are not moving up in the technology world as fast as our Board has grown,Darlene H.,3.0,"September 18, 2024",Our MLS system is Navica - MLS - Systems Engineering Incorporated,It is Navica. We have outgrown the system,Executive Director,Real Estate,Used the software for: 2+ years
navicat_premium,The most useful tool to work with Databases,Navicat has helped me and my team to be more productive. I think that its features and overall design help users be more efficient at what they do.,Mariam A.,5.0,"March 25, 2021","Navicat is one of the most effective tools there is when it comes to databases. It can connect to any type of database within few clicks and has many features to personalize your working space. For instance, I have a purely black background, which helps me concentrate better. In my opinion, Navicat is one of the must-have tools for everyone who has any sort of interaction with databases.","Navicat does not have preinstalled connectors. For instance, when you choose to connect to the MySQL database, it needs to connect to its servers and download required files. This might create some issues if you are only connected to the intranet or have a firewall that blocks downloads.",Sales Manager,Banking,Used the software for: 2+ years
navicat_premium,"The magnificent answer for overseeing databases, clients and associations - Navicat Premium","I use Navicat Premium to oversee clients, associations, and databases. it additionally enables me to dole out various benefits to various clients relying upon the degree of data they require. it empowers me to perform questions on the databases and such. by and large, I think that its supportive when managing databases. I exceedingly prescribe the utilization of Navicat Premium in overseeing databases and clients since it is entirely solid and proficient notwithstanding additional abilities it comes with.",Brian O.,4.0,"July 8, 2019","it is perfect with various OS platforms like Windows, Linux, and Mac OS. it has an instinctive interface it is easy to utilize it to oversee databases and association between the database and the interface. I can undoubtedly control, change and alter databases to sooth my prerequisites without fundamentally composing long and tedious language structure. accompanies a few incorporated highlights that make it dependable and proficient to deal with the databases. it is additionally conceivable to permit the cross-stage. it empowers reinforcement of databases and association so that in case they are lost you can without much of a stretch reestablish them.",it is very costly to purchase the Navicat Premium that accompanies full highlights. The free form does not mirror the full capacities of the superior form and can make clients end up considering different arrangements which are an incredible inverse since it is increasingly solid.,System Administrator,Education Management,Used the software for: 2+ years
navicat_premium,Only one tool for every DB engine,With Navicat I saved time and space on my computer. With a single application I have everything I need and a little more.,Ernesto Enrique F.,5.0,"December 29, 2018","Navicat allows you to save time by configuring work tools to manage your databases because it allows you to add among a large list of available engines. It is a fairly fast application and now that you have the service to store your connections in the cloud, it is much better, a single installation and all your connections where you want to be. What I like most is the assistant for complex queries, with a few clicks you can have queries in several tables and have incredible results.","I am a user of many operating systems both at home and at work and certainly Navicat is present in all of them but the appearance in Linux operating systems is quite outdated, I would like them to improve it.",Full-stack Developer,Human Resources,Used the software for: 2+ years
navicat_premium,Good software but with some bugs in MacOS,,Giuseppe N.,3.0,"April 13, 2022","Excellent cloud management of db, using same software over more device the synchronization is wonderful.","Is a very expensive compared to functionalities that give, the premium version doesn’t even provide sql autocomplete. In some cases during restore after backup, give errors. With other software the same procedure does not give any issue.",Software Engineer Manager,Information Technology and Services,Used the software for: 2+ years
navicat_premium,If you need great DB management software. Buy this!,,Paul A.,5.0,"July 24, 2018","Feature-rich, easy to use, great connectivity. Create databases in Navicat is a breeze, whether you're a DBA or a developer. I used MySQL workbench, and that got me by. Then I tried Navicat and was immediately aware of all the things MySQL Workbench is missing. Navicat is one of those pieces of software you need your developers to have access to.","It is definitely pricey. When I was a contractor and first purchased this, I was not impressed at the price, mainly because I would have to deal with MySQL, SQL Server, Postgres, and other database backends, so I had to buy the full package.",Software Engineer III,Telecommunications,Used the software for: 2+ years
navicat_premium,"Best tool on the market for database administration, report creation, and database migration.",I can definitely say this software has increased my productivity and allowed me work with some databases that I was unfamiliar with.,Ted S.,5.0,"April 5, 2018",Navicat is my favorite tool and a cornerstone of my development toolbox of programs that I use on a daily basis. From cloning websites to creating quick database scripts for chron jobs and timed reports. I highly recommend it.,"There's really not much I could suggest to improve Navicat. Maybe a cloud synch to store database connection settings and possibly an option to store backups to online file storage such as dropbox, Google drive, etc.",IT Consultant,Used the software for: 2+ years,
navicat_premium,All you need for Databases is Navicat Premium,"Navicat is a great help and tool to: explore your database, create queries easily and fast, import and export your database, and much more!",Román Josué D.,5.0,"February 20, 2019","I think Navicat Premium has the potential to be the only tool you need for working with databases. The query builder is just amazing, it helps you to build a query by just using drag-n-drop, which would be your final query or at least be a good base for a cumbersome query. The model explorer is another great tool, allowing you to see the diagram and navigate through it easily. Connecting to a database is also very simple. I used it a lot with PostgreSQL and it works perfectly, and I preferred to use Navicat than the pgAdmin.","When there are changes on the model and you want to update the diagram is not that simple, as usually leaves all the tables on the left-upper corner and you need to either move them manually or create the diagram again.",Data Science Team Lead,Information Technology and Services,Used the software for: 2+ years
navicat_premium,Review for Navicat,"Overall it's a great software for web and software developers for working with database , it has major database clients inside it and it's very simple to use.",Tigran H.,5.0,"March 2, 2020",This is the most usable app for database I've seen during my career. It has all features that software developer needs for working with database. Most important it has simple UI and it's very easy to use. It has visualisation of tables connections which is one of the best features of Navicat.,On new versions sometimes it loads slower then in old version but overall it does not have any cons that I can mention here.,Developer,Information Technology and Services,Used the software for: 2+ years
navicat_premium,One of the most useful DB tools,,Branimir P.,5.0,"September 19, 2017","Having used this tool has made my job tasks a lot easier. With having a lot of SQLite and MS SQL DBs on our systems, this gave me a possibility to do a lot of test queries before putting them in the system which doesn't have such options. Doing reports has become an easy task.","It takes a little while to get used to using this, but It's not that bad. Sometimes the Beautify SQL feature makes a mess.",IT Admin,Financial Services,Used the software for: 2+ years
navicat_premium,The best sw to manage databases,Exceptional and professional tool for those who have to deal with large or small amounts of data with a certain continuity.,Verified Reviewer,5.0,"July 31, 2019","Navicat Premium helps you to connect and manage various databases, such as MySQL, MariaDB, MongoDB, SQL Server, SQLite, Oracle & PostgreSQL. Inside it has all the functions to import and export data in any format, even with copy and paste. It also has a very useful data modeling for database architecture. An investment that is worth the expense, because you will be rewarded in a big way!","We need in-depth knowledge of database operation and the attention that a database deserves, always making copies before changes that can lead to data loss",DB & SW DEV,Computer & Network Security,Used the software for: 2+ years
navicat_premium,Great for a SQL Newbie!,I am able to use Navicat with our database to pull very helpful information out of our financial system that we are unable to access using the user interface of the program. It's saved us multiple times already!,Jennifer W.,5.0,"April 9, 2020","I love that my project stays synced up in the cloud and it allows me to stay organized. I am able to organize tables, queries, and views in virtual folders that help me stay focused on the areas most important to my work. I am new to using SQL and it has been a very user-friendly tool and very useful in my day-to-day work.",There are many more features than I've had time to explore. I wish there were little tips that were offered periodically to help learn new things about how to use it.,Controller,Religious Institutions,Used the software for: 2+ years
navicat_premium,The only real option,Have used it for many years. It is the inly real option when writing queries for databases.,Jeremie W.,5.0,"January 17, 2020",Usability. Layout. Functionality. Stability.,Sometimes it crashes. I also hate that sometimes you can’t save over your saved queries.,Developer,Information Technology and Services,Used the software for: 2+ years
navicat_premium,Easy management,"The first time i used navicat i knew i found what i just needed to manage and design DBs, i tried few times to find if there was another similar Application and no other DB manager does what navicat can do.",Verified Reviewer,5.0,"April 1, 2019","Manage all databases no matter the engine i can do all with a single application. Easy database management, creating querys is very simple without even writing a single line of code.",You can move data from what DB to other DB but cant still able to move data to certain DB engines.,I.T coordinator,Consumer Goods,Used the software for: 2+ years
navicat_premium,Venum and Navicat,,Keith E.,5.0,"October 21, 2022","Without doubt, the easy to use user interface. Everything is simplified, and logical - all of which save time when accessing data or database dev.","The learning curve is steep for users unfamiliar with SQL, but the entire platform's community is friendly and helpful!",Market Research Analyst and Marketing Specialist,Sporting Goods,Used the software for: 2+ years
navicat_premium,Navicat to sync local Database with live,Overall it's a great tool. I was stuck and used it to migrate a large database from one server to another.,Sardar U.,5.0,"April 21, 2021",- Query execution is very fast. - Provide help in writing queries (Intellisense) - Moving data from one server to another is very fast - Can copy a table from one server to another server,The only disadvantage I feel is it's a bit expensive than other competitors as the pricing goes higher.,Developer,Computer Software,Used the software for: I used a free trial
navicat_premium,Amazing tool!,Navicat help our business partners to solve a data migration between many stores,Angel P.,5.0,"December 27, 2019","Great software to integrate with other databases that have some application depends on data migration. The intuitive tools like export to CSV, JSON is an example of how Navicat can help you to solve administrative problems very fast and easily because of usability is simple.",Choose this software if you have a complex application,Developer,Information Technology and Services,Used the software for: 6-12 months
navicat_premium,"Simple, fast, and intuitive access to all of your databases from the desktop","I'm using Navicat Premium. The best part of Navicat premium is the database migration features, which you can drag and drop tables from Oracle to MySQL, PostgreSQL to MySQL and vice versa. or to a plain text file with designated SQL format and encoding. Meanwhile, you can transfer database data between different servers across various database platfrom. For those who work cross-database, Navicat Premium is definitely must-have database management software that removes all the headache of working with multiple applications & compatibility problems between databases.",Chau P.,5.0,"December 13, 2016",,,Used the software for:,,
navicat_premium,Great database management software,"Access all of your databases across different servers, create and edit tables, fields, etc. Command prompt feature is nice, and easily transfer information from one database to another, even on different servers. Valuable tool!",Troy L.,5.0,"March 8, 2017",,,Used the software for:,,
navicat_premium,Excelente manejador de base de datos,las ventajas que nos dio fue poder tener todos los datos a la mano y poder generar reportes en cuestión de minutos los cuales son de gran ayuda para la toma de decisiones. La facilidad de manejar las bases de datos de todos los sistemas que se tiene implementados en la empresa,efrain H.,5.0,"November 7, 2022","La facilidad de diseñar bases de datos , administrar , y la versatilidad de poder manejar los datos a los formatos que mejor te convenga en caso de requerir exportarlo",cumplió con nuestras expectativas de uso para el propósito que se tiene,jefe de desarrollo de sistemas,Transportation/Trucking/Railroad,Used the software for: 2+ years
navicat_premium,"It is a very powerful and versatile database management tool, very easy to use","It has been a great help in the creation and administration of database that I have had to manage, as well as being very useful in the classes taught in database design, since it allows me to make a comparison of how to administer a database by console and as with a graphic tool",Eyamir U.,5.0,"May 11, 2018","Its totally graphical user-friendly interface, which allows to carry out from the conceptual design to the physical design of the database in a very easy way, which makes it a powerful tool to be used by people who are not experts in the database administration. In addition to maintaining high compatibility with different DBMS such as MySQL, MariaDB, SQL Server, Oracle, PostgreSQL and SQLite from a single application. Compatible with cloud databases such as Amazon RDS, Amazon Aurora, Amazon Redshift, Microsoft Azure, Oracle Cloud, Google Cloud and Alibaba Cloud. Added to this allows you to manage the database easily and quickly, gives you the options of creating views, triggers, backup functions, synchronization, among others. You can create queries easily. Being able to create the code automatically compatible with the selected DBMS. It provides you with a free trial version for 14 days. Compatible with Windows, Linux and Mac. In addition to having extensive documentation and sites that provide support and documentation","Actually there is no feature that I do not like Navicat, the only thing I could say is that it is so useful that sometimes the people from so much use it lose a little bit of alacrity to download the database directly by console",Profesora,Used the software for: 2+ years,
navicat_premium,An Intuitive Database Client ,"This software is definitely our preffered choice when working with database, we've been using it for a while now and it has just made working with databases light work and I would definitely recommend it in my opinion.",Verified Reviewer,5.0,"September 21, 2020","It's an intuitive database client, most processes are easy and straight forward. I just can't explain how dead simple I feel this software is which makes it even better. It's great for working with different databases at the same time. Generating ERD models helps for documenting databases for legacy systems that without having to actually do this manually. It's ability to different database engines is great, for the greater part I know I don't have to worry about where I'm connecting to.",This one time it ran a query that was commented which ended up deleting a whole table because I had selected a certain area or something like that and when I clicked the query button I thought it would just run the whole thing and skipped the commented section. I felt like the software should've made it a bit more difficult to make such a mistake. The price tag is definitely on the higher end of products,General Manager,Information Technology and Services,Used the software for: 2+ years
navicat_premium,Rock solid database tool,"Faster SQL script learning curve, better productivity and great tool reliability.",Verified Reviewer,5.0,"July 24, 2018","My first contact with Navicat was about nine years ago, and I was learning SQL at that time. It helped me a lot because with it I didn't need to see only complex SQL strings at the console, no, Navicat has a very good interface where you can see the databases in a graphical way. The interface is very attractive and well organized, but it doesn't takes away it's power, you can do many things with the SQL editor; you can create functions, views, tables, indexes, you can do maintenances, check indexes and obviously view data. It's rock solid, you can trust it to make your database exports (quick backups) and also to restore data. It connects to many different sources, such as Oracle, MySQL, PostgreSQL, SQLite and many more... It worth the price!","It cannot deal very well with network oscillations, but I guess this is not the tool's fault, maybe the database drops the connection when you quickly disconnect from one network and reconnects. For example, if I'm executing a long SQL string with many INSERTs statements and my network drops for a couple seconds, the SQL Editor window freezes and the instruction is interrupted. Ideally, it should try to reconnect after and continues from where it stopped, but it doesn't. Again, this is the only con I have agaist Navicat and maybe this couldn't be the tool's fault.",SAP BW Consultant,Used the software for: 2+ years,
