product_index,software_category,product_id,name,url,rating,reviews_count,description
1,DevOps,site24x7,Site24x7,https://www.capterra.com/p/168192/Site24x7,4.7,345,"All-in-one Performance Monitoring Tool (SaaS) for DevOps and IT. Monitor Websites, Servers, Apps, Cloud, VMs, Network and more. Learn more about Site24x7"
2,DevOps,manageengine_applications_manager,ManageEngine Applications Manager,https://www.capterra.com/p/172323/ManageEngine-Applications-Manager,4.6,258,Ensure your mission-critical business applications meet end-user expectations with 360-degree monitoring from Applications Manager. Learn more about ManageEngine Applications Manager
3,DevOps,github,GitHub,https://www.capterra.com/p/129067/GitHub,4.8,6165,"GitHub Repos, GitHub Codespaces, GitHub Actions, GitHub packages and our suite of security tools enable a fully managed DevOps cloud. Learn more about GitHub"
4,DevOps,bitbucket,Bitbucket,https://www.capterra.com/p/233341/Bitbucket,4.6,1343,"Bitbucket is more than just Git code management. Bitbucket gives teams one place to plan projects, collaborate on code, test, & deploy. Learn more about Bitbucket"
5,DevOps,gitlab,GitLab,https://www.capterra.com/p/159806/GitLab,4.6,1216,"GitLab unifies planning, CI/CD, security, and agentic AI, eliminating the tool handoffs that slow software delivery. Learn more today. Learn more about GitLab"
6,DevOps,mulesoft_anypoint_platform,MuleSoft Anypoint Platform,https://www.capterra.com/p/275022/Anypoint-Platform,4.4,574,"Anypoint Platform boosts DevOps with CI/CD integration, collaborative tools, automation, monitoring, containerization, and security. Learn more about MuleSoft Anypoint Platform"
7,DevOps,docker,Docker,https://www.capterra.com/p/148132/Docker,4.6,536,"Application development solution that enables businesses to build applications, share container images, and more. Learn more about Docker"
8,DevOps,pycharm,PyCharm,https://www.capterra.com/p/186625/PyCharm,4.7,369,PyCharm Professional Edition is a fully-featured IDE for professional Python development and data science. Learn more about PyCharm
9,DevOps,datadog,Datadog,https://www.capterra.com/p/135453/Datadog-Cloud-Monitoring,4.6,358,Collect and analyze DevOps metrics from across your distributed stack to accelerate workflows and enhance agility with Datadog. Learn more about Datadog
10,DevOps,kodekloud,KodeKloud,https://www.capterra.com/p/239528/Kodekloud,4.8,320,"KodeKloud provides DevOps courses with industry certification prep, hands-on labs, and real-world projects for all skill level. Learn more about KodeKloud"
11,DevOps,heroku,Heroku,https://www.capterra.com/p/158191/Heroku,4.6,304,"Cloud-based PaaS for businesses that helps develop, manage & deploy web and mobile-based applications to enhance customer engagement. Learn more about Heroku"
12,DevOps,open_devops,Open DevOps,https://www.capterra.com/p/267175/Open-DevOps,4.5,273,"Atlassian Open DevOps is mission control, providing the flexibility of a custom toolchain with the coordination of an all-in-one. Learn more about Open DevOps"
13,DevOps,rollbar,Rollbar,https://www.capterra.com/p/158230/Rollbar,4.5,263,"The continuous code improvement platform. Proactively discover, predict, and remediate errors with real-time AI-assisted workflows. Learn more about Rollbar"
14,DevOps,splunk_enterprise,Splunk Enterprise,https://www.capterra.com/p/94317/Splunk,4.6,260,"Trusted by the world's leading organizations, Splunk helps you investigate, monitor, and analyze all of your organization's data. Learn more about Splunk Enterprise"
15,DevOps,tempo_timesheets,Tempo Timesheets,https://www.capterra.com/p/190126/Tempo,4.3,223,"Timesheets by Tempo: Empower DevOps. AI-powered time-tracking, reliable data, seamless operations. Track billable time with ease. Learn more about Tempo Timesheets"
16,DevOps,new_relic,New Relic,https://www.capterra.com/p/118128/New-Relic,4.5,195,"New Relic unifies telemetry data to boost DevOps, offering real-time insights, proactive alerts, and full-stack visibility. Learn more about New Relic"
17,DevOps,ninox,Ninox,https://www.capterra.com/p/163351/Ninox,4.7,193,Ninox is a low-code platform that allows users to build customized business apps and databases without coding. Learn more about Ninox
18,DevOps,opsgenie,OpsGenie,https://www.capterra.com/p/170236/OpsGenie,4.6,154,Opsgenie is a modern incident management and response solution for operating always-on services. Learn more about OpsGenie
19,DevOps,azure_devops,Azure DevOps,https://www.capterra.com/p/170547/VSTS-DevOps,4.4,147,"DevOps solution that streamlines the process of software development using repositories, testing, package management, and more. Learn more about Azure DevOps"
20,DevOps,travis_ci,Travis CI,https://www.capterra.com/p/179183/Travis-CI,4.1,129,Travis CI empowers software development teams to test and deploy their code with confidence. Learn more about Travis CI
21,DevOps,spirateam,SpiraTeam,https://www.capterra.com/p/85434/SpiraTeam,4.2,98,"SpiraTeam optimizes DevOps workflows with Azure DevOps, Jenkins integratios, AI, and complete lifecycle management in one tool. Learn more about SpiraTeam"
22,DevOps,circleci,CircleCI,https://www.capterra.com/p/150380/CircleCI,4.6,93,"Engineering teams of all sizes use CircleCI to easily build, test, and deploy production-ready code. Learn more about CircleCI"
23,DevOps,amazon_cloudwatch,Amazon CloudWatch,https://www.capterra.com/p/204333/Amazon-CloudWatch,4.5,91,Observability of your AWS resources and applications on AWS and on-premises Learn more about Amazon CloudWatch
24,DevOps,dynatrace,Dynatrace,https://www.capterra.com/p/81932/Dynatrace,4.6,83,Dynatrace provides software intelligence to simplify cloud complexity and accelerate digital transformation. Learn more about Dynatrace
25,DevOps,dotcom_monitor,Dotcom-Monitor,https://www.capterra.com/p/89991/Dotcom-Monitor,4.5,80,"Enterprise-grade monitoring and performance/load testing solutions for websites, web applications, infrastructure, APIs, and more. Learn more about Dotcom-Monitor"
26,DevOps,bitrise,Bitrise,https://www.capterra.com/p/178004/Bitrise,4.9,71,"Bitrise allows mobile app developers to release faster and more often, by automating the build, test and delivery process. Learn more about Bitrise"
27,DevOps,myget,MyGet,https://www.capterra.com/p/201837/MyGet,4.3,71,"Accelerate your software team with cloud package management, advanced security controls and a single integration point for your DevOps. Learn more about MyGet"
28,DevOps,code_capsules,Code Capsules,https://www.capterra.com/p/10011411/Code-Capsules,4.8,69,"Code Capsule is a single platform that lets you build, deploy and scale your MEAN dev stack. Connect to GitHub and go. Learn more about Code Capsules"
29,DevOps,mabl,mabl,https://www.capterra.com/p/175029/mabl,4.0,67,mabl is the leading intelligent test automation platform built for DevOps. Learn more about mabl
30,DevOps,redis_enterprise,Redis Enterprise,https://www.capterra.com/p/173860/Redis-Enterprise,4.8,65,"Redis Enterprise is a real-time data platform that is an enterprise-proven, 5-9s HA solution that allows you to easily scale. Learn more about Redis Enterprise"
31,DevOps,octopus_deploy,Octopus Deploy,https://www.capterra.com/p/204945/Octopus,4.8,60,Octopus automates complex deployments and seamlessly integrates with your DevOps tools. Learn more about Octopus Deploy
32,DevOps,ironworker,IronWorker,https://www.capterra.com/p/182067/Iron-Worker,4.3,54,"A hosted background job solution that lets you run your containers with dynamic scale and detailed analytics, along with much more. Learn more about IronWorker"
33,DevOps,spinupwp,SpinupWP,https://www.capterra.com/p/10012241/SpinupWP,4.9,51,SpinupWP is a modern cloud server control panel designed to manage WordPress sites and serve them lightning fast. Learn more about SpinupWP
34,DevOps,tricentis_testim,Tricentis Testim,https://www.capterra.com/p/165430/Testim,4.6,50,"Testim is the leading AI-powered, SaaS-based test automation tool for cloud-native and custom web apps. Learn more about Tricentis Testim"
35,DevOps,appdynamics,AppDynamics,https://www.capterra.com/p/226975/AppDynamics,4.5,41,"AppDynamics' DevOps Monitoring provides full visibility in your applications, infrastructures and supporting services. Learn more about AppDynamics"
36,DevOps,appcircle,Appcircle,https://www.capterra.com/p/265747/Appcircle,4.9,37,"Appcircle is an easy-to-use mobile CI/CD platform with testing and store deployment. Make fully-automated, better mobile app releases. Learn more about Appcircle"
37,DevOps,waydev,Waydev,https://www.capterra.com/p/179273/Waydev,4.5,37,The #1 Development Analytics platform for data-driven engineering leaders. Learn more about Waydev
38,DevOps,chef_enterprise_automation_stack,Chef Enterprise Automation Stack,https://www.capterra.com/p/170467/Chef,4.4,36,"DevOps platform that automates infrastructure deployment via built-in validations, configuration testing, server data storage, etc. Learn more about Chef Enterprise Automation Stack"
39,DevOps,sumo_logic,Sumo Logic,https://www.capterra.com/p/124188/Sumo-Logic,4.6,33,"Sumo Logic delivers the only cloud-native, real-time machine data analytics platform that provides continuous intelligence. Learn more about Sumo Logic"
40,DevOps,groundcover,groundcover,https://www.capterra.com/p/10016401/groundcover,4.7,32,Cloud-based observability solution that helps businesses track and manage workload and performance on a unified dashboard. Learn more about groundcover
41,DevOps,kubermatic_kubernetes_platform,Kubermatic Kubernetes Platform,https://www.capterra.com/p/199419/Kubermatic-Kubernetes-Platform,4.6,32,"Enterprise software that automates multi-cloud, on-prem, and edge operations with a central self-service management UI. Learn more about Kubermatic Kubernetes Platform"
42,DevOps,harness,Harness,https://www.capterra.com/p/186312/Harness,4.5,32,Harness provides self-service CI/CD that enables Engineers to deploy software on-demand without a single script. Learn more about Harness
43,DevOps,p4,P4,https://www.capterra.com/p/174325/Helix-Core,4.5,31,"Cloud-based application development solution that allows businesses to track and manage changes to source code, digital assets & more. Learn more about P4"
44,DevOps,logz_io,Logz.io,https://www.capterra.com/p/153685/Logz-io,4.6,30,Logz.io is the leading open source-based cloud observability platform. Learn more about Logz.io
45,DevOps,sematext_cloud,Sematext Cloud,https://www.capterra.com/p/166479/Sematext-Cloud,4.8,29,DevOps observability platform delivers full-stack visibility to release faster. Correlate metrics and logs in a split view. Learn more about Sematext Cloud
46,DevOps,ibm_cloud,IBM Cloud,https://www.capterra.com/p/240584/IBM-Cloud,4.5,29,A combination of PaaS and IaaS that allows enterprises of any size to create custom apps and automate infrastructure deployment. Learn more about IBM Cloud
47,DevOps,tempo_capacity_planner,Tempo Capacity Planner,https://www.capterra.com/p/190516/Tempo-Planner,4.1,29,"Optimize DevOps with Capacity Planner. Effortlessly allocate resources, track time, and manage capacity in Jira. Learn more about Tempo Capacity Planner"
48,DevOps,scalingo,Scalingo,https://www.capterra.com/p/241477/Scalingo,4.9,27,"Scalingo is a secure, European Platform-as-a-Service (PaaS) designed to support any type of hosting project. ISO-27001 & HDS compliant. Learn more about Scalingo"
49,DevOps,tricentis_qtest,Tricentis qTest,https://www.capterra.com/p/173762/qTest,4.4,27,qTest is a test management platform that provides real-time visibility and control across development and testing methodologies. Learn more about Tricentis qTest
50,DevOps,lumigo,Lumigo,https://www.capterra.com/p/201542/Lumigo,4.7,26,"Lumigo provides AI-powered observability with end-to-end distributed tracing, log management, and comprehensive metrics. Learn more about Lumigo"
51,DevOps,electroneek_platform,ElectroNeek Platform,https://www.capterra.com/p/183324/electroNeek-RPA,4.6,26,"ElectroNeek is transforming business process management in enterprises by integrating AI, RPA, IDP with employee workflows. Learn more about ElectroNeek Platform"
52,DevOps,elastic_observability,Elastic Observability,https://www.capterra.com/p/238837/Logstash,4.3,25,"Rely on the most widely deployed observability platform available, built on the proven Elastic Stack (also known as the ELK Stack) to c Learn more about Elastic Observability"
53,DevOps,launchdarkly,LaunchDarkly,https://www.capterra.com/p/187546/LaunchDarkly,4.7,24,"LaunchDarkly is the runtime control plane for software features, helping engineering teams release quickly and safely. Learn more about LaunchDarkly"
54,DevOps,puppet_enterprise,Puppet Enterprise,https://www.capterra.com/p/124189/Puppet-Enterprise,4.4,24,"Cloud-based solution that helps businesses manage infrastructure configuration, trace intent, regulate compliance and more. Learn more about Puppet Enterprise"
55,DevOps,headlessforms,Headlessforms,https://www.capterra.com/p/266168/Headlessforms,4.5,23,Build high quality HTML forms in minutes. We have the Form Backend Learn more about Headlessforms
56,DevOps,cloudsmith,Cloudsmith,https://www.capterra.com/p/177474/Cloudsmith-Package,4.5,22,"Experience the future of DevOps with Cloudsmith, the only cloud-native, global, universal software supply chain platform. Learn more about Cloudsmith"
57,DevOps,alertops,AlertOps,https://www.capterra.com/p/160468/AlertOps,4.7,21,Automate incident resolution in your CI/CD pipeline with fully enabled toolchains – so you can focus on orchestrating change. Learn more about AlertOps
58,DevOps,snyk,Snyk,https://www.capterra.com/p/172252/Snyk,4.6,21,Snyk's Developer Security Platform puts security expertise in the toolbox of every developer. Learn more about Snyk
59,DevOps,tower,Tower,https://www.capterra.com/p/207716/Tower,5.0,20,"Source code management tool that helps businesses to craft granular commits, Inspect file changes, create pull requests, and more. Learn more about Tower"
60,DevOps,artifactory,Artifactory,https://www.capterra.com/p/148994/Artifactory,4.6,19,"The universal repository manager for DevOps & AI. Securely manage, store & distribute binaries across your entire software supply chain Learn more about Artifactory"
61,DevOps,honeycomb,Honeycomb,https://www.capterra.com/p/198473/Honeycomb,4.9,18,"Observability for modern Software Eng/Devops/SRE/Build teams to create & operate scalable, stable, and reliable apps and services. Learn more about Honeycomb"
62,DevOps,vmware_aria,VMware Aria,https://www.capterra.com/p/264863/vRealize-Cloud-Management,4.9,18,"VMware Aria helps enterprises improve speed of delivery, optimize performance, control costs, and reduce risk. Learn more about VMware Aria"
63,DevOps,epsagon,Epsagon,https://www.capterra.com/p/199598/Epsagon,4.8,18,"Epsagon enables teams to instantly visualize, understand and optimize their complex microservice architectures. Learn more about Epsagon"
64,DevOps,allure_testops,Allure TestOps,https://www.capterra.com/p/227555/Allure-TestOps,4.7,18,Allure Testops is a full-stack test management platform to orchestrate your manual and automated testing. Aligned with DevOps. Learn more about Allure TestOps
65,DevOps,expresia,Expresia,https://www.capterra.com/p/252358/Expresia,4.7,18,The unified Cloud-based Digital Transformation Platform to build and scale any business from Startup to Enterprise. Learn more about Expresia
66,DevOps,oracle_cloud_infrastructure_oci,Oracle Cloud Infrastructure (OCI),https://www.capterra.com/p/203476/Oracle-Cloud-Infrastructure,4.6,18,"A complete cloud infrastructure platform, OCI has all the services you need to migrate, build, and run all your IT Learn more about Oracle Cloud Infrastructure (OCI)"
67,DevOps,pantheon,Pantheon,https://www.capterra.com/p/186038/Pantheon,4.1,18,WebOps for DevOps. Discover the power of Pantheon and supercharge your development team. Learn more about Pantheon
68,DevOps,cyclr,Cyclr,https://www.capterra.com/p/158623/Cyclr,4.8,17,"Powerful low-code integration toolkit for SaaS developers - create, amplify, manage & publish native integrations from within your app. Learn more about Cyclr"
69,DevOps,vmware_tanzu,VMware Tanzu,https://www.capterra.com/p/230522/VMware-Tanzu,4.2,17,VMware Tanzu simplifies multi-cloud operations and frees developers to move faster in creating and delivering modernized applications. Learn more about VMware Tanzu
70,DevOps,slickstack,SlickStack,https://www.capterra.com/p/211436/SlickStack,5.0,16,"Open-source LEMP script to enhance and simplify WordPress provisioning, performance, and security. Learn more about SlickStack"
71,DevOps,qase,Qase,https://www.capterra.com/p/200155/Qase,4.8,16,"A test management platform for manual & automated QA testing, tracking, and reporting for delivering higher quality software, faster. Learn more about Qase"
72,DevOps,aws_codepipeline,AWS CodePipeline,https://www.capterra.com/p/234449/AWS-CodePipeline,4.6,16,"Continuous delivery software that helps businesses automate software release processes, streamline workflow modeling and more. Learn more about AWS CodePipeline"
73,DevOps,redgate_monitor,Redgate Monitor,https://www.capterra.com/p/141452/SQL-Monitor,4.5,16,"Proactively monitor your SQL Server estate - SQL Monitor helps you and your team find issues before they become problems, Learn more about Redgate Monitor"
74,DevOps,plandek,Plandek,https://www.capterra.com/p/267625/Plandek,4.5,16,"Empower DevOps teams with actionable insights, optimizing software delivery & enhancing collaboration across the entire pipeline. Learn more about Plandek"
75,DevOps,sigrid,Sigrid,https://www.capterra.com/p/219140/Sigrid,4.1,16,"Empower your DevOps with Sigrid, where software assurance meets agile delivery. Integrate it directly into your CI/CD pipelines. Learn more about Sigrid"
76,DevOps,hatica,Hatica,https://www.capterra.com/p/241059/Hatica,4.9,15,Engineering Analytics to boost developer productivity Learn more about Hatica
77,DevOps,codescan,CodeScan,https://www.capterra.com/p/204478/CodeScan,4.8,14,CodeScan offers static code analysis and automated scans of Salesforce policies to strengthen code quality and data security. Learn more about CodeScan
78,DevOps,sensu,Sensu,https://www.capterra.com/p/182813/Sensu,4.8,13,"Automate your monitoring workflow and gain deep visibility into Kubernetes, hybrid cloud, and bare metal infrastructure. Learn more about Sensu"
79,DevOps,layerci,LayerCI,https://www.capterra.com/p/202546/LayerCI,4.8,13,Developers ship changes faster by using LayerCI provisioned VMs for E2E tests and full-stack website previews. Learn more about LayerCI
80,DevOps,all_quiet,All Quiet,https://www.capterra.com/p/10009461/All-Quiet,4.7,13,"All Quiet is an on-call, alerting and incident response platform for tech startups, scaleups and grownups. Learn more about All Quiet"
81,DevOps,bluecat,BlueCat,https://www.capterra.com/p/156431/BlueCat,4.5,13,BlueCat helps enterprises achieve their network modernization objectives by delivering innovative products and services. Learn more about BlueCat
82,DevOps,implementer,Implementer,https://www.capterra.com/p/242513/Implementer,4.5,13,PTC Implementer is a change management solution that provides an easy-to-use environment to manage developments in IBM i environments. Learn more about Implementer
83,DevOps,buildpiper,BuildPiper,https://www.capterra.com/p/212815/BuildPiper,4.2,13,BuildPiper: The Most Powerful Microservice Delivery Platform Learn more about BuildPiper
84,DevOps,opscompass,OpsCompass,https://www.capterra.com/p/191605/OpsCompass,4.8,12,"OpsCompass drives multi-cloud security, drift, cost management, and policy compliance on all leading cloud platforms. Learn more about OpsCompass"
85,DevOps,keeper_secrets_manager,Keeper Secrets Manager,https://www.capterra.com/p/242263/Keeper-Secrets-Manager,4.6,12,Keeper Secrets Manager is a cloud-based zero-knowledge platform that can secure privileged credentials. Learn more about Keeper Secrets Manager
86,DevOps,pluralsight_flow,Pluralsight Flow,https://www.capterra.com/p/203937/Pluralsight-Flow,4.6,12,"Optimize software delivery. Say goodby to wasted efforts. Build happier, healthier teams using Pluralsight Flow. Learn more about Pluralsight Flow"
87,DevOps,configcat,ConfigCat,https://www.capterra.com/p/187099/ConfigCat,4.6,11,Feature flag & config service. Fixed prices. Unlimited Team Members. 10 minutes trainable. Clear docs. Awesome tech support. Free plan Learn more about ConfigCat
88,DevOps,bunnyshell,Bunnyshell,https://www.capterra.com/p/181738/Bunnyshell,4.6,11,"One platform to create, manage and optimize full-stack environments for the entire application lifecycle. Learn more about Bunnyshell"
89,DevOps,7pace_timetracker,7pace Timetracker,https://www.capterra.com/p/204901/7pace-Timetracker,4.5,11,"7pace Timetracker is a professional time-tracking app with integrated time recording, accurate data for insights, and powerful reports. Learn more about 7pace Timetracker"
90,DevOps,cloud_66,Cloud 66,https://www.capterra.com/p/194937/Cloud-66,4.8,10,Cloud 66 is a full-stack DevOps as a Service provider with everything you need to run your code on any cloud. Learn more about Cloud 66
91,DevOps,mia_platform,Mia-Platform,https://www.capterra.com/p/205899/Mia-Platform,4.5,10,An AI-Native Developer Platform Foundation as a holistic solution to build your own platform for the AI-native engineering era Learn more about Mia-Platform
92,DevOps,softagram,Softagram,https://www.capterra.com/p/180377/Softagram,4.4,10,Faster code reviews and improved quality. Analysis of pull requests with visual reports of changes and impact. Learn more about Softagram
93,DevOps,mission_control,Mission Control,https://www.capterra.com/p/219779/Mission-Control,4.8,9,Mission Control is a Project Management and Professional Services Automation SaaS trusted by thousands of companies worldwide. Learn more about Mission Control
94,DevOps,scriptrunner,ScriptRunner,https://www.capterra.com/p/179858/ScriptRunner,4.7,9,Your #1 for PowerShell Automation Learn more about ScriptRunner
95,DevOps,squadcast,Squadcast,https://www.capterra.com/p/182098/Squadcast,4.6,9,"Squadcast is a reliability automation platform, enabling teams to track, respond, & gain valuable insights for all reported incidents. Learn more about Squadcast"
96,DevOps,incredibuild,Incredibuild,https://www.capterra.com/p/210494/Incredibuild,4.6,9,"Incredibuild enables DevOps engineers and release managers to accelerate dev cycles (8x faster builds, 80% shorter release cycles). Learn more about Incredibuild"
97,DevOps,ansible_automation_platform,Ansible Automation Platform,https://www.capterra.com/p/206320/Ansible-Automation-Platform,4.6,9,Build and operate a scalable automation system Learn more about Ansible Automation Platform
98,DevOps,delphix,Delphix,https://www.capterra.com/p/147983/Delphix,4.6,9,Enterprises around the world choose the Delphix DevOps Data Platform to rapidly deploy compliant data into non-production environments. Learn more about Delphix
99,DevOps,deployhq,DeployHQ,https://www.capterra.com/p/10020225/DeployHQ,5.0,8,"DeployHQ automates website and app deployments from Git, SVN, etc. It offers custom workflows, scheduled and zero-downtime deployments. Learn more about DeployHQ"
100,DevOps,dbforge_sql_tools,dbForge SQL Tools,https://www.capterra.com/p/241326/dbForge-SQL-Tools,4.9,8,SQL Tools extends SSMS with many essential features aimed at boosting productivity and reducing expenses while performing routine tasks Learn more about dbForge SQL Tools
101,Devops,strong_network,Strong Network,https://www.capterra.com/p/267139/Strong-Network,4.9,8,"Improve the efficiency, security and governance of your entire application development process while reducing the cost of managing it Learn more about Strong Network"
102,Devops,mend,Mend,https://www.capterra.com/p/146730/WhiteSource,4.4,8,Find & fix security and compliance issues in open source libraries in real-time Learn more about Mend
103,Devops,packagecloud,Packagecloud,https://www.capterra.com/p/249506/Packagecloud,5.0,7,"Packagecloud is a package repository that allows users to host npm, python, rubygem, apt, Java/Maven, and yum repositories. Learn more about Packagecloud"
104,Devops,hpe_greenlake,HPE GreenLake,https://www.capterra.com/p/208825/HPE-GreenLake,4.6,7,Transform the way you do business with one experience and one operating model across your distributed clouds Learn more about HPE GreenLake
105,Devops,jile,Jile,https://www.capterra.com/p/176236/Jile,4.6,7,"With Jile, connect your DevOps tools, orchestrate and automate your CI/CD pipeline. . Learn more about Jile"
106,Devops,middleware,Middleware,https://www.capterra.com/p/10001380/Middleware,4.6,7,"Middleware is an AI-driven, full-stack cloud observability platform that detects, diagnoses, and automatically fixes issues. Learn more about Middleware"
107,Devops,bytesafe,Bytesafe,https://www.capterra.com/p/236848/Bytesafe,4.6,7,Manage Open Source supply chain threats intelligently with Bytesafe's cloud-native security platform. Learn more about Bytesafe
108,Devops,servicepilot,ServicePilot,https://www.capterra.com/p/132821/ServicePilot-ISM,4.4,7,"Software that provides a unified view of service delivery, availability, performance and security of IT applications. Learn more about ServicePilot"
109,Devops,chocolatey,Chocolatey,https://www.capterra.com/p/210185/Chocolatey,4.8,6,"DevOps solution that supports GUI, built-in powershell functions, runtime malware protection, package creation, auditing and more. Learn more about Chocolatey"
110,Devops,resilio_active_everywhere,Resilio Active Everywhere,https://www.capterra.com/p/173193/Resilio-Connect,4.8,6,Resilio Active Everywhere is a scalable solution for transferring and syncing large amounts of enterprise data up to 10x faster. Learn more about Resilio Active Everywhere
