product_id,review_title,description,author,rating,date,pros,cons,author_profession,author_industry,author_duration
hackrate,One of the best bug bounty platform,,Verified Reviewer,5.0,"February 16, 2022","I'm using Hackrate as a bounty hunter, and I found that there is a great team behind Hackrate. They validated my previous reports fast.","Small number of bug bounty programs. They are using CAPEC instead of CWE, it was a bit strange for me at the first time, but it is very similar in most of the cases.",Software Engineer,Computer Software,Used the software for: 6-12 months
hackrate,My experience with Hackrate Bug Bounty Platform,"My overall experience is absolute positive. They have professional analysts with short response times. Also they provide decent amount of reward for the bounties, and the reputation / badge system is well designed. Also for companies, who want to know their assets are safe, this opportunity provides reasonable assurance, because of the numerous userbase will make sufficient work on the targets.",Kis G.,4.0,"March 18, 2022","I'm pleased to have the opportunity to be a part of a Hungarian BugBounty platform. During the years I spent with BB on various platforms, I can say that Hackrate has really quick response time. I'm the part of the platform for almost one year, and I can barely say, that they are constantly evolving, and the most important thing is they listen to their community, and try to establish development approaches based on the user's feedback.","There are not many programs to test on, but since the platform is new, they have to find their place on the market, and I'm sure they will be flooded with clients.",Senior Advisor,Computer Software,Used the software for: 6-12 months
hackrate,Decent Emerging Platform,"Decent but it can't be only way to work in bug bounties. I would have to work on other platforms like intigriti, bugcrowd, etc. to sustain my income.",Soham G.,5.0,"August 27, 2024",Less Competition. Fast resolution. Amazing technical support.,Low number of paid programs. Program I worked on had user issues that were not announced to researchers. So more communication with researchers would be better.,Freelancer,Internet,Used the software for: Less than 6 months
hackrate,Must have for any IT software company,,Verified Reviewer,5.0,"April 8, 2022",The implementation was fast and seamless.,"I could not tell any negative comment, we do not have any concern.",Advisor,Computer & Network Security,Used the software for: 6-12 months
hackrate,Hackrate is a great alternative to mainstream bug bounty platforms,,Mark F.,5.0,"January 17, 2022",The Hackrate platform is easy to use and provides a great coverage to discover vulnerabilities in software. They are continuously expanding their researcher community.,"Nothing. Maybe it is a bit less advanced than the major bug bounty platforms, but they fully compensate this with attention and customer support.",CEO,Computer & Network Security,Used the software for: 6-12 months
hackrate,My review,,Norbert B.,5.0,"March 31, 2022","I like the mVDP form and the JIRA integration the most, in addition to the basic features, they are useful for me.",I can't really think of anything I don't like about the platform.,Delivery Manager,Computer Software,Used the software for: 1-2 years
hackrate,Highly recommended,"Cybersecurity should be prioritized in every company's life and it is so simple to do, especially with products like Hackrate. Worth to try!",Csila Z.,5.0,"March 26, 2022","Easy to handle, user-friendly, innovative tool.",I have not experienced any quality weakness of the product.,Account Manager,Telecommunications,Used the software for: 6-12 months
hackrate,"Great product and service, smart team",,Gergely R.,5.0,"March 25, 2022","Easy to use, great support, cost effective solution to improve the quality of our product.",There are only few programs yet as it is a new platform.,CEO,Information Technology and Services,Used the software for: 6-12 months
hackrate,Hackrate is a great bug bounty platform.,,Jonathan N.,5.0,"January 14, 2022",They sre always helpful and quick to respond.,There are not many programs yet as it is a new platform.,Security Consultant,Computer & Network Security,Used the software for: 1-2 years
hackrate,Next gen service,,Kristof S.,5.0,"April 1, 2022",the pacing of the team and the feature set for value,"Still a small business feeling, yet it was no set back on the quality side",VC,Investment Management,Used the software for: 1-2 years
hackrate,Good for cybersecurity,I think it is very usefull wide type of compani around the world.,Gergo K.,5.0,"February 3, 2022",The risk assessment is one of the most useful part of the software. On the other hand the vulnerability scanner is also so useful for me.,"In my oppinion, the sofware consists of wide range of service. That is why it can be possiable someone don’t use on of them, but I think it still makes it useful.",Cybersecurity consultant,Computer & Network Security,Used the software for: Less than 6 months
hackrate,Hackrate team is helpful,,Mark S.,5.0,"February 21, 2022","Hackrate educational opportunities were quite useful since I started my learning path in ethical hacking. My most favorite is the capture the flag, but there are several type of other learning opportunities as well.","None so far, I quite like the product as it is.",Cybersecurity Expert,Telecommunications,Used the software for: 6-12 months
hackrate,IT security vulnerability testing for all companies,They have a very transparent website. Their services have competitive pricing.,Gergely F.,5.0,"March 4, 2022",They have a variety of testing packages that can be customized for any company. The platform is clearly transparent.,"They dont have free trial option, but maybe it will change later",Account manager,Retail,Used the software for: 6-12 months
hackrate,"Nice initiative, an innovative platform.",,Gábor D.,5.0,"February 20, 2022","It was quite modern, responsive. Good way to start as a hobby .","Bugfixes were slower than expected, other else was fine.",Product Security Engineer,Medical Devices,Used the software for: 6-12 months
hackrate,Great experience from a hacker perspective,,Verified Reviewer,5.0,"February 25, 2022",Amazing customer support. Very easy to submit bugs.,Might be useful to enable payment via Paybal or Crypto currency,Engineer,Security and Investigations,Used the software for: Less than 6 months
hackrate,Useful for us,,Cemil Y.,5.0,"August 14, 2022",It accelerated the development process and we experienced a performance increase as a company.,"In general, I liked it very much, I did not have a bad experience, I recommend it to everyone.",Smart Contract Developer,Financial Services,Used the software for: Less than 6 months
hackrate,An easy-to-use bug bounty platform,,Edina B.,5.0,"February 16, 2022","I found Hackrate through their blog where I read about an interesting vulnerability. Since they also provide education through integration, I can start my bug bounty career.",The testing opportunities are limited because of the low number of bug bounty programs. I hope that they can extend their client base.,Advisory Manager,Financial Services,Used the software for: Less than 6 months
hackrate,Validating TheFence,,Harold T.,5.0,"November 14, 2022",We selected Hackrate as we were expecting to receive feedback from trusted and from more different resources. In case of vulnerability scanning it is critical to leverage and apply different techniques and methods instead of running an automated scan - Hackrate simply delivered it!,"The first project was really meeting our expectations, maybe we set too high expectations as we were expecting the majority of the vulnerabilities within one week. This took a bit longer in time but the overall timing of the project was as promised.",Managing Director,Computer Software,Used the software for: Less than 6 months
hackrate,An ethical hacking platform with a great price-value proposal,The legal team of Hackrate was helpful during the whole process.,Zsuzsa S.,5.0,"February 14, 2022",They provide 3 different services that are fitting for any company size. The Hackrate Team responded promptly to the upcoming questions.,"They provide Jira integration, but Slack would be useful too.",Key Account Manager,Computer & Network Security,Used the software for: 6-12 months
hackrate,Every digital business today needs cyber security experts that Hackrate can provide them with.,,Áron K.,5.0,"February 3, 2022","The simple user interface, and the effectiveness of the software.",There is no i would like less about Hackrate.,Information Security Professional,Computer & Network Security,Used the software for: I used a free trial
hackrate,Better choice than any competition,,Gabor I.,5.0,"December 20, 2021",Great team with outstanding support. Great hackers as well.,Nothing. Considering that the Hackrate is a a relatively new player on the market they deliver better than the competition.,CEO,Computer & Network Security,Used the software for: Less than 6 months
