product_id,review_title,description,author,rating,date,pros,cons,author_profession,author_industry,author_duration
tmetric,TMetric from the perspective of a Python developer,Our main business problem is managing remote work. TMetric allows me to do that easily and transparently.,Adrian G.,5.0,"August 24, 2022",I like the fact that there are so many features! The add-on for Firefox is very solid. This allows me to create tasks from within Asana for example. I like the fact that I can easily track my time working.,"It's a bit intrusive sometimes, but this can be configured.",Software Developer,Information Technology and Services,Used the software for: 6-12 months
tmetric,Easy to use and customize time tracking tool,,Jonathan N.,4.0,"August 19, 2019","The relatively unofficial API support for the product is very through; if there isn't a first party support already built in for the tools we use, Browser Extension enabling ZenDesk Support, then we have some flexibility to build up additional solutions to integrate TMetric into our work flow. It's easy to create a budget for a project that can be assigned to either time or a monetary value. Time is linear, and cannot overlap; so if you need to go back and change your time because it wasn't tracked properly, you don't need to worry about readjusting all entries to make sure you're not double billing a client.","The project selection tool starts to get slow to load when you have a lot of projects in the system. The desktop application hasn't always been that reliable (crashes, the window opening) although I still run it in the background to monitor what I'm working on, so I can go back and review it at any time. Because time doesn't overlap it is relatively easy to accidentally overwrite a days worth of entries if you accidentally meant to make your start time of an entry to 3:00 PM, forgetting to add the ""PM"", and the system defaults to 3:00 AM, and giving you a quick ""are you sure message"".",Sr. System Engineer,Information Technology and Services,Used the software for: 2+ years
tmetric,A review of TMetric by the Creative Director of a Marketing Agency,"I've been using it for around a year now and, like I say above, it's mostly fine and easy but with a couple of bugs or areas of badly designed UI or UX. The page design and colour scheme and UI do feel a little dated and not quite slick enough perhaps?",Verified Reviewer,3.0,"April 26, 2019",I like it's simplicity - both in looks and function. Once the browser extension is installed you can time track tasks straight from Asana or manually add the time yourself - both methods are relatively quick to do. I like that you can view reports of how you've spent your time - on what projects and clients. Very useful for administrators and accountants.,"It often crashes, breaks or bugs out, leaving myself and my team unable to track our hours in the software. It only breaks every three weeks or so, but I suppose I did expect it to work ALL the time. The other thing that is very annoying is when you are manually entering your hours and they start in AM and finish in PM. The slightly-clunky-to-use clock interface does not automatically guess that you meant PM and ruins all the hours you've already entered that morning by setting the last task as finishing at 12.45AM! The analogue clock face interface used to enter times is a little annoying - it has to be clicked or pressed in the right order and very accurately. It is easy to accidentally leave a timer tracking - even overnight. Perhaps there could be some way to counter this?",Creative Director,Marketing and Advertising,Used the software for: 6-12 months
tmetric,Great value - time tracking,Overall very satisfied.,Joshua J.,5.0,"May 18, 2022","TMetric is exactly what I was looking for as my business continues to grow. I manage multiple business clients and frequently get interrupted or have to switch between tracking time for each client as a phone call or email comes through. TMetric let's me easily switch to a different client and then resume what I was working on previously. It also makes billing my clients easy, as it syncs with Quickbooks Online.","I would like to see more options in reporting. It would also be great to see what my billable hours/balance is for the month in a report, but the only option is per each week.",Owner,Professional Training & Coaching,Used the software for: Less than 6 months
tmetric,An easy way to control your time,Very happy with this tool that allows me to keep track of my work and billing situation reporting times and projects.,Cláudia F.,4.0,"February 5, 2024","It is easy to use, has the possibility to add members and manage different levels of access to the information (teams)",The mobile app is still a little bit under developed.,Architect,Architecture & Planning,Used the software for: 1-2 years
tmetric,Great for freelancers! Works well.,"Overall, I've enjoyed using TMetric, it far outperforms any other system I've used in the past and I'll definitely be sticking with it for the long haul.",Charlotte N.,4.0,"August 19, 2019",I love that I can track time for multiple clients with just a few clicks. The end of the week summaries are perfect and allow for quick and easy invoicing without too much effort.,"The software can be a tad glitchy at times, but I've found that some patience and a quick refresh usually gets things flowing smoothly again.","Writer, Editor, Social Media Manager",Writing and Editing,Used the software for: 2+ years
tmetric,Time Tracking Made Easy ,We needed to see how long we were taking on specific tasks to determine if we were charging enough for our services.,Samantha G.,5.0,"August 19, 2019",I liked the straight forward interface which everyone learned quickly.,What I least like is that only admins can add people to projects. There are occasions when it would be nice to just have someone login their time on a project without having to be added to the whole team process.,CEO,E-Learning,Used the software for: 2+ years
tmetric,Great time tracker for freelance work,This is a great value for freelancers. When I realized the integration with quickbooks was not going to work in my particular set up I tried other free time trackers and quickly decided to just pay for TMetric even though I couldn't get the integration.,Melanie M.,4.0,"July 15, 2020",I like the ability to segment hours by client and then also tag the time with separate attributes that I can use to track certain projects within a customers work scope.,I originally chose this software for the ability to integrate with Quickbooks as a way to streamline my invoicing process each month. When I struggled with the integration I quickly realized I would have to upgrade my quickbooks account to take advantage of this feature.,Freelancer,Marketing and Advertising,Used the software for: Less than 6 months
tmetric,Best timetracker I've found,My time tracking is more accurate now than ever. I'm not having to fabricate time entries when they were missed.,Samuel S.,4.0,"August 5, 2019","App provides a solid set of ways to start timers (Chrome extension, web app, mobile app) but if you forget to start the timer, which I often do, the desktop activity monitor makes it so easy to fill in the blanks.",It could have a prettier UI. The PC app in particular. And the PC app could have features allowing a timer to stay on screen in an unobtrusive way.,Administrator,Non-Profit Organization Management,Used the software for: Less than 6 months
tmetric,my sepia review,It's easy to use and It helps to see how much time your team spend un each Project and each tag,Marcos C.,4.0,"July 15, 2020","The time tracking, It helps a lot and I like too the easy to use the platform, although the usability can be improved.","The reports, i would like It to be more peronalized",Art Director,Design,Used the software for: 1-2 years
tmetric,TMetric - Great app!,"Effective and simple tool for tracking work time,enabling tracking reminders and user activity recording",Roberto R.,5.0,"October 17, 2024",Friendly to use! I have tried successfully the free version!,I have no negative comments regarding TMetric,Managing Director,Mechanical or Industrial Engineering,Used the software for: 1-2 years
tmetric,Great but missing features,"Tmetric is very basic, reporting is poor and not configurable. While it tracks time it cannot track resource utilization, project burn, costs (vs price). Tmetric support is responsive however their reply for most of the enhancements is “it doesn’t do that” which means I need to find a product that wants to improve and provide the customer experience we need.",Marie J.,4.0,"August 22, 2019","So I use this for all employees billable or not. It is great for internal usage but it is a lot of work to transfer to an invoice for a customer. On average each employee spends two hours each week. It doesn’t track expenses, car mileage, or receipts on an account so we have to use multiple applications to get one invoice out each week. I like that I can put in each contract assign the hours to each employee but it doesn’t do burn sheets so again I need another tool. As for tracking time it’s just okay. It’s great when it work automatically on the computer. It does a great job at tracking idle time but tends to crash when in a project monitoring activity. While all apps crash the issue is you don’t know this one has because it’s hidden until you want to do a different task and then you’ve lost all your tracking. Oh there is a feature to allow customers access but I would never do that without the ability to configure it to show the customer what I want",Reliability and stability are the least favorite things,COO,Information Technology and Services,Used the software for: 1-2 years
tmetric,TMetric has improved my overall productivity and speed of billing,"Been using for about 18-19 months, and is has greatly improved my productivity, my ability to manage clients and projects, and GREATLY expedites my billing process and overall time spent tracking and billing time. These days, I'm click click done, instead of compiling time on spreadsheets or even trying to remember what I'm working on. I'm focusing more on the work and less on tracking it all.",Ron P.,5.0,"July 15, 2020","The features it offers are robust enough to support a basic production environment (clients, projects, adjustable billing rates, compatibility with other software), yet is much easier and simple to use than some highly robust and involved enterprise billing systems. It's perfect for a small service business like mine. But my absolute favorite feature is the ability to use the timer to start/stop/start project work on the fly. I can bounce from project to project and simply use the timers to track the work over the course of a hectic day.","Earlier on, there were some features that seemed a bit under developed, but those features have been upgraded and evolved, and has much improved an already good software. (i.e. client icons/avatars)",Advertising Media Planner,Marketing and Advertising,Used the software for: 1-2 years
tmetric,Good value for the price.,Overall it's been pretty easy to use and does what I need it to do. I would recommend it. Great value for the cost.,Stacy M.,4.0,"July 15, 2020","I really like the reports function. You can see time, billing, and other details in many different ways. Easy to use and gives insights you might not otherwise be able to see. You can add really detailed info about time entries. Integrates with trello nicely.","If I a click a project as billable after the project has been started any time spent on the project before that is not counted as billable. Only the admin can click something as billable which is a problem because sometimes I want the designers to enter projects but they can't unless I give them admin status. If they enter it then I have to go back click all their time as billable. There are a couple things I wish it did. Project management like trello, clock-in/clock-out per person and allow them to record time on individual projects through the day, better CRM there's no field for client phone numbers, email or details.",Owner,Design,Used the software for: 1-2 years
tmetric,Fundamental,"It's a must to have time tracker for teams, I know if a I'm being productive or not. I can share the log with my team and make adjustments. I can estimate better the next jobs and provide the ideal due time to clients and to the board.",Vinicius A.,4.0,"August 19, 2019","The product has improved a lot since they started. It's simple to use but full of features, as you can read in others feedbacks. I don’t need to edit all stuff, it knows where I’m am and what a I’m doing. I just need to add a title and labels and Tmetric supply me with a day or week relatory as I wish. The interface is easy to use, quick to learn, very easy to visualize the informations and the interactions respond instantly without delays.","Too much grey in the UI (but I’m a designer so maybe not the focus group user) It's just a time tracker after all, I have to use other tools for other kind of work management (so I have to end up to administrate a lot of tools at time).",Designer,Computer Software,Used the software for: 1-2 years
tmetric,Manage team members' hours on company projects,"It integrates my personal and team workflow considerably well, making it easy to categorize time and keep all project tasks on time.",ALEXANDER F.,5.0,"January 29, 2020",• Integration with several fermenters that we use as Jira and Tello. • Has the function of exporting to spreadsheets in .csv format. • Provides mobile application. • Very good cost benefit. • It has great usability and option to use tags. • It makes it much easier to track my team's work.,"Occasional failures or loss of service without warning or apparent reason. The desktop application is a little complicated. Exporting reports to Google Drive takes a little bit of work. Navigating through different tasks is a little bad. At first, I found it difficult to visualize the time that my colleagues took on each project.",Customer Success Manager,Computer Software,Used the software for: 6-12 months
tmetric,"An exemplary time tracking app, long live Tmetric!","I'm solving the problem of time tracking/time sheets for myself within our organization. Previously i was jotting down time on scraps of paper/notebooks and then had written my own app in VBA inside excel, but it was clunky and did not total up time on projects. Tmetric's reporting is very helpful in tracking time spent per project.",Garreth T.,5.0,"July 29, 2020","With Tmetric, i like the simple integration with other task managment platforms such as todoist. The way time is tracked is simple and it's fast and easy to input data about each project and task being worked on such that it becomes part of your flow","The page to add projects is a little bit clunky in terms of the order of data entry - i want to enter project ID first, then project title. ALso it would be useful to directly enter clients from the add project page.",Mechanical Engineer,Construction,Used the software for: 1-2 years
tmetric,A real time and money saver.,"With TMetric all billable time is captured, leading to an increase in revenue.",Tim H.,5.0,"July 15, 2020","Time tracking is easy with TMetric- it provides helpful reminders to start tracking, pause tracking and switch tasks, which can help users keep their tracking accurate. The software use reports (optional) helps give clients and administrators additional peace of mind that the time logged is accurate and focused time. Linking to Quickbooks is a real time-saver, enabling time to be easily and accurately invoiced. With TMetric all billable time is captured, leading to an increase in revenue.","Some of the user interfaces is slightly out-dated in the desktop app, but this does not impact use, and the web-app is easy and clean to use.",Deirecotr,Education Management,Used the software for: 6-12 months
tmetric,Customer Service Representative,So far tmetric is one of the easiest project timer,Jessamae G.,5.0,"May 15, 2023",easy access and easy to check the progress of your task,"we cant edit our time easily, hard to check the screenshot of our activity also it will stop all of a sudden if the courser is not moving",Telemarketer,Outsourcing/Offshoring,Used the software for: 1-2 years
tmetric,My experience has been very satisfactory with its reports and control of time spended in my projects,,Edward R.,4.0,"May 8, 2017","I like and enjoy the reports because are very detailed, for example I can see the statistics of my partners when we worked in many subtask of a big activity and I can know when we spend longer than estimated.","Well I think that isn't easy the installation, it can be more simply, for now it's the only thing that i see with this software.",proyect leader,Used the software for: 1-2 years,
tmetric,Helped me to spend less time on accounting,I have to account for my time amongst some projects and report back times spent. TMetric's browser plugin makes this accounting a very easy and time-saving effort.,Attila N.,5.0,"August 5, 2019","The best part is multi-device integrations, you can use your phone and browser plugin and they are all in sync. I also like that the browser plugin can fetch data from the current context (like adding a button to a Jira ticket and filling up everything when you click on that). Hm, no, the best part is for basic accounting the free version is enough. And if you need more features, you can always opt-in to the paid plans. But frankly, the existence of the free option made me to start using it.",It would be nice if the browser plugin (firefox) could do search as you type (for searching past tasks).,Senior engineer,Information Technology and Services,Used the software for: 6-12 months
tmetric,Time tracking essentials without the bloat,"After another free time tracking app we used completely overhauled their UI in favour of providing lots of features we didn't really need, we went to look for an alternative solution. We stumbled upon TMetric, a new time tracking app seemingly still in its early stages. This is great because the team behind it clearly focused on the essentials first without bloating the software with feature creep. The core interactions required for a time tracking app are all very polished and unlike the competitor products. I personally really like the timeline and seeing my logged work hours and breaks so visually. It's also really intuitive to add breaks or worklog items after the fact. Integrations with common project management software are plentiful and the one I used so far works seamless ly (GitLab). The only shortcomings are in the billing rate options, these are still very basic so having multiple different rates depending on task type etc is not possible yet (as far as I know). However, Devart has a support portal where they are reasonably active and you can request features there.",Xander W.,5.0,"February 7, 2017","Very simple and intuitive, visual timeline for your worklogs and breaks",Billing rates are very basic (only one rate for your account and a team member rate),UX Engineer,Computer Software,Used the software for: 6-12 months
tmetric,Perfect tracking solution,I had a couple of very small problems with it within my years of using the app. Everytime I submitted and tried to contact the support they were friendly and patched things up real quick- Even though I was a free user. I wouldn't trade this app for the world!,Marijan G.,5.0,"August 19, 2019","There is a lot that TMetric has to offer but for me two things stand out: 1. The ability to track time: you have various plugins (desktop,in browser) or you can just go to your in app and track tiime. Also it even easier to track time with various tools: asana, jira,trello etc. It adds a task name also so you don't have to bother with that 2. Reporting: The reports are great. When I send my clients the reports on the end of the month they are very pleased. also it is great overview to monitor your self progress.",The when having subtasks on Trello it would be usefull to get the names of the parent task as well as the subtask,Developer,Information Technology and Services,Used the software for: 1-2 years
tmetric,A simple Time tracker.,,Verified Reviewer,5.0,"May 29, 2019","Signup is very easy and no hassle to set it up with trello. It is a simple time tracking application which has a lot of bonus feature to see. I started creating a project and adding todos, it is really not the way but I need to check my time. The reporting is nice and easy. I must say I am impressed with the timeline. The desktop application gives me convenient to work offline but still track my time. Adding manual time to the backlog is smooth and fast.",Not really. everything workes fine for me and manual time adding is work without any trouble. The UI is old school but I like retro looks so it is fine for me.,Online Trainer,E-Learning,Used the software for: Less than 6 months
tmetric,Easy integration with Asana,I have bi-weekly reports that need to be updated with the time spent on my projects for a certain application. Tmetric makes it so easy with the detailed report I can extract as a csv and then summarize by project and get the latest worked-on date!,Michelle M.,5.0,"July 15, 2020","Can set up my tasks with tags in Asana and easily press the ""start timer"" button to charge my time to that task. With a new application, was easy to run detailed reports to see how much time was spent in each section of the new application.","Nothing at this time, the features I needed for my reporting are all available",District Programmer,Education Management,Used the software for: 1-2 years
