product_id,review_title,description,author,rating,date,pros,cons,author_profession,author_industry,author_duration
oracle_taleo_cloud,Taleo for Recruiting,"My experience with Taleo was middle of the road. I think it's good enough, I wouldn't tell everyone to buy it but it does the job.",Tiffanie R.,3.0,"January 30, 2020",Taleo was the first ATS I used and I thought it was very easy to learn the ins and outs. It wasn't an overly complicated platform and if I needed to find a candidate or process it was very straightforward.,"Taleo is not the most robust system. You're not going to get all the bells and whistles and it's not going to be the tool you rave and tell all your friends about, but it gets the job done and it's fairly intuitive. Sourcing for candidates is very difficult though.",Sourcing Specialist,Information Technology and Services,Used the software for: 2+ years
oracle_taleo_cloud,Big Companies need Giant software,,Hani S.,4.0,"January 9, 2023","Oracle Taleo help you to mentor your team and make your day more easy as keep all report for each one in and out ,and in that way give you the control system on who under your charge, the software help head of department to eliminate paper work to be in one day only as help you in evaluation every person individually","I think the platform is so hard to handle and to know how it's use, and report must be configured at beginning. the implementation maybe be long and hard in beginning , however i think it is worth.",accounting manager,Pharmaceuticals,Used the software for: 2+ years
oracle_taleo_cloud,Oracle Taleo Cloud,,Brayden Z.,3.0,"September 24, 2024",1. It has a lot of features to support recruitment 2. easy to use and user-friendly 3. highly secure,Tot as innovative in terms of new features and updates compared to some of the newer competitors in the market,HR and Project Management Specialist,Banking,Used the software for: 1-2 years
oracle_taleo_cloud,Excellent HR Tool,"Great integrations, feature-packed, and makes us more efficient. Highly recommended.",Jake C.,5.0,"October 25, 2019","We can keep tabs on applicants. Monitor their progression from initial evaluation, hiring, and building skills. Encompasses just about all of the human resources processes. The price is great for the features you get. We love having the employee paperwork all filled in before a new hire even steps foot into the office for their first day. Nobody likes paperwork. This software definitely improves our onboarding process, making us much more efficient. The integrations also allow our department to save time managing employees. Having things like our background check service integrated is great.","Needs an integration with payroll. Not the easiest software to deal with (it's Oracle...). You'll have that with software that is powerful, though. Still, could use some improvements for ease of use. Navigation could be improved.",ecommerce analyst,Internet,Used the software for: 6-12 months
oracle_taleo_cloud,Excellent For Applications and Resumes,"Even though the initial set up is long, subsequent applications are easy and breezy since all your information is already in there. When I was looking for a job, there were a ton of companies that used this for their application process- a lot of quality companies and positions too!",Shilleah S.,5.0,"June 14, 2019","I loved, loved, loved that it stored my resume and job application information and was easy to submit to multiple positions within individual companies.","The first time you apply to a job listing, it takes SOOOO LONG to enter all the information. Also, each business requires you to re-enter or upload your information, but once it IS in there, you can easily apply to multiple job listings!",Sales and Marketing Manager,Consumer Services,Used the software for: 2+ years
oracle_taleo_cloud,A Cumbersome Tool,,Jennifer P.,3.0,"August 9, 2023",I like that all candidate data and metrics are housed in one place.,The tool is not very intuitive and is very hard to navigate and source and search profiles.,"Sr Strategist, Talent Programs",Hospital & Health Care,Used the software for: 2+ years
oracle_taleo_cloud,Outdated system with poor functionalities,"The system really feels outdated in 2023 and one can feel it while navigating, loading and pulling data.",Chris D.,2.0,"November 27, 2023",It was hard for me to tell which feature I liked,"speed of data pulling and loading, lack if intuitiveness, filtering",Lead Specialist Talent Acquisition Marketing,Staffing and Recruiting,Used the software for: 6-12 months
oracle_taleo_cloud,I utilize Taleo for full-lifecycle recruiting,It captures and organizes a huge number of applicants,Lily S.,3.0,"November 22, 2017",Taleo is relatively easy to use and has a broad range of functionality. It is also extremely customizable.,"The user experience leaves something to be desired, it feels outdated. Taleo is not particularly intuitive, and needs stronger integration with other HR systems",Corporate Recruiter,Used the software for: 2+ years,
oracle_taleo_cloud,Lots to be desired from end user of performance review,,Jeremy S.,2.0,"December 15, 2017",I do like that I can see all the reviews from the cycle online. And being able to track status online too,The formatting for adding comments on performance reviews is not friendly; it allows for text only. There is NO formatting available.,"Manager of Analytics, Customer Operations",Computer Software,Used the software for: 2+ years
oracle_taleo_cloud,Accuracy is awesome,,Obumneme O.,5.0,"March 6, 2018",I loved the correctness of its reporting and how easy it is to communicate with the HR through resume submissions. I love the feature of having to accept applicants via the software.,"not user-friendly when you want to create reports. Overall it's a good platform, the reporting platform can be overwhelming at times.",Engineer,Used the software for: 6-12 months,
oracle_taleo_cloud,Great functionality ,Have been using this program for several years and find it easy to use.,Vickie V.,5.0,"October 11, 2023",Fairly easy to use with some tutorials. Customer interaction is seamless.,Some of the overview of HR is not seen on the user interface side and it is sometimes difficult to find errors.,District Manager,Retail,Used the software for: 2+ years
oracle_taleo_cloud,"Maintain Jobs and position control list, and applicants","used to post jobs for the college, review applications, to send offer of employment, and onboard the hires",Verified Reviewer,5.0,"August 19, 2021","I liked being able to set-up specific forms for the specific classification of employee. I liked having everything in one place for for the recruitment cycle, the job posting, applications, and the HR forms required after hired to initiate the onboarding process is very nice. You can upload contract and have applicant sign electronically to agree and maintain its records all in one place.",I don't really have any complaints the system was fairly easy to use.,Senior Payroll Generalist,Education Management,Used the software for: Less than 6 months
oracle_taleo_cloud,"Slow, Flash based",,Verified Reviewer,2.0,"October 11, 2017",Reporting metrics are helpful but could be more conclusive and could be more filters available. Application information is not easily printable for those that refuse to use a computer to view.,"Interface is dreadfully slow, it is built in flash which is outdated and unable to access from apple ipads, iphones which is difficult to manage at career events and providing instant feedback to potential applicants.",Workforce Planning Bureau Chief,Government Administration,Used the software for: 2+ years
oracle_taleo_cloud,Easy to use but too pricey to be the best ,Better value elsewhere if you don't need Oracle Software for recruiting,Ty M.,4.0,"May 7, 2018",It is an Oracle product so it implements and snycs with existing software well. Being experienced with other Oracle Software I felt the look of the landing page was positive and it was easy to get around the site!,"The Price is very high especially if you want ""full features."" Felt a little nickled and dimed to get all the features we wanted. Salesman was honest but it was frustrating",Owner,Human Resources,Used the software for: 1-2 years
oracle_taleo_cloud,Better for recruiters than candidates,,Verified Reviewer,4.0,"April 11, 2018","fairly configurable, good candidate management options for users. ability to screen and prioritize candidates is helpful.","too few fields for candidates to filter; no option for candidates to 'search', only to choose from drop-down menu,",Senior Manager - Talent Management,Chemicals,Used the software for: 2+ years
oracle_taleo_cloud,Review of Oracle Taleo Cloud,"Over all, it is user friendly software and 90% it fulfills customer/users needs.Regarding highlighting of comments and notification, pop up message service shall be in place.",Muhammad Jamal A.,5.0,"January 2, 2023","Easy to operate and create log in account supported by admin teams.Easy to find out the processes, identify errors and reply from the relevant department.All notifications are easily accessible and trackable via email support.",Sometime comment or question raised by the line managers in the process are unable to see these are not highlighted properly and no pop up message receives.,Manager,Market Research,Used the software for: 6-12 months
oracle_taleo_cloud,Not very user friendly ,,Verified Reviewer,1.0,"January 16, 2020","The overall product features, and internal candidate search features including excel download.","The speed and user interface, it was very difficult to work on Taleo to perform simplest work like job posting or screen candidates because of slow speed.",Talent Acquisition Specialist,Market Research,Used the software for: 1-2 years
oracle_taleo_cloud,TM review,"Easy to learn, and navigate.",Theresa M.,5.0,"July 22, 2022","easier to use than the previous system. Less system interruptions, less system down time, faster.",I do not have any issues with this software.,Program Coordinator,Human Resources,Used the software for: 1-2 years
oracle_taleo_cloud,Good Tool for Performance & Recruitment,,Elizabeth S.,4.0,"August 16, 2021",I liked the fact that you can use it to manage employees performance and understand how they are doing day to day with the evaluation tools available,I did not like the different pages and the transition from one page to another,HR Manager,Machinery,Used the software for: 1-2 years
oracle_taleo_cloud,"Overall: I've been using Taleo since 2 years now, and it's the easiest to use and to navigate.","As a corporation, we were looking for a recruitment software and candidate management system that could safely store all our business data. Taleo certainly delivers on this front! It's an easy-to-use/user-friendly software with great customer service to back it up. I do recommend this product for businesses with 10-10,000+ employees who are looking for a cost-effective way to manage their recruitment process.",Basharat A.,3.0,"July 26, 2017","Easy to learn, user-friendly, great functionality and tools, excellent customer service & customer training.",Professional Services work- There is an opportunity to do customization to the product but would suggest waiting to see if needed. Customizations are usually where you will have issues when something breaks. The core product is always working but automations is where you may see failures.,Dy. Manager HRD,Oil & Energy,Used the software for: 1-2 years
oracle_taleo_cloud,oracle excellent program for the support of their databases ,good software,Verified Reviewer,5.0,"April 16, 2018","the best of oracle, is its massive capacity to contain and create such large databases, reliable and secure","I should have more tools, more accessories",operador,Used the software for: 6-12 months,
oracle_taleo_cloud,Taleo is a great talent acquisiton software. It isn't as flexible as some of the newer technology.,I don't know yet,Verified Reviewer,4.0,"October 11, 2017",I like the TCC use. Integrating between systems seems to be straightforward and user friendly most of the time.,"Paying by headcount rather than by user. We have employees who are not users, no access to system, but we pay for them per the contract.","Sr Mgr, Global HR Technology",Defense & Space,Used the software for: 2+ years
oracle_taleo_cloud, Cadillac of software ,A great product overall… Might be more than you need for a small organization,Verified Reviewer,5.0,"August 29, 2018","Looks great- intuitive interface, lots of bells and whistles",Implementation can be confusing if you don’t have professional services,Senior Director-IT,Retail,Used the software for: 2+ years
oracle_taleo_cloud,Taleo - old school HRIS,"Unfortunately, Taleo did not work for our environment as our configuration was not suitable for our recruiting environment. It definitely can handle process and checks/balances in the recruiting workflow but wasn't very dynamic is storing/sorting/cultivating candidates.",Twila A.,4.0,"April 5, 2018",Taleo is definitely geared to large enterprises with data storage needs. The integration with financial software is well established.,The architecture is very restrictive. The recruiting software isn't very configurable without patches that may nor may not work. Such a large system does not make changes/updates very often or quickly.,HR Manager,Primary/Secondary Education,Used the software for: 1-2 years
oracle_taleo_cloud,Very Detailed and in depth recruiting tool,"I used this system as a recruiter for a major trucking company -- Taleo is a great product for storing, managing, and reviewing potential recruits. Job postings are simple enough and allow for quite a bit of in depth detail if needed. From the job seeker side, it is a typical long drawn out process to fill out, and it does lack abilities to pull in correct data from Resumes when loaded. That being said, it is still easy enough to navigate and review even from the recruit side.",Scott C.,4.0,"April 12, 2017",In depth and very robust in functionality,Does not do a great job of grabbing correct data from uploaded resumes.,Driver Operations Manager,Transportation/Trucking/Railroad,Used the software for: 2+ years
